Score,SuperPath Name,# SuperPath Total Genes,# SuperPath Matched Genes,Matched Genes (Symbols),Evidence URL
49.83,Gene Expression (Transcription),1543,161,"LRPPRC, ZNF154, HAND2, POLR1B, DR1, ZNF699, ZNF701, ZNF549, ZNF550, ZNF551, ZNF557, ZNF561, ZNF562, ZNF704, ZNF708, PTPN1, RANBP2, TXNIP, BRD2, TOPBP1, NUP62, FBXO32, GTF2H5, CCNB1, POLR2E, TNKS1BP1, GATAD2A, VEGFA, MDM4, MYC, ZNF268, ZNF28, BRPF1, GLI2, ZNF385A, ZNF394, HSP90AA1, TACO1, U2AF2, PHAX, BTG2, CCNK, TAF1, ZNF570, ZNF573, ZNF585B, ZNF589, HCFC1, CSTF1, CSTF2, NCOR2, SFN, HSPD1, ZNF711, DNA2, ZNF282, UBE2D1, UBE2I, TP53, AGO2, ZNF611, KMT2A, ZNF621, KMT2B, KMT2D, COMMD3-BMI1, CBX3, RBBP5, EP300, MAPKAPK5, GEM, PCGF5, CHEK1, CHEK2, ZFP30, BBC3, ZNF641, USP9X, YAP1, ZNF426, SMAD2, ZNF440, YES1, RBM8A, COX6B1, OGT, COX8A, SUMO1, TAL1, TCF3, H2AC8, FOS, H2AX, HUS1, YWHAE, PRELID1, DDIT4, E2F4, RBX1, H2BC15, H2BC21, YWHAZ, YY1, H2BC5, SUV39H1, SUZ12, ZNF764, RFC5, JUN, JUNB, H3-3B, TDRKH, RRN3, DDX39B, ZKSCAN3, MAF, ZNF799, PABPN1, ACTB, GPI, TARBP2, KCTD15, SEM1, PPARA, PIN1, PAGR1, SRRT, ZNF662, IL2RA, ZNF347, EED, TET3, ZC3H11A, TFAP2B, RICTOR, ZNF486, ZNF490, NFIB, ZNF12, TGFA, NFIX, ESRRB, SIN3A, RYBP, FZR1, G6PD, BMI1, RPA1, CALM2, H4C3, CAMK2A, SKI, MLH1, MLLT1, DGCR8, CDK4, SNRPD3, PAX5, DYRK2, CDK6, CDK9",https://pathcards.genecards.org/card/gene_expression_(transcription)
33.16,Infectious Disease,1818,163,"SLC5A5, MUC17, MAP2K1, MAP2K3, MAP2K4, SLC12A6, LARP1, NCKAP1, MAP2K7, STAT5A, THSD4, RANBP2, TXNIP, TOPBP1, NUP62, TAB1, B2M, GTF2H5, ABCC6, CCNB1, POLR2E, CEBPD, RPL14, GATAD2A, VEGFA, SAR1B, MYC, FGB, PTPN6, SPCS3, HSP90AA1, FGF1, GCLM, FGF19, HSPA1B, CCNK, TAF1, TIRAP, B4GALT7, ANTXR2, FGF9, NCOR2, SFN, RPL22, TLN1, DNA2, HHAT, FGFR4, UBE2D1, UBE2I, TP53, AGO2, MED28, ABI2, SLC24A4, CEP43, ENTPD5, UBE2V1, GNAI2, RPL24, NLRP12, AP2M1, ACACA, EP300, KPNA1, GEMIN2, GEMIN4, AGTRAP, GNB2, GNG12, RPL41, AHCY, KREMEN1, SPON2, XRCC6, APH1A, RNF185, SMAD2, SLC33A1, HLA-A, HLA-B, HLA-C, YES1, H2AC12, SUMO1, H2AC8, H2AX, HUS1, GP5, ATIC, MSN, YWHAE, CHST6, E2F3, RBX1, H2BC15, H2BC21, YWHAZ, H2BC5, PRELP, SUZ12, GPC4, MYO10, RFC5, JUN, JUNB, MYO18A, H3-3B, MGAT5, ATP1A2, TPST2, IL17RA, PABPN1, ACTB, AKT1S1, PDGFRA, TRAF3, SEM1, SHOC2, TRAF6, MC2R, ALG14, PPFIBP1, PAK2, CDC37, EED, ALG9, VAV3, IFNGR2, TPM3, RICTOR, VPS37D, FXYD1, TGFA, TRAT1, RPS15A, CYP11A1, SIN3A, WASF2, FZR1, PEDS1-UBE2V1, G3BP1, RPS16, GRB2, THBS2, ST6GAL1, RPA1, CALM2, CALR, H4C3, CAMK2A, CNBP, SLC5A2, MLH1, CDK4, HPRT1, POLA2, SNRPD3, CDK6, CDK9, MPRIP, RAB5B, CSK",https://pathcards.genecards.org/card/infectious_disease
32.47,Regulation of Activated PAK-2p34 By Proteasome Mediated Degradation,943,100,"MAP2K4, HAND2, MAP2K7, INO80B, BRD2, TAB1, B2M, PFN1, ABCC6, WEE1, CCNB1, VEGFA, TACC3, ABCF1, MDM4, MYC, GLI2, PTPN6, ZNF385A, HSP90AA1, ELAVL1, HSPA14, KLHL12, HSPA1B, HCFC1, DAB2IP, DNA2, HHAT, RASGRP3, UBE2D1, UBE2D2, UBE2G1, TP53, AGO2, HHIP, UBE2V1, AP2M1, EP300, MAPKAPK5, TNPO1, GNB2, GNG12, CHEK1, CHEK2, ZFP36, XIAP, DCP2, APH1A, RNF185, YAP1, HLA-A, HLA-B, HLA-C, YES1, H2AC12, OGT, REL, H2AC8, FOS, H2AX, E2F4, RBX1, GINS3, YWHAZ, YY1, CD3D, CD3E, FOXK1, RFC5, JUN, MAF, ACTB, ORAI2, TRAF3, SEM1, TRAF6, PRKG2, RHOA, PAK2, VAV3, CDC6, SMOX, AMD1, NFKBIB, FZR1, PEDS1-UBE2V1, KHSRP, GRB2, RAC3, RPA1, CALM2, CALR, ATXN2, MCM8, CAMK2A, KIF3A, CDK4, POLA2, POLD3, FBXL18",https://pathcards.genecards.org/card/regulation_of_activated_pak-2p34_by_proteasome_mediated_degradation
31.17,Signal Transduction,2597,212,"MAP2K1, ARL4C, NHS, ADM, NCKAP1, STAT5A, AXL, PTPN1, EIF4EBP1, RANBP10, RANBP2, TAB1, PFN1, WDR91, TIAL1, DIAPH1, LRRC1, POLR2E, GATAD2A, VEGFA, PTPN3, TACC3, MDK, MYC, NPY4R, FGB, GLI2, PTPN6, SPC25, HSP90AA1, FGF1, TACR3, PTPRF, CENPA, F2R, FGF19, KLHL12, CENPN, CCNK, ZDHHC21, MYH11, DAB2IP, FGF9, NCOR2, SFN, TLN1, HHAT, RASGRP3, OTUD7B, FGFR4, UBE2D1, UBE2D2, TP53, DTX1, RND2, AGO2, ABI2, HHIP, KMT2D, COMMD3-BMI1, GNAI2, DBN1, RBBP5, AP2M1, BAMBI, EP300, CEP97, RBCK1, OCRL, SCD, MAPKAPK5, LTBP4, GNB2, GNG12, FAM135A, CHEK1, KREMEN1, XIAP, USP9X, TRIB1, SOX4, GFRA1, FMNL3, PXN, APH1A, YAP1, SPPL2A, LETM1, SMAD2, YES1, CTTN, PYGO2, UHMK1, MOB1A, H2AC8, SMAD5, FOS, BCAR1, H2AX, SH3PXD2A, YWHAE, FOSL1, E2F3, E2F4, RBX1, H2BC15, H2BC21, RCC2, RCE1, GIPC1, SPRY1, YWHAZ, YY1, H2BC5, CPT1A, SUZ12, JUN, JUNB, JUND, H3-3B, H3-4, DDX39B, TAOK1, CXCL8, PSAP, PLEKHG3, TRA2B, ACTB, AKT1S1, PDE3A, ULK1, PDE4C, PDE4D, RDH11, PDE7B, SHMT2, DOCK11, RGS5, PDGFRA, SEM1, PIN1, SHOC2, TRAF6, MC2R, PRKG2, CLASP1, PDK3, RHOA, PAK2, RTN4, CDC37, IL2RA, EED, VAV3, PMEPA1, GPR20, GPR27, HNRNPC, TPM3, PEA15, PEAK1, RICTOR, NAB2, ATP6V0E1, CLIP1, TFRC, TGFA, TRAT1, EFHD2, ARHGAP15, ARHGAP18, ATP6V1F, SIN3A, ARHGAP29, ESYT1, ARHGAP31, ARHGAP39, WASF2, IL6ST, BMI1, BMPR1A, GRB2, RAC3, RACGAP1, THBS2, PTBP1, CALM2, ARHGEF18, H4C3, CAMK2A, SKI, AMH, ANGPTL3, KIF2C, KIF3A, ZWINT, S1PR2, GRM5, TULP3, LAMC1, CDK4, CCL16, SAA1, INHBA, CDK9, ARL13B, PYGO1, PAK4, MEF2D, CSK, WNT16, ITGB8",https://pathcards.genecards.org/card/signal_transduction
30.74,Cellular Responses to Stimuli,819,89,"MAP2K3, CAPZA1, CAPZA2, RAI1, SZT2, LRPPRC, MAP2K4, MAP2K7, HDGF, HSBP1, RANBP2, TXNIP, NUP62, CEBPG, RPL14, VEGFA, MDM4, MYC, HSP90AA1, TACO1, HSPA14, GCLM, CASTOR2, HSPA1B, HSPA4L, NCOR2, RPL22, TLN1, PHB2, BACH1, UBE2D1, UBE2D2, CHAC1, TP53, COMMD3-BMI1, RPL24, EP300, MAPKAPK5, FKBP14, RPL41, DCP2, H1-4, DCTN6, UBXN7, COX6B1, COX8A, DNAJA2, YME1L1, H2AC8, FOS, H2AX, YWHAE, E2F3, RBX1, H2BC15, H2BC21, H2BC5, SUZ12, JUN, H3-3B, H3-4, CXCL8, MAFK, AKT1S1, CREB3L2, ACTR1A, TERF2, ERO1A, SEM1, PPARA, SRPRB, KDM6B, EED, ATP6V0E1, ATP6V1F, RPS15A, SIN3A, FZR1, G6PD, BMI1, RPS16, KHSRP, RPA1, CALR, H4C3, CAMK2A, CDK4, CDK6, MEF2D",https://pathcards.genecards.org/card/cellular_responses_to_stimuli
29.53,MAP Kinase Signaling,113,26,"MAP2K1, MAP2K3, MAP2K4, NIBAN2, MAP2K7, TAB1, RASD1, SFN, RASGRP3, MAPKAPK5, RPS6KA4, YES1, FOS, YWHAE, FOSL1, FOSL2, SPRY1, YWHAZ, JUN, JUNB, JUND, SPAG9, SHOC2, PEA15, CAD, RAC3",https://pathcards.genecards.org/card/map_kinase_signaling
28.89,Metabolism of Proteins,2077,175,"MUC17, CAPZA1, CAPZA2, FBXL4, NICN1, TNIP2, LARS1, INO80B, THSD4, EIF4EBP1, RANBP2, FEM1A, FEM1C, NUP62, TAB1, B2M, B3GALNT2, FBXO32, THY1, CCNF, RPL14, SAR1B, MDM4, MYC, TIMM10, SPCS3, TIMM17A, MRPL12, U2AF2, USP12, KLHL11, TIMP1, KLHL21, B4GALT5, OTUB1, HCFC1, USP22, NCOR2, RPL22, HSPD1, OTUD7B, UBE2D1, UBE2D2, UBE2G1, UBE2H, UBE2I, TP53, ASB16, HIC1, PPP6R1, LSAMP, COMMD3-BMI1, MRPL44, RPL24, COPS7B, MRPL9, MRPS10, RBBP5, ACAD8, EP300, UBE2Z, GNB2, GNG12, MRPS14, MRPS15, DCAF16, RPL41, DCAF7, MRPS16, NDUFV3, GFM1, USP9X, RNF152, MRPS23, ASPH, SPON2, METTL21A, APH1A, DCTN6, UBXN7, RNF185, YARS1, MRPS5, DDA1, SMAD2, HLA-A, FN3K, DDB1, H2AC12, UGGT2, OGT, SUMO1, YME1L1, YOD1, PIGP, H2AC8, FOLR1, H2AX, QSOX1, MSRB1, PRELID1, RNF40, RBX1, H2BC15, H2BC21, RCE1, YY1, H2BC5, SUZ12, RAB11B, NUCB1, FOXK1, H3-3B, MGAT5, TPST2, ACTB, ASB6, ACTR1A, ATP5F1A, PLET1, RAB14, SHMT2, TRAF3, SEM1, SRP9, PPARA, SRPRB, TRAF6, ALG14, RHOA, ALG9, TRAPPC2, HNRNPC, VCPIP1, SENP2, TFAP2B, SSR3, MCFD2, VWA1, TGFA, PMPCA, TTLL12, IGFBP4, RPS15A, SIN3A, FARSA, TTLL7, RAB8B, BMI1, TGOLN2, RPS16, VDAC2, THBS2, CLPP, ST6GAL1, ST6GALNAC1, RPA1, CALM2, CALR, H4C3, AMDHD2, ST8SIA5, MAN1C1, LAMC1, SAA1, INHBA, FBXL13, FBXL18, EIF1AX, RAB17, RAB15, RAB5B, CS, SRP19, RAB32",https://pathcards.genecards.org/card/metabolism_of_proteins
26.68,DNA Damage,296,43,"BRD2, TOPBP1, WEE1, CCNB1, CCNF, TACC3, CENPA, ARPP19, OTUB1, HCFC1, SFN, TP53, PHLDA3, CHEK1, CHEK2, XRCC6, APEX1, DDB1, FOS, H2AX, HUS1, YWHAE, DDIT4, RCC2, YWHAZ, YY1, JUNB, SPART, TERF2, PIN1, SMG1, CDC37, CDC6, CAD, MKI67, RPA1, MLH1, CDK16, CDK4, DYRK2, CDK6, CDK9, NEK7",https://pathcards.genecards.org/card/dna_damage
20.47,Pleural Mesothelioma,409,48,"MAP2K1, MAP2K3, MAP2K4, MAP2K7, MCU, EIF4EBP1, VEGFA, MDK, MDM4, MYC, FGF1, FGF19, SLC7A5, SETD5, HCFC1, FGF9, VGLL4, FGFR4, TP53, KREMEN1, BBC3, YAP1, OGT, MOB1A, FOSL1, YY1, SUZ12, JUN, CD47, ACTB, AKT1S1, ULK1, PDGFRA, PAK2, EED, SENP2, TGFA, EFNA1, EFNA3, EFNA5, BMI1, GRB2, MKNK2, LAMC1, CDK4, PAK4, MEF2D, WNT16",https://pathcards.genecards.org/card/pleural_mesothelioma
20.40,IL-17 Family Signaling Pathways,108,21,"MAP2K1, MAP2K3, MAP2K4, MAP2K7, TAB1, CEBPD, HSP90AA1, ELAVL1, REL, FOS, FOSL1, FOSL2, JUN, JUNB, JUND, CXCL8, IL17RA, TRAF3, TRAF6, NFKBIB, IL6ST",https://pathcards.genecards.org/card/il-17_family_signaling_pathways
20.05,RNA Polymerase I Promoter Opening,555,59,"POLR1B, DR1, B2M, GTF2H5, CCNB1, POLR2E, TNKS1BP1, GATAD2A, MYC, MYH11, HCFC1, NCOR2, SFN, TP53, AGO2, KMT2A, KMT2B, KMT2D, CBX3, RBBP5, EP300, KPNA1, USP9X, APH1A, YAP1, H2AC12, OGT, PYGO2, TAL1, H2AC8, H2AX, YWHAE, H2BC15, H2BC21, YWHAZ, YY1, H2BC5, SUV39H1, SUZ12, JUN, H3-3B, H3-4, RRN3, PABPN1, ACTB, KDM5A, PAGR1, KDM6B, RHOA, EED, TET3, SIN3A, H4C3, HOXD3, CDK4, POLA2, SAA1, ARID5B, PYGO1",https://pathcards.genecards.org/card/rna_polymerase_i_promoter_opening
19.93,Toll Comparative Pathway,101,20,"MAP2K3, MAP2K4, TAB1, ELAVL1, TIRAP, IRAK3, TP53, EP300, GNB2, FOS, FOSL1, FOSL2, JUN, JUNB, JUND, CXCL8, TRAF6, IFNGR2, NFKBIB, CALM2",https://pathcards.genecards.org/card/toll_comparative_pathway
19.39,Cellular Senescence,195,29,"MAP2K3, MAP2K4, MAP2K7, MDM4, UBE2D1, TP53, COMMD3-BMI1, MAPKAPK5, H1-4, H2AC8, FOS, H2AX, E2F3, H2BC15, H2BC21, H2BC5, SUZ12, JUN, H3-3B, H3-4, CXCL8, TERF2, KDM6B, EED, FZR1, BMI1, H4C3, CDK4, CDK6",https://pathcards.genecards.org/card/cellular_senescence
18.83,MAPK Signaling: Oxidative Stress,79,17,"MAP2K1, MAP2K3, MAP2K4, MAP2K7, SFN, TP53, USP9X, RPS6KA4, FOS, YWHAE, FOSL1, YWHAZ, JUN, JUNB, JUND, TRAF6, CAMK2A",https://pathcards.genecards.org/card/mapk_signaling_oxidative_stress
18.74,Signaling By Rho GTPases,722,70,"NHS, NCKAP1, RANBP2, PFN1, WDR91, DIAPH1, LRRC1, SPC25, HSP90AA1, CENPA, CENPN, MYH11, SFN, RND2, ABI2, DBN1, CEP97, OCRL, FAM135A, USP9X, FMNL3, LETM1, CTTN, H2AC8, H2AX, SH3PXD2A, YWHAE, H2BC15, H2BC21, RCC2, YWHAZ, H2BC5, H3-3B, DDX39B, TAOK1, PLEKHG3, TRA2B, ACTB, SHMT2, DOCK11, PIN1, CLASP1, RHOA, PAK2, CDC37, VAV3, HNRNPC, TPM3, PEAK1, CLIP1, TFRC, EFHD2, ARHGAP15, ARHGAP18, ARHGAP29, ESYT1, ARHGAP31, ARHGAP39, WASF2, GRB2, RAC3, RACGAP1, CALM2, ARHGEF18, H4C3, KIF2C, ZWINT, ARL13B, PAK4, CSK",https://pathcards.genecards.org/card/signaling_by_rho_gtpases
18.73,Signaling By Receptor Tyrosine Kinases,532,56,"MAP2K1, NCKAP1, STAT5A, AXL, PTPN1, RANBP10, TIAL1, DIAPH1, POLR2E, VEGFA, PTPN3, MDK, MYC, PTPN6, HSP90AA1, FGF1, PTPRF, FGF19, FGF9, FGFR4, ABI2, AP2M1, EP300, CHEK1, TRIB1, PXN, APH1A, YAP1, YES1, FOS, BCAR1, FOSL1, GIPC1, SPRY1, JUNB, JUND, ACTB, PDGFRA, RHOA, PAK2, CDC37, VAV3, RICTOR, NAB2, ATP6V0E1, TGFA, ATP6V1F, SIN3A, WASF2, GRB2, THBS2, PTBP1, CALM2, LAMC1, MEF2D, CSK",https://pathcards.genecards.org/card/signaling_by_receptor_tyrosine_kinases
18.16,TCR Signaling (Qiagen),238,32,"MAP2K1, MAP2K3, MAP2K4, MAP2K7, STAT5A, CACNG8, RASGRP3, SLC9A3, SLC9A4, FOS, FOSL1, FOSL2, CD3D, CD3E, JUN, JUNB, JUND, ACTB, PDGFRA, RHOA, PAK2, CACNA1A, VAV3, NFAT5, TRAT1, NFKBIB, GRB2, RAC3, CALM2, CAMK2A, PAK4, CSK",https://pathcards.genecards.org/card/tcr_signaling_(qiagen)
17.79,Regulation of TP53 Activity,362,42,"LRPPRC, TOPBP1, GTF2H5, CCNB1, POLR2E, TNKS1BP1, GATAD2A, MDM4, BRPF1, ZNF385A, TACO1, BTG2, CCNK, TAF1, SFN, DNA2, TP53, AGO2, EP300, MAPKAPK5, CHEK1, CHEK2, BBC3, COX6B1, COX8A, FOS, HUS1, YWHAE, PRELID1, DDIT4, E2F4, YWHAZ, RFC5, JUN, GPI, PIN1, RICTOR, G6PD, RPA1, MLH1, DYRK2, CDK9",https://pathcards.genecards.org/card/regulation_of_tp53_activity
17.36,Signaling By TGFB Family Members,124,21,"MYC, CCNK, NCOR2, UBE2D1, BAMBI, EP300, LTBP4, USP9X, SMAD2, SMAD5, E2F4, JUNB, RHOA, PMEPA1, BMPR1A, ARHGEF18, SKI, AMH, INHBA, CDK9, ITGB8",https://pathcards.genecards.org/card/signaling_by_tgfb_family_members
17.27,Sertoli-Sertoli Cell Junction Dynamics,393,44,"MAP2K1, MAP2K3, MAP2K4, NPR1, MAP2K7, MYH11, TJAP1, CSTF1, CSTF2, RND2, STX4, NECTIN1, NECTIN3, PXN, CTTN, FOS, BCAR1, FOSL1, FOSL2, RAB11B, MYO10, JUN, JUNB, JUND, MYO1F, ACTB, ACTN4, RAB14, PRKG2, RHOA, PAK2, LLGL1, CLDN12, CLDN16, RAB8B, RAC3, TUBD1, CDK4, RAB17, RAB15, RAB5B, PAK4, ITGB8, RAB32",https://pathcards.genecards.org/card/sertoli-sertoli_cell_junction_dynamics
17.21,"Tacrolimus/Cyclosporine Pathway, Pharmacodynamics",44,12,"MAP2K3, MAP2K4, MAP2K7, REL, FOS, FOSL1, FOSL2, JUN, JUNB, JUND, MAF, MAFK",https://pathcards.genecards.org/card/tacrolimuscyclosporine_pathway_pharmacodynamics
16.93,IL-1 Family Signaling Pathways,158,24,"MAP2K1, MAP2K3, MAP2K4, MAP2K7, TAB1, PTPN6, TIRAP, IRAK3, UBE2V1, EP300, REL, FOS, FOSL1, FOSL2, JUN, JUNB, JUND, CXCL8, TRAF6, RHOA, TGFA, NFKBIB, GRB2, MKNK2",https://pathcards.genecards.org/card/il-1_family_signaling_pathways
16.66,GPCR Pathway,712,67,"MAP2K1, MAP2K3, PPP1R10, MAP2K4, MAP2K7, STAT5A, HDGF, AXL, GTF2H5, CCNB1, CCNF, VEGFA, MDK, MYC, HSP90AA1, FGF1, FGF19, TIMP1, TAF1, FGF9, NCOR2, TLN1, PHB2, FGFR4, TP53, RND2, GNAI2, EP300, KPNA1, LTBP4, TNPO1, GNB2, GNG12, TBRG1, GFER, PXN, EPHB4, SMAD2, UHMK1, FOS, BCAR1, E2F3, E2F4, RCAN1, DDR2, CD3D, CD3E, JUN, PLD3, ACTB, PDGFRA, RHOA, PAK2, IL2RA, NFAT5, TGFA, NFKBIB, SIN3A, GRB2, RAC3, CALM2, CAMK2A, CDK4, MMP11, PAK4, CSK, ITGB8",https://pathcards.genecards.org/card/gpcr_pathway
16.58,MAPK Family Signaling Cascades,588,58,"MAP2K1, STAT5A, RANBP2, CCNB1, POLR2E, PTPN3, MYC, FGB, PTPN6, HSP90AA1, FGF1, FGF19, DAB2IP, FGF9, NCOR2, TLN1, HHAT, RASGRP3, FGFR4, TP53, AGO2, CEP43, EP300, MAPKAPK5, AGTRAP, KREMEN1, GFRA1, APH1A, SMAD2, YES1, ATIC, MSN, RBX1, RCE1, JUN, JUNB, MYO18A, ACTB, AKT1S1, PDGFRA, SEM1, SHOC2, PRKG2, PPFIBP1, PAK2, CDC37, IL2RA, TPM3, PEA15, RICTOR, TGFA, TRAT1, IL6ST, GRB2, CALM2, CAMK2A, MPRIP, CSK",https://pathcards.genecards.org/card/mapk_family_signaling_cascades
16.41,Assembly of The Pre-replicative Complex,314,37,"DNA2, UBE2D1, AGO2, KMT2A, KMT2B, KMT2D, COMMD3-BMI1, RBBP5, EP300, KPNA1, PCGF5, YAP1, TAL1, TCF3, H2AC8, H2AX, RBX1, H2BC15, H2BC21, GINS3, H2BC5, RFC5, H3-3B, SEM1, IL2RA, CDC6, SIN3A, RYBP, FZR1, BMI1, RPA1, MCM8, H4C3, POLA2, POLD3, PAX5, CDK6",https://pathcards.genecards.org/card/assembly_of_the_pre-replicative_complex
16.37,Regulation of Actin Cytoskeleton,151,23,"MAP2K1, NCKAP1, PFN1, DIAPH1, FGF1, F2R, FGF19, FGF9, FGFR4, ABI2, GNG12, PXN, BCAR1, MSN, ACTB, RDX, PDGFRA, RHOA, PAK2, WASF2, RAC3, PAK4, CSK",https://pathcards.genecards.org/card/regulation_of_actin_cytoskeleton
16.14,Cell Cycle Checkpoints,292,35,"RANBP2, TOPBP1, WEE1, CCNB1, MDM4, SPC25, ZNF385A, CENPA, CENPN, SFN, DNA2, UBE2D1, TP53, CHEK1, CHEK2, H2AX, HUS1, YWHAE, H2BC15, H2BC21, RCC2, YWHAZ, H2BC5, RFC5, H3-4, TAOK1, SEM1, CLASP1, CDC6, CLIP1, RPA1, MCM8, H4C3, KIF2C, ZWINT",https://pathcards.genecards.org/card/cell_cycle_checkpoints
15.94,TGF-Beta Pathway,653,62,"MAP2K1, MAP2K3, MAP2K4, MAP2K7, STAT5A, HDGF, AXL, EIF4EBP1, EIF4EBP2, TAB1, VEGFA, SAR1B, MDK, MYC, FGF1, F2R, FGF19, TIMP1, FGF9, FGFR4, UBE2I, TP53, ELP2, MAPK8IP2, EP300, KPNA1, MAPKAPK5, LTBP4, DUSP14, GNB2, GNG12, TBRG1, GFER, XIAP, RPS6KA4, PXN, EPHB4, SMAD2, SUMO1, TCF3, SMAD5, FOS, RBX1, DDR2, JUN, H3-3B, H3-4, CXCL8, PDGFRA, RHOA, PAK2, IL2RA, IFNGR2, TGFA, NFKBIB, GRB2, RAC3, MKNK2, SKI, CCL16, PAK4, ITGB8",https://pathcards.genecards.org/card/tgf-beta_pathway
15.89,Class I MHC Mediated Antigen Processing and Presentation,854,76,"CAPZA1, CAPZA2, FBXL4, FEM1A, FEM1C, B2M, FBXO32, CCNF, SAR1B, FGB, PTPN6, KLHL11, KLHL21, TIRAP, RASGRP3, UBE2D1, UBE2D2, UBE2G1, UBE2H, UBE2Q1, ASB16, UBE2V1, COPS7B, RBBP5, AP2M1, UBE2Z, RBCK1, PVR, DCAF16, STX4, DCAF7, CD1D, DCTN6, UBXN7, RNF19B, DDA1, HLA-A, HLA-B, HLA-C, YES1, DDB1, RNF217, REL, TRIM37, CD300E, RBX1, YWHAZ, CD3D, CD3E, ICOSLG, ASB6, ULBP3, ACTR1A, ORAI2, SEM1, TRAF6, PAK2, LILRB2, SIGLEC12, ZNRF2, CLEC2D, RICTOR, TRAT1, NFKBIB, FZR1, PEDS1-UBE2V1, GRB2, RACGAP1, CALM2, CALR, KIF2C, KIF3A, ARIH2, FBXL13, FBXL18, CSK",https://pathcards.genecards.org/card/class_i_mhc_mediated_antigen_processing_and_presentation
15.89,Chromatin Organization,270,33,"DR1, GATAD2A, BRPF1, SETD7, HCFC1, USP22, NCOR2, KMT2A, ELP2, KMT2B, KMT2D, RBBP5, EP300, H2AC12, OGT, ATF7IP, H2AC8, H2AX, H2BC15, H2BC21, H2BC5, SUV39H1, SUZ12, ACTB, PADI1, KAT6B, KDM5A, KDM6B, EED, DOT1L, H4C3, CDK4, ARID5B",https://pathcards.genecards.org/card/chromatin_organization
15.88,Toll-Like Receptor Signaling Pathways,133,21,"MAP2K3, MAP2K4, MAP2K7, TAB1, TIRAP, IRAK3, UBE2V1, NLRP12, RNF216, REL, FOS, FOSL1, FOSL2, JUN, JUNB, JUND, CXCL8, TRAF3, TRAF6, PANX1, NFKBIB",https://pathcards.genecards.org/card/toll-like_receptor_signaling_pathways
15.79,Cytoskeletal Signaling,308,36,"PFN1, DIAPH1, TLN1, RASGRP3, DBN1, AP2M1, PVR, USP9X, PXN, CTTN, MSN, ERC1, RCC2, RAB11B, PLEC, ACTB, SRCIN1, ACTN4, FSCN1, RDX, RHOA, PAK2, LLGL1, CDC37, VAV3, CLIP1, TFRC, LMNB2, ARHGAP31, WASF2, RAC3, VDAC2, LPP, KIF3A, MPRIP, PAK4",https://pathcards.genecards.org/card/cytoskeletal_signaling
15.77,Homology Directed Repair,346,39,"INO80B, TOPBP1, GTF2H5, WEE1, CCNB1, POLR2E, SFN, DNA2, UBE2I, TP53, COPS7B, EP300, GEN1, CHEK1, CHEK2, XRCC3, XRCC6, APEX1, DDB1, SUMO1, H2AC8, H2AX, HUS1, YWHAE, RBX1, H2BC15, H2BC21, YWHAZ, YY1, H2BC5, RFC5, H3-4, ACTB, TERF2, SEM1, RPA1, H4C3, MLH1, POLD3",https://pathcards.genecards.org/card/homology_directed_repair
15.53,PDGFR-beta Signaling Pathway,146,22,"MAP2K1, MAP2K4, NCKAP1, STAT5A, PTPN1, MYC, SFN, ZFP36, USP6NL, CTTN, FOS, BCAR1, YWHAZ, JUN, JUND, ACTN4, PIN1, RHOA, RICTOR, WASF2, GRB2, CSK",https://pathcards.genecards.org/card/pdgfr-beta_signaling_pathway
15.38,Innate Immune System,2054,153,"MUC17, MAP2K1, MAP2K3, CAPZA1, CAPZA2, MAP2K4, FBXL4, NCKAP1, TNIP2, TXLNA, MAP2K7, STAT5A, ARL8A, PTPN1, RANBP2, TXNIP, NUP62, TAB1, B2M, FBXO32, CFHR5, DIAPH1, POLR2E, CCNF, CEBPD, VEGFA, SAR1B, MYC, FGB, PTPN6, PTPN9, GBP6, HSP90AA1, KLHL11, TIMP1, HSPA1B, KLHL21, TIRAP, CGAS, RASGRP3, LEAP2, IRAK3, UBE2D1, UBE2D2, UBE2G1, UBE2H, UBE2I, UBE2Q1, TP53, ABI2, ASB16, GDI2, UBE2V1, AP2M1, EP300, KPNA1, UBE2Z, RBCK1, PVR, PKM, STX4, CD1D, TMT1A, TRIM10, GZMM, XRCC6, DCTN6, RNF19B, PRCP, HLA-A, HLA-B, HLA-C, YES1, REG3A, RNF216, RNF217, REL, TRIM37, SUMO1, FOS, CD300E, QSOX1, MSN, RBX1, YWHAZ, PDE12, SURF4, MYO10, CD3D, CD3E, JUN, JUNB, PLD3, ICOSLG, CXCL8, CD47, PSAP, IL17RA, ACTB, ASB6, SVIP, GPI, ULBP3, TARBP2, ACTR1A, RAB14, FSCN1, ORAI2, ERP44, TRAF3, SEM1, PAFAH1B2, PIN1, TRAF6, RHOA, PAK2, LILRB2, IL2RA, VAV3, PDZD11, IFNGR2, PANX1, SIGLEC12, ZNRF2, IFNLR1, ALOX15, CLEC2D, RICTOR, ATP6V0E1, TRAT1, ATP6V1F, NFKBIB, WASF2, FZR1, PEDS1-UBE2V1, IL6ST, ATP8B4, GRB2, RACGAP1, CLU, CALM2, CALR, CMTM6, CAMK2A, KIF2C, KIF3A, SAA1, ARIH2, FBXL13, FBXL18, AMPD3, RAB5B, CSK",https://pathcards.genecards.org/card/innate_immune_system
15.34,"Cell Cycle, Mitotic",691,64,"RANBP2, TOPBP1, NUP62, HAUS5, WEE1, CCNB1, POLR2E, MDM4, MYC, SPC25, ZNF385A, HSP90AA1, CENPA, ARPP19, CENPN, SFN, DNA2, UBE2D1, UBE2I, TP53, CEP43, CC2D1B, EP300, CTC1, TNPO1, CHEK1, CHEK2, SUMO1, H2AC8, H2AX, HUS1, YWHAE, E2F3, E2F4, RBX1, H2BC15, H2BC21, RCC2, GINS3, YWHAZ, H2BC5, RFC5, H3-3B, H3-4, TAOK1, ACTR1A, TERF2, SEM1, CLASP1, CDC6, CLIP1, FZR1, RPA1, MCM8, H4C3, MLH1, KIF2C, ZWINT, CDK4, POLA2, POLD3, FBXL18, CDK6, NEK7",https://pathcards.genecards.org/card/cell_cycle_mitotic
15.27,Cell Cycle,137,21,"WEE1, CCNB1, MYC, SFN, TP53, EP300, CHEK1, CHEK2, SMAD2, YWHAE, E2F3, E2F4, RBX1, YWHAZ, CDC6, FZR1, RPA1, ANAPC7, CDK4, POLA2, CDK6",https://pathcards.genecards.org/card/cell_cycle
15.10,CNTF Signaling,149,22,"MAP2K1, MAP2K3, MAP2K4, MAP2K7, STAT5A, EIF4EBP1, TIMP1, LDLR, RPS6KA4, FOS, YWHAE, FOSL1, FOSL2, YWHAZ, JUN, JUNB, JUND, NFKBIB, IL6ST, GRB2, RAB5B, MEF2D",https://pathcards.genecards.org/card/cntf_signaling
14.92,Chromatin Regulation / Acetylation,255,31,"DR1, BRD2, TIAL1, HELLS, CENPA, SETD1B, SETD7, TAF1, HCFC1, KMT2A, KMT2B, CBX3, RBBP5, EP300, H1-4, METTL14, TRIM37, H2AX, RNF40, SUV39H1, SUZ12, HMGN2, HNRNPA0, KDM5A, KDM6B, DOT1L, HNRNPC, SIN3A, RYBP, BMI1, MLLT1",https://pathcards.genecards.org/card/chromatin_regulation__acetylation
14.66,Apoptotic Pathways in Synovial Fibroblasts,731,66,"MAP2K1, MAP2K3, PPP1R10, MAP2K4, NCKAP1, MAP2K7, HDGF, GTF2H5, PFN1, CACNG8, MDK, MYC, HSP90AA1, FGF1, F2R, FGF19, TIMP1, TAF1, FGFR4, TP53, RND2, AGO2, ABI2, GNAI2, EP300, LTBP4, GNB2, GNG12, TBRG1, CHEK1, CHEK2, BBC3, GFER, XIAP, RPS6KA4, FOS, YWHAE, FOSL1, YWHAZ, CD3E, JUN, H3-3B, H3-4, ACTB, TERF2, PDGFRA, PPARA, RHOA, PAK2, IL2RA, CACNA1A, ALOX15, TGFA, NFKBIB, IL6ST, PARP15, GRB2, RAC3, RACGAP1, VDAC2, DFFA, H4C3, EIF1AX, PAK4, MEF2D, ITGB8",https://pathcards.genecards.org/card/apoptotic_pathways_in_synovial_fibroblasts
14.44,Cell Cycle Role of 14-3-3 Proteins in Cell Cycle Regulation,30,9,"WEE1, CCNB1, SFN, TP53, CHEK1, CHEK2, HUS1, YWHAE, YWHAZ",https://pathcards.genecards.org/card/cell_cycle_role_of_14-3-3_proteins_in_cell_cycle_regulation
14.40,Toll-like Receptor Signaling Pathway,285,33,"MAP2K1, MAP2K3, MAP2K4, MAP2K7, STAT5A, TAB1, MYC, PTPN6, HSPA1B, TIRAP, IRAK3, TP53, EP300, RBCK1, BBC3, SMAD2, DDB1, RNF216, FOS, MSN, YWHAZ, CD3D, CD3E, JUN, CXCL8, CREB3L2, TRAF3, TRAF6, IL2RA, NFKBIB, GRB2, CDK4, CDK6",https://pathcards.genecards.org/card/toll-like_receptor_signaling_pathway
14.35,Transcription_P53 Signaling Pathway,54,12,"MAP2K4, RANBP2, GTF2H5, MAP4, VEGFA, TP53, FHL2, EP300, APEX1, REL, SUMO1, FOS",https://pathcards.genecards.org/card/transcription_p53_signaling_pathway
14.26,Transcriptional Regulation By The AP-2 (TFAP2) Family of Transcription Factors,38,10,"VEGFA, MYC, HSPD1, UBE2I, EP300, SUMO1, YY1, KCTD15, TFAP2B, TGFA",https://pathcards.genecards.org/card/transcriptional_regulation_by_the_ap-2_(tfap2)_family_of_transcription_factors
13.95,Ovarian Tumor Domain Proteases,39,10,"TNIP2, OTUB1, OTUD7B, UBE2D1, TP53, YOD1, TRAF3, TRAF6, RHOA, VCPIP1",https://pathcards.genecards.org/card/ovarian_tumor_domain_proteases
13.72,Immune Response IL-2 Activation and Signaling Pathway,75,14,"MAP2K1, STAT5A, MYC, PTPN6, REL, FOS, FOSL1, FOSL2, JUN, JUNB, JUND, IL2RA, NFKBIB, GRB2",https://pathcards.genecards.org/card/immune_response_il-2_activation_and_signaling_pathway
13.63,Ubiquitination Cascade,57,12,"OTUB1, OTUD7B, UBE2D1, UBE2D2, UBE2G1, UBE2H, UBE2Q1, UBE2V1, UBE2Z, XIAP, USP9X, YOD1",https://pathcards.genecards.org/card/ubiquitination_cascade
13.53,5q35 Copy Number Variation,106,17,"MYC, ANKS4B, FGF1, FGF19, B4GALT7, FGFR4, ABHD5, GNAI2, DBN1, COX6B1, COX8A, H2AX, PRELID1, JUN, KDM6B, EED, GRB2",https://pathcards.genecards.org/card/5q35_copy_number_variation
13.48,TGF-beta Signaling Pathways,96,16,"MAP2K1, MAP2K3, MAP2K4, MYC, SMAD2, REL, SMAD5, FOS, FOSL1, JUN, JUNB, JUND, TRAF6, RHOA, PAK2, GRB2",https://pathcards.genecards.org/card/tgf-beta_signaling_pathways
13.47,PKMTs Methylate Histone Lysines,86,15,"SETBP1, SETD1B, SETD5, SETD7, KMT2A, KMT2B, KMT2D, RBBP5, ATF7IP, SUV39H1, SUZ12, H3-3B, EED, DOT1L, H4C3",https://pathcards.genecards.org/card/pkmts_methylate_histone_lysines
13.37,Development_Glucocorticoid Receptor Signaling,41,10,"STAT5A, HSP90AA1, HSPA14, HSPA1B, UBE2I, EP300, REL, SUMO1, FOS, JUN",https://pathcards.genecards.org/card/development_glucocorticoid_receptor_signaling
13.35,Akt Signaling,682,61,"MAP2K3, STAT5A, HDGF, AXL, EIF4EBP1, TAB1, CEBPG, MDK, HSP90AA1, FGF1, FGF19, TIMP1, TIRAP, FGFR4, IRAK3, TP53, RND2, GNAI2, MAPK8IP2, MAPKAPK5, LTBP4, GNB2, GNG12, TBRG1, CHEK1, GFER, XIAP, PXN, YAP1, EPHB4, FOS, YWHAE, FOSL1, YWHAZ, DDR2, CD3D, CD3E, JUNB, JUND, SPAG9, CXCL8, IL17RA, ACTB, AKT1S1, PDGFRA, TRAF6, RHOA, PAK2, CDC37, IL2RA, VAV3, TGFA, BMPR1A, GRB2, RAC3, MKNK2, ATXN2, CCL16, PAK4, MEF2D, ITGB8",https://pathcards.genecards.org/card/akt_signaling
13.01,AP-1 Transcription Factor Network,69,13,"MYC, TIMP1, TP53, EP300, HLA-A, FOS, FOSL1, FOSL2, JUN, JUNB, JUND, CXCL8, MAF",https://pathcards.genecards.org/card/ap-1_transcription_factor_network
12.96,Transcriptional Activity of SMAD2/SMAD3:SMAD4 Heterotrimer,51,11,"MYC, CCNK, NCOR2, UBE2D1, EP300, USP9X, SMAD2, E2F4, JUNB, SKI, CDK9",https://pathcards.genecards.org/card/transcriptional_activity_of_smad2smad3smad4_heterotrimer
12.76,Validated Targets of C-MYC Transcriptional Activation,80,14,"CCNB1, MYC, HSP90AA1, HSPD1, TP53, COMMD3-BMI1, FOSL1, E2F3, CAD, TFRC, MTDH, PEG10, BMI1, CDK4",https://pathcards.genecards.org/card/validated_targets_of_c-myc_transcriptional_activation
12.62,Signaling Events Mediated By Hepatocyte Growth Factor Receptor (c-Met),71,13,"MAP2K1, MAP2K4, PTPN1, EIF4EBP1, RANBP10, PXN, BCAR1, JUN, AKT1S1, RHOA, PAK2, GRB2, PAK4",https://pathcards.genecards.org/card/signaling_events_mediated_by_hepatocyte_growth_factor_receptor_(c-met)
12.60,Activation of The Pre-replicative Complex,112,17,"TOPBP1, DNA2, CHEK1, CHEK2, H1-4, HUS1, GINS3, YWHAZ, RFC5, CDC6, RPA1, MCM8, CDK4, POLA2, POLD3, CDK6, CDK9",https://pathcards.genecards.org/card/activation_of_the_pre-replicative_complex
12.57,Processing of Capped Intron-Containing Pre-mRNA,755,65,"LRPPRC, RANBP2, NUP62, GTF2H5, PCBP1, POLR2E, TNKS1BP1, RPL14, TRMT9B, ELAVL1, U2AF2, PHAX, HSPA1B, SF3B3, CSTF1, CSTF2, RPL22, RPL24, GEMIN2, GEMIN4, TNPO1, UBL5, RPL41, RBM22, ZFP36, C1D, CHERP, RBM28, DCP2, METTL14, RBM8A, CTU1, UTP11, SDE2, YWHAZ, NOB1, EBNA1BP2, DDX39B, RRP36, PABPN1, TRA2B, NOL9, DDX6, RPP25, SEM1, SRRT, SRSF10, SMG1, PAN2, HNRNPC, ZC3H11A, FTSJ3, CRNKL1, SNRNP27, RPS15A, UPF3A, FASTK, RPS16, KHSRP, WBP4, PNPT1, PTBP1, PTBP2, SNRPD3, CDKAL1",https://pathcards.genecards.org/card/processing_of_capped_intron-containing_pre-mrna
12.45,SARS-CoV-2 Infection,414,41,"LARP1, RANBP2, NUP62, TAB1, B2M, GATAD2A, VEGFA, SAR1B, PTPN6, HSP90AA1, SFN, UBE2I, UBE2V1, NLRP12, AP2M1, EP300, GEMIN2, GEMIN4, HLA-A, HLA-B, HLA-C, SUMO1, YWHAE, RBX1, YWHAZ, GPC4, MGAT5, ATP1A2, IL17RA, TRAF3, TRAF6, IFNGR2, FXYD1, RPS15A, PEDS1-UBE2V1, G3BP1, RPS16, GRB2, ST6GAL1, CNBP, SNRPD3",https://pathcards.genecards.org/card/sars-cov-2_infection
