Score,SuperPath Name,# SuperPath Total Genes,# SuperPath Matched Genes,Matched Genes (Symbols),Evidence URL
12.37,ERK Signaling,1185,93,"MAP2K1, MAP2K3, PPP1R10, MAP2K4, MAP2K7, STAT5A, HDGF, AXL, TAB1, WEE1, CACNG8, VEGFA, MDK, MYC, FGF1, FGF19, TIMP1, MYH11, COL18A1, COL23A1, ELN, TLN1, FGFR4, IRAK3, TP53, RND2, GNAI2, MAPK8IP2, EP300, LTBP4, GNB2, GNG12, TBRG1, SOX12, CHEK1, CHEK2, BBC3, GFER, SOX4, RPS6KA4, SPON2, PXN, APH1A, EPHB4, SMAD2, TCF3, SMAD5, FOS, BCAR1, MSN, FOSL1, FOSL2, E2F3, E2F4, DDR2, MYO10, CD3D, CD3E, JUN, JUNB, JUND, H3-3B, H3-4, MYO1F, CXCL8, IL17RA, ACTB, ACTN4, RDX, PDGFRA, TRAF6, RHOA, PAK2, IL2RA, CACNA1A, CLIP1, TGFA, NFKBIB, BMPR1A, GRB2, RAC3, PARVB, MKNK2, CDH7, CAMK2A, TUBD1, LAMC1, CDK4, CCL16, CDK6, PAK4, MEF2D, ITGB8",https://pathcards.genecards.org/card/erk_signaling
12.34,MAPK Signaling Pathway,244,28,"MAP2K1, MAP2K3, MAP2K4, MAP2K7, TAB1, CACNG8, MYC, FGF1, FGF19, HSPA1B, FGF9, RASGRP3, FGFR4, TP53, MAPK8IP2, MAPKAPK5, GNG12, RPS6KA4, FOS, JUN, JUND, TAOK1, TRAF6, PAK2, CACNA1A, GRB2, RAC3, MKNK2",https://pathcards.genecards.org/card/mapk_signaling_pathway
12.26,Tyrosine Kinases / Adaptors,148,20,"AXL, FGF1, SFN, FGFR4, YAP1, EPHB4, YES1, BCAR1, YWHAE, SPRY1, YWHAZ, MACC1, DDR2, PDGFRA, PEAK1, TGFA, EFNB1, GRB2, MPZL1, CSK",https://pathcards.genecards.org/card/tyrosine_kinases__adaptors
12.19,Deubiquitination,297,32,"TNIP2, INO80B, TAB1, MDM4, MYC, USP12, OTUB1, HCFC1, USP22, OTUD7B, UBE2D1, TP53, EP300, USP9X, SMAD2, H2AC12, OGT, YOD1, H2AC8, H2BC15, H2BC21, RCE1, YY1, H2BC5, FOXK1, ACTB, TRAF3, SEM1, TRAF6, RHOA, VCPIP1, VDAC2",https://pathcards.genecards.org/card/deubiquitination
12.05,Downstream Signaling in Naïve CD8+ T Cells,46,10,"MAP2K1, B2M, HLA-A, FOS, FOSL1, CD3D, CD3E, JUN, JUNB, IL2RA",https://pathcards.genecards.org/card/downstream_signaling_in_nave_cd8_t_cells
11.92,Disorders of Folate Metabolism and Transport,16,6,"FOLR1, ATIC, SHMT2, MTHFD1, MTHFD2, MTHFR",https://pathcards.genecards.org/card/disorders_of_folate_metabolism_and_transport
11.75,Signaling Events Mediated By HDAC Class I,118,17,"RANBP2, NUP62, GATAD2A, HSP90AA1, NCOR2, UBE2I, EP300, SUMO1, YWHAE, H2BC21, YY1, H3-3B, H3-4, PPARA, SIN3A, H4C3, CAMK2A",https://pathcards.genecards.org/card/signaling_events_mediated_by_hdac_class_i
11.67,Endometrial Cancer,201,24,"MAP2K1, STAT5A, VEGFA, MYC, FGF1, TP53, BBC3, PXN, SMAD2, REL, FOS, BCAR1, E2F3, JUN, RHOA, PAK2, TGFA, GRB2, RAC3, CALM2, MLH1, CDK4, CDK6, PAK4",https://pathcards.genecards.org/card/endometrial_cancer
11.57,MTOR Signaling Pathway,48,10,"MAP2K1, EIF4EBP1, SFN, DDIT4, YY1, RRN3, AKT1S1, ULK1, RICTOR, CLIP1",https://pathcards.genecards.org/card/mtor_signaling_pathway
11.46,"PtdIns(4,5)P2 in Cytokinesis Pathway",11,5,"OCRL, MSN, RDX, RHOA, RACGAP1",https://pathcards.genecards.org/card/ptdins(45)p2_in_cytokinesis_pathway
11.45,EPH-Ephrin Signaling,143,19,"MAP2K1, MYH11, TLN1, GNAI2, AP2M1, PXN, APH1A, EPHB4, YES1, ACTB, ACTN4, RHOA, PAK2, VAV3, EFNA1, EFNA3, EFNA5, EFNB1, GRB2",https://pathcards.genecards.org/card/eph-ephrin_signaling
11.38,Glucose / Energy Metabolism,307,32,"PTPN1, TXNIP, ABCC6, CEBPD, NKX6-1, SLC7A5, ACACA, SCD, PKM, YAP1, PCYT1A, UCP2, OGT, NMNAT1, CPT1A, ULK1, SHMT2, PPFIBP1, PANK1, PEA15, TFAP2B, CAD, KCNH2, SLC47A1, CYP11A1, G6PD, MTHFD2, CLPP, SLC5A2, NHERF2, CS, MTHFR",https://pathcards.genecards.org/card/glucose__energy_metabolism
11.24,Prolactin Signaling,432,41,"MAP2K1, MAP2K3, MAP2K4, MAP2K7, STAT5A, AXL, EIF4EBP1, CEBPD, VEGFA, MDM4, MYC, IRAK3, TP53, RND2, EP300, RPS6KA4, APH1A, TCF3, FOS, E2F3, E2F4, JUN, H3-3B, H3-4, PDGFRA, TRAF6, RHOA, PAK2, IL2RA, VAV3, IFNGR2, NFAT5, TGFA, NFKBIB, PARP15, GRB2, CALM2, CAMK2A, CDK4, CDK6, PAK4",https://pathcards.genecards.org/card/prolactin_signaling
11.12,P53 Pathway,50,10,"CSE1L, MDM4, SETD7, UBE2D1, TP53, CHEK1, CHEK2, YY1, PIN1, DYRK2",https://pathcards.genecards.org/card/p53_pathway
11.04,ESR-mediated Signaling,298,31,"ARL4C, POLR2E, MYC, HSP90AA1, ZDHHC21, NCOR2, AGO2, GNAI2, EP300, SCD, GNB2, GNG12, UHMK1, H2AC8, FOS, H2AX, H2BC15, H2BC21, YY1, H2BC5, CPT1A, JUN, JUND, H3-3B, RDH11, PDK3, TGFA, CALM2, H4C3, ANGPTL3, CDK9",https://pathcards.genecards.org/card/esr-mediated_signaling
11.02,Immune Response_IL-6 Signaling Pathway,33,8,"MAP2K1, CEBPD, REL, FOS, JUN, JUND, IL6ST, GRB2",https://pathcards.genecards.org/card/immune_response_il-6_signaling_pathway
10.95,Cell Cycle Regulation of G1/S Transition (part 1),124,17,"WEE1, CCNB1, MYC, HSP90AA1, CHEK1, CHEK2, SMAD2, FOS, E2F4, RBX1, JUN, JUNB, FZR1, GRB2, ANAPC7, CDK4, CDK6",https://pathcards.genecards.org/card/cell_cycle_regulation_of_g1s_transition_(part_1)
10.92,Signaling By ALK in Cancer,91,14,"STAT5A, RANBP2, CCNB1, PTPN6, TP53, AGO2, ATIC, MSN, RBX1, JUN, JUNB, PPFIBP1, TPM3, GRB2",https://pathcards.genecards.org/card/signaling_by_alk_in_cancer
10.92,Corticotropin-releasing Hormone Signaling Pathway,91,14,"MAP2K1, HSP90AA1, GNAI2, ACACA, GNB2, FOS, FOSL1, FOSL2, JUNB, JUND, CXCL8, RHOA, CYP11A1, CAMK2A",https://pathcards.genecards.org/card/corticotropin-releasing_hormone_signaling_pathway
10.91,CD28 Signaling in T-Helper Cell,113,16,"MAP2K4, MAP2K7, FOS, CD3D, CD3E, JUN, ICOSLG, ACTB, IL2RA, NFAT5, TRAT1, NFKBIB, GRB2, CALM2, CAMK2A, CSK",https://pathcards.genecards.org/card/cd28_signaling_in_t-helper_cell
10.90,Calcineurin-regulated NFAT-dependent Transcription in Lymphocytes,51,10,"PTPN1, FOS, FOSL1, RCAN1, JUN, JUNB, CXCL8, MAF, IL2RA, CDK4",https://pathcards.genecards.org/card/calcineurin-regulated_nfat-dependent_transcription_in_lymphocytes
10.89,Packaging Of Telomere Ends,209,24,"POLR2E, CENPA, CENPN, TP53, BAMBI, EP300, H1-4, APEX1, SMAD2, H2AC8, H2AX, H2BC15, H2BC21, H2BC5, RFC5, H3-3B, H3-4, TERF2, SIN3A, RPA1, H4C3, SKI, INHBA, POLD3",https://pathcards.genecards.org/card/packaging_of_telomere_ends
10.64,Integrated Breast Cancer Pathway,150,19,"TAB1, WEE1, VEGFA, MYC, RASGRP3, BACH1, TP53, GDI1, EP300, PKIA, DCAKD, CHEK1, CHEK2, XRCC3, SMAD2, FOSL2, JUN, BMPR1A, CDK4",https://pathcards.genecards.org/card/integrated_breast_cancer_pathway
10.62,VEGF Signaling Pathway,93,14,"MAP2K1, MAP2K3, MAP2K4, MAP2K7, VEGFA, TLN1, FGFR4, CEP43, PXN, SMAD2, SMAD5, GRB2, RAC3, CSK",https://pathcards.genecards.org/card/vegf_signaling_pathway
10.62,Transport of Inorganic Cations/anions and Amino Acids/oligopeptides,735,61,"SLC5A5, SLC5A6, SLC12A5, SLC12A6, MCU, ABCC6, SAR1B, ABCF1, SLC6A6, BSND, STOML3, SLC7A5, LDLR, PHB2, SLC24A4, SLC9A3, SLC9A4, AP2M1, VLDLR, SGK3, GNB2, GNG12, SCNN1G, TRPC4AP, FLVCR1, SLC2A14, ASPH, RNF185, SLC30A3, LETM1, SLC33A1, YME1L1, SLC38A2, SLC38A4, APOC3, TRPV2, ATP1A2, AQP3, LIPA, AQP6, SEM1, CLCN7, OSTM1, PDZD11, SLC41A2, SLC43A2, FXYD1, ATP6V0E1, TFRC, PMPCA, ATP6V1F, SLC47A1, ESYT1, ATP8B4, SLC4A2, VDAC2, CALM2, CAMK2A, SLC5A2, ANGPTL3, C8orf44-SGK3",https://pathcards.genecards.org/card/transport_of_inorganic_cationsanions_and_amino_acidsoligopeptides
10.62,MAP Kinase Activation,72,12,"MAP2K1, MAP2K3, MAP2K4, TNIP2, MAP2K7, TAB1, UBE2V1, FOS, JUN, IL17RA, TRAF6, PEDS1-UBE2V1",https://pathcards.genecards.org/card/map_kinase_activation
10.62,Development_TGF-beta Receptor Signaling,72,12,"MAP2K1, MAP2K3, TAB1, EP300, TNPO1, XIAP, SMAD2, REL, YY1, FZR1, SKI, ANAPC7",https://pathcards.genecards.org/card/development_tgf-beta_receptor_signaling
10.61,3q29 Copy Number Variation Syndrome,62,11,"STAT5A, MYC, FBXO45, CEP350, CEP43, PXN, UBXN7, PCYT1A, JUN, PAK2, TFRC",https://pathcards.genecards.org/card/3q29_copy_number_variation_syndrome
10.42,Chromosome Maintenance,140,18,"POLR2E, CENPA, CENPN, DNA2, CTC1, H2AC8, H2AX, H2BC15, H2BC21, H2BC5, RFC5, H3-3B, H3-4, TERF2, RPA1, H4C3, POLA2, POLD3",https://pathcards.genecards.org/card/chromosome_maintenance
10.39,Nervous System Development,1269,95,"MAP2K1, THRAP3, HAND2, PFN1, CACNG8, POLR2E, CEBPD, TNKS1BP1, RPL14, MYC, NKX6-1, HSP90AA1, MYH11, FGF9, NCOR2, RPL22, TLN1, TP53, AGO2, MED28, KMT2A, KMT2D, RPL24, RBBP5, AP2M1, VLDLR, EP300, SCN2B, TBX20, RPL41, SLIT1, RPS6KA4, GFRA1, APH1A, YAP1, EPHB4, SMAD2, YES1, RBM8A, TAL1, TCF3, H2AC8, H2AX, KRT78, MSN, FOXC1, PRSS8, RBX1, H2BC15, H2BC21, YY1, H2BC5, SUZ12, MYO10, ONECUT3, JUN, H3-3B, SPAG9, PABPN1, ACTB, KRT80, RDX, SEM1, PPARA, KDM5A, PAGR1, KDM6B, CLASP1, RHOA, PAK2, EED, TET3, VAV3, UNC5B, TFAP2B, NAB2, EFNA1, RPS15A, EFNA3, EFNA5, ARHGAP39, UPF3A, EFNB1, RPS16, GRB2, KRTAP9-6, LHX9, H4C3, AMH, HOXD11, HOXD3, LAMC1, CDK4, PAK4, MEF2D",https://pathcards.genecards.org/card/nervous_system_development