Score,SuperPath Name,# SuperPath Total Genes,# SuperPath Matched Genes,Matched Genes (Symbols),Evidence URL
15.11,WtCFTR and Delta508-CFTR Traffic / Generic Schema (norm and CF),135,39,"SAR1A, SAR1B, UBA52, HGS, UBC, GDI1, AP1B1, AP1S1, AP1S3, COPZ1, AP2M1, AP2S1, TSG101, HIP1, STX1A, STX7, EPN1, YKT6, RAB11A, MYO1D, MYO1F, MYO1H, MYO6, BET1L, ACTB, ACTG1, SEC24D, VAMP8, PRKAR2A, PLIN3, RAB27A, OPTN, ARF1, RAB4A, RAB9A, VPS45, RABGEF1, NHERF1, SEC24A",https://pathcards.genecards.org/card/wtcftr_and_delta508-cftr_traffic__generic_schema_(norm_and_cf)
14.87,Regulation of Actin Cytoskeleton,151,42,"MAP2K2, NCKAP1, PFN1, DIAPH1, MAPK1, CFL1, CFL2, F2, F2R, FGF19, ENAH, FGF5, FGFR1, ABI2, MAPK6, NRAS, SOS2, APC, PXN, MYLK, PIK3C2A, MSN, GIT1, PIK3CD, PIK3R1, ACTB, ACTG1, PDGFRA, PIP4K2B, PIP4K2C, RHOA, PAK1, PAK2, CRK, VCL, LIMK1, RAC1, WASF2, RAC3, MRAS, PAK4, CSK",https://pathcards.genecards.org/card/regulation_of_actin_cytoskeleton
14.83,Acute Viral Myocarditis,75,26,"EIF4G1, CCND1, MAPK1, SOCS1, TLR5, ABL1, ABL2, ITGAL, MMP9, KRT8, BCL2L1, CD4, CD55, PIK3R1, ACTB, CREB1, CXCR4, EDN1, CYCS, TGFB1, IL6, FYN, PARP1, RAC3, DFFA, DFFB",https://pathcards.genecards.org/card/acute_viral_myocarditis
14.82,Oncogenic MAPK Signaling,84,28,"MAP2K2, MAPK1, ARRB1, ARRB2, TLN1, NRAS, AGTRAP, FAM131B, ITGB3, DUSP6, DUSP8, SPRED1, SPRED3, ATG7, BCL2L11, ACTB, ACTG1, SHOC2, VCL, FXR1, KIAA1549, CALM3, KSR2, CAMK2A, HRAS, MPRIP, MRAS, CSK",https://pathcards.genecards.org/card/oncogenic_mapk_signaling
14.82,7q11.23 Copy Number Variation Syndrome,84,28,"GAPDH, LAT2, NUP62, BRD4, MYC, CFL1, HSPA2, DLST, ACACA, TSG101, STX1A, NRG1, CTNNB1, H2AX, HMGA1, BCL7B, RFC2, ULK1, CLASP1, CLDN4, VPS37A, VPS37B, VPS37C, LIMK1, FAS, GRB2, HOXC8, EIF2A",https://pathcards.genecards.org/card/7q1123_copy_number_variation_syndrome
14.81,DYRK1A Involvement Regarding Cell Proliferation in Brain Development,62,23,"EIF2B5, CCND1, TSC1, TP53, RBBP4, HIP1, DCAF7, RBL1, APH1A, REST, E2F4, PSENEN, AKT1S1, CREB1, APP, TFAP4, CRY2, LIN52, LIN9, RAD54L2, CDK4, CDK6, CDKN1B",https://pathcards.genecards.org/card/dyrk1a_involvement_regarding_cell_proliferation_in_brain_development
14.78,P75 NTR Receptor-mediated Signalling,182,48,"TAB2, CASP8, UBA52, OTUD1, OTUD7B, UBC, BAG4, RBCK1, MAPKAPK2, SOS2, GNB4, TBXA2R, XIAP, APH1A, SPPL2A, RELA, YWHAE, BCL2L11, IKBKG, TNFRSF10A, TNFRSF10B, TNFRSF10D, PLEKHG2, PLEKHG5, PSENEN, MIB2, ULK1, TRAF1, ADAM17, TRAF6, NET1, OPTN, RHOA, RHOB, RHOC, RTN4, RTN4R, VAV2, VAV3, SPATA2, RAC1, CYLD, FAS, RACK1, ARHGDIA, ARHGEF18, ARHGEF2, ARHGEF39",https://pathcards.genecards.org/card/p75_ntr_receptor-mediated_signalling
14.77,Transcription Androgen Receptor Nuclear Signaling,98,31,"CCND1, MDM2, MAPK1, NCOR1, HBEGF, WNT3, EP300, SOS2, NRG1, CTNNB1, DVL3, RELA, PIK3R1, AKT2, AR, TGFB1, IGF1, IGF1R, IL6, IL6R, TGFBR1, TGFBR2, FZD6, FZD7, GRB2, PTEN, WNT7B, HRAS, CDKN1A, SRD5A1, WNT3A",https://pathcards.genecards.org/card/transcription_androgen_receptor_nuclear_signaling
14.77,Guidance Cues and Growth Cone Motility,117,35,"CFL1, CFL2, ABL1, ABL2, MAPK8IP2, NRP1, SLIT1, SLIT3, EPHA2, EPHA4, MYL9, PLCG2, NTN1, PIK3R1, SRGAP1, NET1, RHOA, RHOB, RHOC, PAK1, PAK2, RTN4R, UNC5A, UNC5B, UNC5C, UNC5D, LIMK1, RAC1, FYN, EFNA1, EFNA3, RAC3, ARHGEF2, DPYSL5, PAK4",https://pathcards.genecards.org/card/guidance_cues_and_growth_cone_motility
14.70,TNF Signaling,71,25,"MAP2K3, MAP2K7, TAB2, MAP3K5, CASP8, UBA52, OTUD1, OTUD7B, UBC, BAG4, RBCK1, MAPKAPK2, XIAP, SPPL2A, RELA, IKBKG, RFFL, MIB2, ULK1, TRAF1, ADAM17, OPTN, SPATA2, CYLD, RACK1",https://pathcards.genecards.org/card/tnf_signaling
14.61,Signaling By ERBB2,50,20,"PTK6, DIAPH1, HSP90AA1, HBEGF, UBA52, UBC, NRAS, NRG1, NRG4, MEMO1, YES1, ERBB3, RNF41, PIK3R1, AKT2, RHOA, CDC37, FYN, GRB2, HRAS",https://pathcards.genecards.org/card/signaling_by_erbb2
14.39,RRNA Processing in The Nucleus and Cytosol,205,52,"RPS19, RPL12, NIP7, WDR75, HSD17B10, MRM3, TRMT10C, RPL13A, RPL14, TRMT112, CSNK1E, RPL18A, RPS27, UBA52, RPL22, FCF1, BYSL, RPS28, RPL36, ISG20L2, RPL37, RPL27, RPL41, RPL28, RPS4X, C1D, RBM28, RPS6, RPL30, RPL7A, UTP15, UTP4, RPL34, NOB1, RPL8, RPL9, RRP36, RRP7A, NOC4L, RPLP1, RPP14, FTSJ3, SENP3, RPS12, RIOK3, RPS16, RPS17, IMP4, WDR12, EXOSC10, EXOSC2, EXOSC6",https://pathcards.genecards.org/card/rrna_processing_in_the_nucleus_and_cytosol
14.29,Death Receptor Signaling Pathway,119,35,"MAP2K2, MAP2K3, AXIN1, TNFSF14, TNFSF15, MAP3K2, MAPK1, CASP8, HSP90AA1, HSP90AB1, GCK, SFN, MAPK14, TP53, BAG4, MAPK6, BAK1, APAF1, BBC3, XIAP, RELA, YWHAE, YWHAG, BCL2L1, YWHAZ, TNFRSF10A, TNFRSF10B, TNFRSF10D, AKT2, TRAF1, TRAF3, CYCS, FAS, CDKN1A, ELK1",https://pathcards.genecards.org/card/death_receptor_signaling_pathway
14.25,Regulation of Telomerase,68,24,"MXD1, CCND1, SP1, MYC, HSP90AA1, IRF1, ABL1, RBBP4, WT1, DCLRE1B, XRCC5, XRCC6, HUS1, YWHAE, E2F1, ATM, MAX, TERF2, PINX1, IFNAR2, TGFB1, PARP2, CDKN1B, MRE11",https://pathcards.genecards.org/card/regulation_of_telomerase
14.20,Transport to The Golgi and Subsequent Modification,304,70,"CANX, CAPZA2, ANKRD28, SAR1B, COG5, UBA52, B4GALT1, UBC, GMDS, RNF103, PPP6R1, COPZ1, ASGR2, GNE, TMED10, TMED9, MARCHF6, TRIM13, CTSA, DCTN3, DCTN4, DCTN5, DCTN6, RNF185, DYNC1LI2, UGGT1, UGGT2, DYNLL2, YKT6, FOLR1, SPTBN2, MGAT4A, MGAT5, MPI, CD55, SEC16A, SEC22C, BET1L, RFT1, SRD5A3, SEC24D, KDELR1, ALG1, EDEM3, ALG10B, ARF1, ALG14, TRAPPC10, LMAN2, ALG9, TRAPPC2, MCFD2, TGFA, NAGK, SERPINA1, ST3GAL2, ST6GAL2, DPM2, ST6GALNAC3, CALR, CMAS, TUBA1B, TUBB2A, AMFR, MAN1C1, MAN2A1, MAN2A2, SEC24A, RAB1B, ARF3",https://pathcards.genecards.org/card/transport_to_the_golgi_and_subsequent_modification
14.18,Androgen Receptor Network in Prostate Cancer,105,32,"MAP2K2, PTPN11, BRCA1, CCND1, TSC1, MDM2, MYC, RAPGEF1, MAPK1, CASP8, CDC25B, KLK2, MAPK14, TP53, NDRG1, PXN, E2F1, ATM, SMARCC2, PLK1, AR, PAK1, CRK, GRB2, CDK1, CRKL, PTEN, CDK2, CDK4, HRAS, MRE11, ELK1",https://pathcards.genecards.org/card/androgen_receptor_network_in_prostate_cancer
14.08,Head and Neck Squamous Cell Carcinoma,73,25,"EIF4E, CCND1, VEGFA, TSC1, CASP8, SESN2, FGFR1, TP53, FKBP1A, NRAS, CTNNB1, RPS6, E2F1, PIK3R1, AKT2, TRAF3, RICTOR, IGF1R, TGFBR2, PTEN, CDK4, HRAS, CDK6, CDKN1A, CDKN2A",https://pathcards.genecards.org/card/head_and_neck_squamous_cell_carcinoma
13.97,TP53 Regulates Metabolic Genes,87,28,"TSC1, TIGAR, SESN2, SESN3, SFN, TP53, AGO1, AGO2, AGO3, SCO1, COX18, COX19, TNRC6A, TNRC6B, TNRC6C, COX6B1, SLC38A9, YWHAE, YWHAG, RRAGC, RRAGD, YWHAZ, GPI, AKT2, CYCS, G6PD, PTEN, GSR",https://pathcards.genecards.org/card/tp53_regulates_metabolic_genes
13.85,Apoptosis-related Network Due to Altered Notch3 in Ovarian Cancer,52,20,"AXIN1, MAPK1, F2R, VIM, ABL1, NRG1, ERBB3, JUND, TNFRSF10B, ERN1, APP, TRAF1, NET1, PAK2, VAV3, SERBP1, IL7R, THBS1, CDKN1A, CDKN1B",https://pathcards.genecards.org/card/apoptosis-related_network_due_to_altered_notch3_in_ovarian_cancer
13.85,EPHA-mediated Growth Cone Collapse,52,20,"CFL1, CFL2, MYH11, MYH9, EPHA2, EPHA4, YES1, LYN, MYL9, ACTB, ACTG1, RHOA, PAK1, PAK2, LIMK1, RAC1, FYN, EFNA1, EFNA3, PAK4",https://pathcards.genecards.org/card/epha-mediated_growth_cone_collapse
13.81,RAB Geranylgeranylation,65,23,"PTP4A2, RAB11A, RAB11B, RAB13, RAB14, RAB23, RAB27A, RAB2A, RAB2B, RAB31, RAB40B, RAB40C, RAB4A, RAB5C, RAB9A, RAB3B, RAB17, RAB15, RAB5B, RAB10, RAB36, RAB1B, RAB32",https://pathcards.genecards.org/card/rab_geranylgeranylation
13.77,Bladder Cancer,40,17,"MAP2K2, CCND1, VEGFA, MDM2, MYC, MAPK1, HBEGF, TP53, NRAS, MMP9, E2F1, PIK3R1, THBS1, CDK4, HRAS, CDKN1A, CDKN2A",https://pathcards.genecards.org/card/bladder_cancer
13.71,Beta-2 Adrenergic-dependent CFTR Expression,167,44,"MAP2K3, MXD1, PTPN11, SP1, MYC, TNNC1, MAPK14, LEFTY1, GNAI1, GNAI2, GNAI3, GNAS, AHR, YES1, PLA2G4A, LYN, PLCG2, AKAP6, FPR2, ATP2A2, PIK3R1, CREB1, PDE4D, PRKAR2A, ACVR2B, RHOA, PRKX, CACNA1C, PITX1, SYK, RXRA, FYN, CYP11A1, ADCY1, VDR, NANOG, CALM3, CAMK2A, GRIN2A, PTGES2, PTGS1, PTGS2, CDKN1A, CDKN1B",https://pathcards.genecards.org/card/beta-2_adrenergic-dependent_cftr_expression
13.70,Jak-Stat Signaling Pathway,88,28,"MAP2K2, MAP2K3, STAT2, STAT5B, PTPN11, MAPK1, PTPN6, SOCS1, ABL1, MAPK6, NRAS, PIAS2, YES1, LYN, JAK3, IL10RB, PIK3R1, AKT2, CXCR4, IL20RB, IL21R, IL23R, IGF1R, IL5RA, IL6R, FYN, IL7R, HRAS",https://pathcards.genecards.org/card/jak-stat_signaling_pathway
13.66,NcRNAs Involved in Wnt Signaling in Hepatocellular Carcinoma,220,54,"AXIN1, PTPA, CCND1, CCND2, CSNK1E, MYC, INVS, PPP2R2A, EZH2, KLF4, BTRC, LDLR, FBXW2, TLE3, TP53, WNT3, EP300, KREMEN1, CTNNB1, CTNNBIP1, APC, DVL3, PYGO2, TCF3, FOSL1, BCL9L, GPC4, FRAT2, CD44, PRICKLE1, ZBTB33, RSPO1, PRKCH, PPARD, RHOA, RHOB, RHOC, SENP2, TFAP2A, HNRNPU, NFATC3, ESRRB, RAC1, MTDH, FZD6, FZD7, RAC3, NANOG, NLK, CAMK2A, NFYA, WNT7B, CDK6, WNT3A",https://pathcards.genecards.org/card/ncrnas_involved_in_wnt_signaling_in_hepatocellular_carcinoma
13.58,Integrin Pathway,570,115,"MAP2K2, MAP2K3, CAPN6, CAPNS1, TXK, MAP2K7, STAT2, STAT5B, MAP3K2, MAP3K5, PFN1, PFN2, THY1, DIAPH1, CACNG8, VEGFA, MYC, MAPK1, CFL1, CFL2, F2, F2R, MYH11, MYH15, COL18A1, COL1A1, COL1A2, COL5A1, AOC3, TLN1, MAPK14, CCR4, CCR6, MAPK6, GNAI1, GNAI2, GNAI3, ITGA2, OCLN, ITGA3, GNAS, NRAS, SOS2, HSPG2, GNB4, ITGAL, ITGB3, CTNNB1, MYH9, SPON2, PXN, MMP9, JAK3, MYL9, MYLK, MSN, PLCG2, TNC, MYO10, MYO1D, MYO1F, MYO3A, MYO5A, FPR2, MYO5C, MYO6, PIK3R1, ACTB, ACTG1, CREB1, PRKAR2A, SRF, PRKCH, PLPP3, CXCR4, PIP4K2B, PIP4K2C, RHOA, PAK1, PAK2, CYBA, CLDN12, CLDN16, CLDN4, CLDN7, CACNA1A, CACNA1B, CACNA1C, VAV2, VAV3, VCAM1, CRK, VCL, CACNA2D2, CACNB2, TGFB1, TGFBR1, TGFBR2, RAC1, FYN, ARHGAP26, ADCY1, GRB2, RAC3, THBS1, CALM3, CAMK2A, PTEN, LAMA5, HRAS, CCL22, MRAS, ELK1, PAK4, CSK",https://pathcards.genecards.org/card/integrin_pathway
13.46,Nuclear Receptors Meta-pathway,315,71,"SLC5A6, GSTM3, ARL5B, PTPA, ABCC5, SERTAD2, CCND1, SLC6A4, TSC22D3, SP1, MYC, ABCG8, SLC6A8, HSP90AA1, HBEGF, HSP90AB1, GCLM, FGF19, SLC7A11, SLC7A5, NR3C1, ABHD2, EP300, SLC26A2, FKBP5, SLC27A1, NRG1, AHR, ACOX1, SLC2A1, SLC2A5, SLC2A8, EPHA2, PRRG4, CES2, CES3, UGT2B4, SLC39A1, SLC39A11, APOC3, PRDX6, DNAJC15, ZIC2, JUNB, JUND, SEC14L1, TNS4, SMC1A, IL1B, PPARA, PPARD, SRPX2, CDC37, BHLHE40, SLC39A9, TGFA, TGFB1, TGFBR2, RXRA, FASN, G6PD, SERPINA1, VDR, CYP2B6, CDK1, CYP2C19, CDK4, PTGS2, CYP4A11, GSR, CDKN1B",https://pathcards.genecards.org/card/nuclear_receptors_meta-pathway
13.41,Loss of Proteins Required For Interphase Microtubule Organization From The Centrosome,227,55,"HAUS2, HAUS3, MYBL2, HAUS5, HAUS6, WEE1, CCNA2, CCNB1, CSNK1E, PPP2R2A, HSP90AA1, HSP90AB1, CDC25B, UBA52, BTRC, UBC, NDE1, TP53, RBBP4, CC2D2A, EP300, CEP97, PHLDA1, DCTN3, YWHAE, YWHAG, E2F1, E2F3, RAB11A, FOXM1, PLK1, TMEM216, OPTN, RAB3IP, CLASP1, PSMB2, PSMB5, PSMB9, PSMC4, PSMD1, PSMD10, PSMD11, PSME3, LIN52, LIN9, NPHP1, PSMF1, CDK1, TUBA1B, TUBB, TUBB2A, TUBGCP2, CDK2, FBXL18, CDKN1A",https://pathcards.genecards.org/card/loss_of_proteins_required_for_interphase_microtubule_organization_from_the_centrosome
13.37,Development Dopamine D2 Receptor Transactivation of EGFR,128,36,"MAP2K2, PTPN11, CCND1, MAPK1, HSP90AA1, HBEGF, STRN, GNAI1, GNAI2, GNAI3, NRAS, SOS2, GNB4, PXN, PLA2G4A, MMP9, PIK3CD, PIK3R1, CREB1, AKT2, SRF, CXCR4, RHOA, CRK, TGFA, IGF1R, RAC1, FYN, GRB2, CALM3, CAMK2A, CRKL, S1PR3, HRAS, CDKN1B, ELK1",https://pathcards.genecards.org/card/development_dopamine_d2_receptor_transactivation_of_egfr
13.35,C-MYB Transcription Factor Network,80,26,"CCNB1, CCND1, CEBPB, SP1, MYC, KITLG, NCOR1, SLC1A5, HSPA8, COL1A2, SPI1, ZFHX3, NRAS, TRIM28, LYZ, CD4, TOM1, NLK, MCM4, SKI, PTGS2, PAX5, CDK6, CDKN1A, CDKN1B, CDKN2A",https://pathcards.genecards.org/card/c-myb_transcription_factor_network
13.32,Signaling Events Mediated By Hepatocyte Growth Factor Receptor (c-Met),71,24,"MUC20, EIF4E, PTPN1, PTPN11, RAPGEF1, HGS, KPNB1, CTNNB1, MET, APC, PXN, PIK3R1, AKT1S1, RHOA, PAK1, PAK2, CRK, SNAI1, RAC1, GRB2, CRKL, HRAS, ARF6, PAK4",https://pathcards.genecards.org/card/signaling_events_mediated_by_hepatocyte_growth_factor_receptor_(c-met)
13.16,Development FGFR Signaling Pathway,134,37,"MAP2K2, MAP2K3, MAP2K7, PTPN11, MAP3K2, MAP3K5, MAPK1, FGF19, UBA52, FGF5, FGFR1, MAPK14, UBC, MAPKAPK2, NRAS, SOS2, HSPG2, RPS6KA1, RPS6KA3, BCL2L1, PLCG2, PIK3CD, PLD2, PLD3, PIK3R1, CREB1, AKT2, PRKCH, PAK1, CRK, RAC1, FYN, GRB2, CRKL, HRAS, MRAS, ELK1",https://pathcards.genecards.org/card/development_fgfr_signaling_pathway
13.16,Signaling By TGFB Family Members,124,35,"PPP1R15A, SP1, MYC, MAPK1, NCOR1, UBA52, COL1A2, CGN, CCNT1, UBC, EP300, LTBP4, FKBP1A, RBL1, ITGB3, YBX1, SMAD9, E2F4, ZFYVE9, JUNB, ATP1B4, ACVR2B, ACVRL1, RHOA, FURIN, TGFB1, SMURF2, TGFBR1, TGFBR2, PARD3, PARP1, BMP2, BMPR1A, ARHGEF18, SKI",https://pathcards.genecards.org/card/signaling_by_tgfb_family_members
13.16,Ebola Virus Infection in Host,129,36,"HAVCR1, TYRO3, MAPK1, DAB2IP, ITGA2, ITGA3, TSG101, EP300, SCIN, ITGB3, CD209, HLA-A, HLA-B, HLA-DOA, RELA, FOLR1, PIK3CD, PIK3R1, ACTB, ACTG1, ACTN4, TPCN2, MBL2, VPS18, ADAM17, RHOA, RHOB, RHOC, PAK1, VAV2, TFAP2A, RAB9A, VPS39, IGF1R, RAC1, EIF2AK2",https://pathcards.genecards.org/card/ebola_virus_infection_in_host
13.11,Colorectal Cancer Metastasis,165,43,"MAP2K2, MAP2K3, CCND1, CCND2, VEGFA, MYC, MAPK1, ARRB1, TLR5, TP53, MAPK6, WNT3, GNAS, TLR6, SOS2, GNB4, CTNNB1, APC, MMP9, MSH3, TCF3, E2F4, BCL2L1, PIK3R1, PRKAR2A, TGFB1, IL6, IL6R, TGFBR1, TGFBR2, FZD6, FZD7, ADCY1, GRB2, GRK2, GRK3, GRK4, GRK5, GRK6, WNT7B, PTGS2, CDKN1A, WNT3A",https://pathcards.genecards.org/card/colorectal_cancer_metastasis
13.07,Cell Cycle Role of 14-3-3 Proteins in Cell Cycle Regulation,30,14,"WEE1, CCNB1, CDC25B, SFN, MAPK14, TP53, MAPKAPK2, HUS1, YWHAE, YWHAG, ATM, YWHAZ, AKT2, CDK1",https://pathcards.genecards.org/card/cell_cycle_role_of_14-3-3_proteins_in_cell_cycle_regulation
13.07,Aryl Hydrocarbon Receptor Pathway,30,14,"VEGFA, HSP90AA1, KLF6, NRAS, AHR, RELA, E2F1, CDC37, PSRC1, CDK2, HRAS, PTGS2, CDKN1A, CDKN1B",https://pathcards.genecards.org/card/aryl_hydrocarbon_receptor_pathway
13.06,RhoGDI Pathway,181,46,"PFN1, PFN2, VEGFA, FGF19, MYH11, MYH15, FGF5, FGFR1, MYH9, MET, PXN, LYN, MYL9, PLCD3, PLCE1, PLCG2, MYO10, MYO1D, MYO1F, MYO3A, MYO5A, MYO5C, MYO6, PIK3R1, ACTB, ACTG1, PLPP3, NET1, PIP4K2B, PIP4K2C, RHOA, RHOB, RHOC, PAK1, PAK2, VAV2, VAV3, SYK, VCL, RAC1, PARP1, RAC3, ARHGDIA, ARHGEF2, ARF6, PAK4",https://pathcards.genecards.org/card/rhogdi_pathway
13.05,MRNA Splicing - Minor Pathway,50,19,"POLR2A, POLR2E, POLR2F, SF3B1, SF3B3, SF3B5, YBX1, ZMAT5, SRSF2, SRSF6, SRSF7, EFTUD2, SNRNP48, SNRPB, SNRPD1, SNRPD2, SNRPD3, SNRPG, NCBP2",https://pathcards.genecards.org/card/mrna_splicing_-_minor_pathway
13.03,Cyclins and Cell Cycle Regulation,72,24,"PTPA, WEE1, CCNA2, CCNB1, CCND1, CCND2, PPP2R2A, BTG1, BTG2, TP53, HDAC7, E2F1, E2F2, E2F3, E2F4, ATM, TGFB1, CDK1, CDK2, CDK4, CDK6, CDKN1A, CDKN1B, CDKN2A",https://pathcards.genecards.org/card/cyclins_and_cell_cycle_regulation
12.99,Integrin-linked Kinase Signaling,46,18,"PPP1R14A, DIAPH1, CCND1, TACC3, HSP90AA1, CTNNB1, PXN, MYL9, CREB1, CDC37, RICTOR, LIMS1, LIMS2, SNAI1, RAC1, PARP1, PARVB, PARVG",https://pathcards.genecards.org/card/integrin-linked_kinase_signaling
12.99,Microtubule Cytoskeleton Regulation,46,18,"DIAPH1, CFL2, ABL1, MAPKAPK2, APC, EPHB2, MARK2, SPRED1, TAOK1, CLASP1, PAK1, LIMK1, RAC1, CDK1, PTEN, KIF2C, DPYSL2, WNT3A",https://pathcards.genecards.org/card/microtubule_cytoskeleton_regulation
12.97,P38 MAPK Signaling Pathway (WikiPathways),34,15,"MAP3K5, MAP3K9, MYC, MAPK14, MAPKAPK2, MAPKAPK5, PLA2G4A, MAX, CREB1, TGFBR1, RAC1, GRB2, HRAS, ELK1, MEF2D",https://pathcards.genecards.org/card/p38_mapk_signaling_pathway_(wikipathways)
12.96,Spinal Cord Injury,115,33,"CCND1, MYC, MAPK1, BTG2, VIM, TP53, FKBP1A, ZFP36, SLIT1, SLIT3, EPHA4, APEX1, MMP9, E2F1, NTN1, AQP1, IL1B, AQP4, MIF, RHOA, RHOB, RHOC, RTN4, RTN4R, PLXNA2, TGFB1, IL6, RAC1, CDK1, CDK2, CDK4, PTGS2, CDKN1B",https://pathcards.genecards.org/card/spinal_cord_injury
12.95,Stabilization and Expansion of The E-cadherin Adherens Junction,42,17,"NCKAP1, DIAPH1, ENAH, STX4, NECTIN2, CTNNB1, MET, EPHA2, GIT1, MYO6, RHOA, VCL, IGF1R, EFNA1, LPP, VASP, ARF6",https://pathcards.genecards.org/card/stabilization_and_expansion_of_the_e-cadherin_adherens_junction
12.91,Signaling By EGFR,59,21,"PTPN1, PTPN11, PTPN3, HBEGF, UBA52, HGS, UBC, NRAS, MET, PXN, EPN1, SH3GL1, PIK3R1, FAM83A, FAM83D, PAG1, ADAM17, TGFA, GRB2, HRAS, CSK",https://pathcards.genecards.org/card/signaling_by_egfr
12.80,Intrinsic Pathway For Apoptosis,55,20,"CARD8, MAPK1, CASP8, SFN, TP53, BAK1, APAF1, BBC3, XIAP, DYNLL2, YWHAE, YWHAG, E2F1, TP73, BCL2L1, BCL2L11, YWHAZ, AKT2, CYCS, CDKN2A",https://pathcards.genecards.org/card/intrinsic_pathway_for_apoptosis
12.78,5q35 Copy Number Variation,106,31,"BRCA1, MYC, ANKS4B, FGF19, ABHD5, HIC2, ABL1, GNAI1, GNAI2, GNAI3, DBN1, HIP1, TMED10, TMED9, NSD1, COX6B1, H2AX, NTN1, MAX, PIK3R1, CXCR4, KDM6B, DOK3, LMAN2, TPM2, UNC5A, GPRIN1, IGF1R, GRB2, GRK6, ARL10",https://pathcards.genecards.org/card/5q35_copy_number_variation
12.71,Translation Insulin Regulation of Translation,183,46,"EIF2B5, MAP2K2, MAP2K3, EIF2S3, MAP2K7, EIF4A2, EIF4E, PTPN11, EIF4G1, CEBPB, VEGFA, TSC1, CSNK1E, MAPK1, PTPN6, ELK4, MAPK14, SOS2, RPS6, RPS6KA1, MET, RPS6KA4, PDCD4, PIK3CD, JUNB, PIK3R1, AKT2, PRKAR2A, ADAM17, PAK1, EEF2, EEF2K, TGFB1, IGF1, IGF1R, TGFBR1, TGFBR2, RAC1, GRB2, MKNK2, PTEN, HRAS, DYRK2, EIF2AK2, EIF2B3, ELK1",https://pathcards.genecards.org/card/translation_insulin_regulation_of_translation
12.69,CCR5 Pathway in Macrophages,321,71,"STAT2, STAT5B, CACNG8, POLR2A, CCND1, MAPK1, HSP90AA1, ARRB1, ARRB2, HSPA4, MAPK14, CCR4, CCR6, MAPK6, GNAI1, GNAI2, GNAI3, EP300, GNAS, NRAS, SOS2, GNB4, PXN, PLA2G4A, RELA, LYN, JAK3, IKBKG, PLCG2, CD3E, CD4, PIK3CD, FPR2, PIK3R1, AKT2, PRKAR2A, SRF, PRKCH, AR, CXCR4, RHOA, RHOB, RHOC, PAK1, PRKX, CACNA1A, CACNA1B, CACNA1C, VAV2, VAV3, CRK, CACNA2D2, CACNB2, RAC1, FAS, PARD3, ADCY1, GRB2, CALM3, CALR, CRKL, GRK2, GRK3, GRK4, GRK5, GRK6, HRAS, CCL22, MRAS, ELK1, CSK",https://pathcards.genecards.org/card/ccr5_pathway_in_macrophages
12.59,Regulation of CDH11 Expression and Function,31,14,"SP1, HEYL, ZEB2, AGO1, AGO2, AGO3, CTNNB1, TNRC6A, TNRC6B, TNRC6C, ZC3H12A, SNAI1, ILF3, HOXC8",https://pathcards.genecards.org/card/regulation_of_cdh11_expression_and_function
12.53,RHOBTB GTPase Cycle,35,15,"TXNL1, HSP90AA1, HSP90AB1, VIM, SPEN, TMOD3, DBN1, CCT6A, RNF20, CPSF7, DDX39B, MYO6, ACTG1, CDC37, GPS1",https://pathcards.genecards.org/card/rhobtb_gtpase_cycle
12.53,Apoptosis and Survival BAD Phosphorylation,112,32,"MAP2K2, PTPA, PTPN11, MAPK1, PPP2R2A, SFN, PPTC7, GNAS, SOS2, GNB4, APAF1, RPS6KA1, RPS6KA3, RPS6KA4, YWHAE, YWHAG, BCL2L1, YWHAZ, PIK3CD, PIK3R1, AKT2, PRKAR2A, CYCS, IGF1, IGF1R, ADCY1, GRB2, PPM1D, PPM1F, PPM1L, CDK1, HRAS",https://pathcards.genecards.org/card/apoptosis_and_survival_bad_phosphorylation
12.45,Regulation of RUNX1 Expression and Activity,17,10,"PTPN11, CCND1, CCND2, AGO1, AGO2, AGO3, TNRC6A, TNRC6B, TNRC6C, CDK6",https://pathcards.genecards.org/card/regulation_of_runx1_expression_and_activity
12.45,IL2 Signaling Events Mediated By STAT5,74,24,"STAT5B, PTPN11, CCNA2, CCND2, SP1, MYC, HSP90AA1, SOCS1, MAPK14, MAPKAPK2, RPS6, RELA, JAK3, E2F1, BCL2L1, IKZF3, PIK3R1, RHOA, SYK, RAC1, FYN, GRB2, CDK2, CDK6",https://pathcards.genecards.org/card/il2_signaling_events_mediated_by_stat5
12.42,HIF-1-alpha Transcription Factor Network,65,22,"NPM1, ADM, PFKFB3, VEGFA, SP1, ABCG2, PGK1, GCK, ENG, LDHA, NDRG1, PKM, HDAC7, SLC2A1, CREB1, CXCR4, ALDOA, EDN1, BHLHE40, FURIN, TFRC, MCL1",https://pathcards.genecards.org/card/hif-1-alpha_transcription_factor_network
12.41,Glycolysis (REACTOME),93,28,"GAPDH, PFKFB2, PFKFB3, PFKM, NUP153, NUP155, NUP205, RANBP2, NUP42, NUP43, NUP50, NUP62, PGAM1, NUP85, NUP93, NUP98, MDH2, PGK1, PGM2L1, GCK, POM121, SLC25A12, PKM, GPI, ALDOA, ALDOC, TPI1, G6PC1",https://pathcards.genecards.org/card/glycolysis_(reactome)
12.39,IL-9 Signaling Pathways,169,43,"MAP2K2, MAP2K3, STAT5B, PTPN11, CCNA2, CCND1, MYC, RAPGEF1, MAPK1, SOCS1, SORBS1, NRAS, SOS2, RPS6, RPS6KA1, RPS6KA3, HLA-DOA, RELA, FOSB, JAK3, FOSL1, BCL3, PIK3CD, JUNB, JUND, MAX, PIK3R1, CREB1, AKT2, IL21R, CRK, IL6, RAC1, FYN, IL7R, GRB2, CRKL, PTEN, HRAS, CDKN1A, CDKN1B, MRAS, ELK1",https://pathcards.genecards.org/card/il-9_signaling_pathways
12.32,Direct P53 Effectors,128,35,"CARM1, CSE1L, CCNB1, MDM2, SP1, TIGAR, ZNF385A, BTG2, COL18A1, SFN, TP53, NDRG1, HIC1, BAK1, APAF1, BBC3, MET, APC, EPHA2, PRDM1, FOXA1, E2F1, TP73, TNFRSF10A, TNFRSF10B, TNFRSF10D, TGFA, FAS, MCL1, S100A2, VDR, PTEN, NFYA, DGCR8, CDKN1A",https://pathcards.genecards.org/card/direct_p53_effectors
12.32,Interleukin-4 and Interleukin-13 Signaling,108,31,"CCND1, VEGFA, MYC, HSP90AA1, HSP90B1, SOCS1, HSPA8, COL1A2, VIM, TP53, IRF4, MMP9, JAK3, BCL2L1, JUNB, PIK3R1, IL1B, FSCN1, IL23R, VCAM1, ALOX15, TGFB1, IL6, IL6R, MCL1, NANOG, LAMA5, SAA1, PTGS2, CCL22, CDKN1A",https://pathcards.genecards.org/card/interleukin-4_and_interleukin-13_signaling
12.32,Apoptosis and Survival FAS Signaling Cascades,108,31,"MAP3K5, CASP8, CFL2, VIM, MAPKAPK2, APAF1, XIAP, SUMO1, BCL2L1, BCL2L11, IKBKG, TNFRSF10A, TNFRSF10B, ACTB, ACTG1, APP, AKT2, TRAF1, PAK1, PAK2, LMNB1, CYCS, TFAP2A, LIMK1, IGF1, IGF1R, LMNB2, FAS, PARP1, DFFA, DFFB",https://pathcards.genecards.org/card/apoptosis_and_survival_fas_signaling_cascades
12.30,Sudden Infant Death Syndrome (SIDS) Susceptibility Pathways,159,41,"GAPDH, THRB, CEBPB, TAC1, SLC6A4, VEGFA, SP1, NKX2-2, HSP90B1, GCK, EN1, VIPR1, NR3C1, SLC9A3, EP300, TSPYL1, CTNNB1, YBX1, REST, TCF3, YWHAE, YWHAG, TP73, YWHAZ, FOXM1, CREB1, PRKAR2A, IL1B, AQP4, AR, ALDOA, NOS1AP, NEUROD1, BHLHE40, SSTR2, RUNX3, IL6, IL6R, G6PC1, NANOG, NFYA",https://pathcards.genecards.org/card/sudden_infant_death_syndrome_(sids)_susceptibility_pathways
12.27,Activation of AMPK Downstream of NMDARs,84,26,"RALGAPA2, SFN, STX4, CTNNB1, MYH9, YWHAE, YWHAG, YWHAZ, RAB11A, MYO5A, ACTB, ACTG1, AKT2, RAB13, RAB14, RAB4A, RAC1, LNPEP, CALM3, TUBA1B, TUBB2A, KIF3A, KIF3B, EXOC5, EXOC8, RAB10",https://pathcards.genecards.org/card/activation_of_ampk_downstream_of_nmdars
12.26,MyD88 Dependent Cascade Initiated on Endosome,175,44,"MAP2K3, TNIP2, MAP2K7, PTPN11, TAB2, NKIRAS2, MAPK1, CASP8, HSP90B1, USP14, UBA52, SOCS1, TIRAP, BTRC, TLR5, MAPK14, UBC, IRAK2, IRAK3, IRAK4, TP53, UBE2V1, MAPKAPK2, TLR6, DUSP4, DUSP6, RPS6KA1, RPS6KA3, RELA, HMGB1, IKBIP, IKBKG, PLCG2, MAVS, ECSIT, NOD2, CREB1, APP, TRAF3, TRAF6, UNC93B1, PEDS1-UBE2V1, SAA1, ELK1",https://pathcards.genecards.org/card/myd88_dependent_cascade_initiated_on_endosome
12.26,Development EGFR Signaling Pathway,154,40,"MAP2K2, MAP2K7, MDM2, MYC, MAPK1, CASP8, HSP90AA1, HBEGF, TP53, MAPK6, NRAS, SOS2, DUSP4, NRG1, NRG4, CTNNB1, XIAP, PXN, RELA, MMP9, ERBB3, IKBKG, PIK3CD, PIK3R1, AKT2, PRKCH, RHOA, RHOB, RHOC, PAK1, VAV2, VAV3, TGFA, RAC1, GRB2, CAMK2A, HRAS, MRAS, ELK1, CSK",https://pathcards.genecards.org/card/development_egfr_signaling_pathway
12.25,TP53 Regulates Transcription of Cell Cycle Genes,48,18,"NPM1, CARM1, CNOT6L, CCNA2, CCNB1, ZNF385A, BTG2, SFN, TP53, EP300, RBL1, E2F1, E2F4, E2F8, CDK1, CDK2, CDKN1A, CDKN1B",https://pathcards.genecards.org/card/tp53_regulates_transcription_of_cell_cycle_genes
12.17,Immune Response IL-2 Activation and Signaling Pathway,75,24,"MAP2K2, STAT5B, PTPN11, MYC, MAPK1, PTPN6, SOCS1, SOS2, RELA, FOSB, JAK3, HMGA1, FOSL1, FOSL2, PIK3CD, JUNB, JUND, PIK3R1, AKT2, SYK, SIRPA, GRB2, HRAS, ELK1",https://pathcards.genecards.org/card/immune_response_il-2_activation_and_signaling_pathway
12.17,Immune Response_Role of Integrins in NK Cells Cytotoxicity,44,17,"MAP2K2, MAP2K3, PTPN11, MAPK1, PTPN6, MAPK14, KLRD1, SOS2, ITGAL, PXN, LYN, PAK1, VCAM1, RAC1, GRB2, RACK1, HRAS",https://pathcards.genecards.org/card/immune_response_role_of_integrins_in_nk_cells_cytotoxicity
12.14,Integrins in Angiogenesis,57,20,"PTPN11, VEGFA, CASP8, HSP90AA1, COL1A1, COL1A2, COL5A1, TLN1, ITGB3, PXN, PIK3C2A, PIK3R1, RHOA, VAV3, VCL, IGF1R, TGFBR2, RAC1, ANGPTL3, CDKN1B",https://pathcards.genecards.org/card/integrins_in_angiogenesis
12.14,CXCR4-mediated Signaling Events,57,20,"STAT2, PTPN6, CFL1, ARRB2, HGS, PXN, MMP9, CD3E, CD4, PIK3R1, CXCR4, PAG1, PAK1, CRK, RICTOR, LIMK1, RACK1, GRK2, GRK6, CSK",https://pathcards.genecards.org/card/cxcr4-mediated_signaling_events
12.13,GADD45 Pathway,32,14,"BRCA1, CCNA2, CCNB1, CCND1, CCND2, CCNF, CCNT1, TP53, ATM, CDK1, CDK2, CDK4, CDK6, CDKN1A",https://pathcards.genecards.org/card/gadd45_pathway
12.12,Response to Elevated Platelet Cytosolic Ca2+,622,121,"DGKH, CAPZA2, SLC16A1, PTPN1, PTPN11, SERPINF2, SERPING1, STIM1, PFN1, WEE1, VEGFA, TOR4A, MAPK1, GLG1, KLC2, PTPN6, ABHD12, CFL1, F2, F2R, SLC7A11, ARRB1, ARRB2, SLC7A5, PHACTR2, GTPBP2, F2RL3, COL1A1, COL1A2, TLN1, MAPK14, IRF1, TP53, ABL1, GNAI1, GNAI2, GNAI3, ITGA2, CBX5, ITGA3, GNAS, NRAS, GNB4, ITGAL, TBXA2R, STX4, STXBP2, ITGB3, P2RX7, YES1, PLA2G4A, LYN, LGALS3BP, QSOX1, APOH, YWHAZ, PLCG2, OLR1, TNFRSF10A, CD44, MAFK, TNFRSF10B, TNFRSF10D, H3C10, PSAP, ATP2A2, PIK3R1, ACTB, ACTN4, APP, PRKAR2A, H3C14, H3C15, H3C2, H3C3, H3C4, PRKCH, ORAI2, SELPLG, ALDOA, MIF, DOCK7, PPIA, RHOA, RHOB, PDPN, VAV2, VAV3, SYK, CRK, VCL, VPS45, TFPI, TGFB1, IGF1, IGF2, RAC1, FYN, SERPINA1, SIRPA, GRB2, THBS1, CLU, CALM3, KIF18B, KIF1B, KIF1C, TUBA1B, TUBB2A, CALU, EHD3, ANGPT4, KIF2C, KIF3A, KIF3B, CDK2, KIF5B, KIF6, HRAS, GATA6, CSK",https://pathcards.genecards.org/card/response_to_elevated_platelet_cytosolic_ca2
12.12,Immune Response IL-23 Signaling Pathway,160,41,"TNIP2, STAT5B, PTPN11, MYC, MAPK1, F2, CSRP2, MAPK14, TP53, ITGA3, NRAS, SOS2, CTNNB1, PXN, RELA, BCL2L1, IKBKG, CD3E, CD4, PIK3CD, IL10RB, PLD2, PIK3R1, AKT2, IL1B, PDGFRA, PAK1, PAK2, IL23R, CRK, IL6, RAC1, FYN, GRB2, RAD51, ANGPT4, HRAS, EIF2AK2, CDKN1A, ELK1, PAK4",https://pathcards.genecards.org/card/immune_response_il-23_signaling_pathway
