Score,SuperPath Name,# SuperPath Total Genes,# SuperPath Matched Genes,Matched Genes (Symbols),Evidence URL
50.00,Prolactin Signaling,432,131,"MAP2K2, MAP2K3, CARD10, AXIN1, MAP2K7, STAT2, STAT5B, EIF4E, PTPN11, MAP3K2, BRCA1, MAP3K5, MAP3K9, CCND1, CCND2, CEBPB, VEGFA, TSC1, MDM2, MDM4, SP1, MYC, MAPK1, CASP8, HBEGF, SOCS1, FGFR1, TLR5, MAPK14, IRAK2, IRAK3, IRAK4, IRF1, TP53, NR3C1, ABL1, ABL2, MAPK6, EP300, GNAS, TLR6, NRAS, SOS2, NRG1, NRG4, CTNNB1, RPS6, RPS6KA1, MET, APC, RPS6KA3, RPS6KA4, APH1A, RELA, LYN, TCF3, JAK3, HMGB1, PIK3C2A, BCL10, ERBB3, E2F1, E2F2, E2F3, E2F4, BCL2L1, BCL2L11, ATM, IKBKG, PLCD3, PLCE1, PLCG2, PIK3CD, H3-4, PLEKHA1, H3C10, PIK3R1, PSENEN, CREB1, AKT2, PRKAR2A, SRF, H3C2, H3C3, H3C4, IL1B, PRKCH, PDGFRA, ADAM17, TRAF6, RHOA, RHOB, RHOC, PAK1, PAK2, VAV2, VAV3, CYCS, SYK, CRK, NF2, NFAT5, NFATC3, TGFA, IGF1, IGF1R, IGF2, IL6, IL6R, RAC1, FYN, FZD6, FZD7, PARP1, PARP15, ADCY1, GRB2, CALM3, CAMK2A, CRKL, PTEN, CDK2, CDK4, HRAS, CDK6, CDKN1A, CDKN1B, CDKN2A, MRAS, ELK1, PAK4",https://pathcards.genecards.org/card/prolactin_signaling
45.91,Vesicle-mediated Transport,673,175,"AAK1, CAPZA2, RALGAPA2, GAPVD1, ANKRD28, SNX2, TBC1D13, TBC1D14, TBC1D15, SAR1B, TSC1, ARPC2, TOR1B, KLC2, HSP90AA1, COG5, HBEGF, HSP90B1, ARPC3, ARRB1, ARRB2, SBF1, UBA52, HSPA8, COL1A1, COL1A2, CYTH2, CYTH3, LDLR, SFN, HGS, SCARF1, UBC, COLEC12, TBC1D24, TBC1D25, GDI1, AP1B1, AP1S1, PPP6R1, AP1S3, SGIP1, COPS7B, COPZ1, AP2M1, AP2S1, TSG101, OCRL, HIP1, AP4E1, STX4, TMED10, TMED9, USP6NL, MYH9, SLC2A8, DCTN3, DCTN4, DCTN5, DCTN6, DYNC1LI2, YIPF6, PLA2G4A, EPN1, EPN2, CTTN, DYNLL2, YKT6, CPD, FOLR1, SH3GL1, MON1B, PIK3C2A, YWHAE, YWHAG, YWHAZ, SPTBN2, SURF4, RAB11A, RAB11B, CD4, MYO5A, GJA9, GJB1, TRIP10, TRIP11, GJD3, CD55, SEC16A, SEC22C, MYO6, BET1L, ACTB, ACTG1, PACSIN1, ULK1, SEC24D, APP, VAMP3, VAMP8, AKT2, TPD52, RAB13, RAB14, RGP1, KDELR1, PLIN3, RAB27A, RAB31, OPTN, RAB3IP, ARF1, RHOBTB3, RAB4A, RAB5C, TRAPPC10, LMAN2, BICD2, NAA30, TRAPPC2, RAB9A, VTA1, VPS36, VPS37A, VPS37B, VPS37C, VPS45, MCFD2, GPS1, TFRC, TGFA, RABGAP1, RABGEF1, RIN3, BLOC1S3, RAC1, DENND2C, DENND4B, DENND5B, DENND6A, IL7R, SERPINA1, GRB2, SNAPIN, LNPEP, CALM3, CALR, KIF18B, KIF1B, KIF1C, TUBA1B, TUBB2A, GRK2, KIF2C, GRK3, KIF3A, KIF3B, EXOC5, MAN1C1, MAN2A1, MAN2A2, KIF5B, KIF6, SAA1, EXOC8, MAP1LC3B, SEC24A, ARF6, RAB5B, RAB10, RAB36, RAB1B, GGA1, RAB32, ARF3",https://pathcards.genecards.org/card/vesicle-mediated_transport
42.76,Processing of Capped Intron-Containing Pre-mRNA,755,187,"RPS19, RPL12, NUDT21, NIP7, WDR75, WDR77, STEEP1, CNOT6L, EIF4A2, EIF4A3, HSD17B10, NUP153, NUP155, NUP205, EIF4E, RAN, RANBP2, EIF4G1, NUP42, NUP43, NUP50, URM1, NUP62, MRM3, TRMT10C, NKAP, RPL13A, DICER1, POLR2A, POLR2E, POLR2F, RPL14, NUP85, NUP93, NUP98, TRMT112, PCBP2, CELF1, CSNK1E, SET, PPP2R2A, GCFC2, RPL18A, RPS27, HBS1L, U2AF2, PHAX, ANP32A, UBA52, NXT1, HSPA8, SF1, SF3A1, SF3A3, SF3B1, SF3B3, SF3B5, CSTF1, CSTF2, POM121, RPL22, FCF1, BYSL, RPS28, MAPK14, UBC, RPL36, ISG20L2, ISY1, RPL37, PRPF38A, PRPF4, RPL27, DUS2, MAPKAPK2, GEMIN4, GEMIN6, PUS3, ACIN1, RPL41, RPL28, TMED10, ZFP36, RPS4X, C1D, CHERP, RBM28, CTNNBL1, RPS6, POP1, DCP1A, DCP2, RPL30, METTL14, YBX1, RPL7A, UTP15, APOBEC3A, APOBEC3C, UTP4, RPL34, YWHAZ, CPSF7, SUPV3L1, NOB1, QTRT2, DNAJC8, RNPS1, RPL8, RPL9, DDX39B, RRP36, RRP7A, NOC4L, PABPN1, SMC1A, RPLP1, DDX6, EDC3, RPP14, AQR, ZMAT5, SRP54, NONO, SRRM2, SRSF10, SMG1, SRSF2, SRSF6, SRSF7, SMG7, SRSF9, PSMB2, PSMB5, PRMT5, PAN2, CDC5L, SYF2, PSMB9, HNRNPD, HNRNPH1, ZBTB8OS, ZC3H11A, PSMC4, PAPOLA, FTSJ3, SENP3, RPS12, HNRNPU, PSMD1, PSMD10, PSMD11, PPIL1, PPIL4, IGF2BP1, RIOK3, SMU1, IGF2BP2, IGF2BP3, FYTTD1, PSME3, EFTUD2, ADAT1, RPS16, KHSRP, RPS17, PNN, PSMF1, IMP4, PNPT1, MTO1, PTBP2, SNRNP48, SNRPA, WDR12, GRSF1, SNRPA1, SNRPB, SNRPD1, EXOSC10, EXOSC2, SNRPD2, SNRPD3, SNRPG, EXOSC6, CDKAL1, NCBP2",https://pathcards.genecards.org/card/processing_of_capped_intron-containing_pre-mrna
41.07,Deubiquitination,297,95,"MUL1, AXIN1, TNIP2, MCRS1, INO80D, INO80E, ADRM1, BRCA1, CCNA2, MDM2, MDM4, MYC, ARRB1, ARRB2, USP12, USP14, USP16, UBA52, OTUB1, HCFC1, PTRH2, USP22, USP28, HGS, OTUD5, OTUD7A, OTUD7B, UBC, TP53, EP300, BAP1, FKBP8, USP42, USP49, RNF146, APC, ASXL2, H2AC1, H2AC11, H2AC12, H2AC13, H2AC14, YOD1, H2AC18, H2AC19, H2AC20, H2AC7, H2AC8, H2BC1, H2BC11, H2BC12, H2BC13, JOSD1, H2BC17, H2BC21, RCE1, YY1, H2BC26, H2BC3, H2BC5, IKBKG, H2BC9, FOXK1, MAVS, MBD5, NOD2, IDE, ACTB, AR, TRAF3, TRAF6, RHOA, PSMB2, PSMB5, TOMM20, PSMB9, PSMC4, SENP8, PSMD1, PSMD10, PSMD11, TGFB1, SMURF2, TGFBR1, TGFBR2, PSME3, CYLD, VDAC1, VDAC2, PSMF1, RAD23A, ATXN3, CDK1, PTEN, INO80",https://pathcards.genecards.org/card/deubiquitination
41.07,Gene Silencing By RNA,190,71,"NUP153, NUP155, NUP205, RAN, RANBP2, NUP42, NUP43, NUP50, NUP62, DICER1, POLR2A, CCNB1, POLR2E, POLR2F, NUP85, NUP93, NUP98, MAPK1, SET, HSP90AA1, ARPP19, POM121, TMPO, AGO1, AGO2, AGO3, ENSA, KMT5A, CTDNEP1, TNRC6A, TNRC6B, TNRC6C, H2AC14, H2AC18, H2AC19, H2AC20, GORASP2, H2AC7, H2AC8, H2AX, H2BC1, H2BC11, H2BC12, H2BC13, H2BC17, H2BC21, H2BC26, H2BC3, H2BC5, H2BC9, H3-4, TDRKH, H3C10, H3C14, H3C15, H3C2, H3C3, H3C4, PLK1, RAB2A, NEK6, NEK9, LMNB1, CDK1, H4C15, ANG, DGCR8, H4C8, NCAPD3, NCAPG2, RAB1B",https://pathcards.genecards.org/card/gene_silencing_by_rna
40.94,Sertoli-Sertoli Cell Junction Dynamics,393,115,"MAP2K2, MAP2K3, NPR1, AXIN1, MAP2K7, PTPA, MAP3K2, MAP3K5, MAPK1, PPP2R2A, CFL1, CFL2, MYH11, MYH15, TJAP1, TJP3, CSTF1, CSTF2, CGN, MAPK14, SORBS1, MAPK6, ITGA2, OCLN, ITGA3, EPB41, NRAS, ITGAL, STX1A, STX1B, STX4, ITGB3, NECTIN1, NECTIN2, CTNNB1, MYH9, PXN, MARK2, EPN1, EPN2, CTTN, FOSB, MYL9, FOSL1, FOSL2, SPTBN2, RAB11A, RAB11B, MYO10, JUNB, JUND, MYO1D, MYO1F, MYO3A, MYO5A, MYO5C, MYO6, PIK3R1, ACTB, ACTG1, ACTN4, VAMP1, VAMP3, AKT2, PRKAR2A, RAB13, RAB14, RAB23, RAB27A, RAB2A, RAB2B, RAB31, PLPP3, PLS1, RHOA, RHOB, RHOC, PAK1, RAB4A, PAK2, RAB5C, LLGL1, CLDN12, CLDN16, CLDN4, CLDN7, MAGI3, VCL, RAB9A, LIMK1, TGFB1, TGFBR1, TGFBR2, RAC1, PARD3, RAC3, RAB3B, ARHGEF2, TUBB2A, PTEN, TUBD1, EXOC5, PATJ, CDK4, EXOC8, HRAS, MRAS, VASP, RAB17, RAB15, RAB5B, RAB10, PAK4, RAB1B, RAB32",https://pathcards.genecards.org/card/sertoli-sertoli_cell_junction_dynamics
38.86,ERK Signaling,1185,259,"MAP2K2, MAP2K3, PPP1R11, CAPN6, CAPNS1, PTK7, AXIN1, TNFSF14, MAP2K7, STAT2, STAT5B, HDGF, PPP1R14A, PPP1R15A, PTPA, MAP3K2, BRCA1, TAB2, MAP3K5, MAP3K9, WEE1, CACNG8, CCND1, CCND2, PPP1R3B, CEBPB, FERMT2, VEGFA, TSC1, MDK, MDM2, MYC, PPP1R7, TYRO3, RAPGEF1, MAPK1, KITLG, CASP8, GLG1, PPP1R9B, PPP2R2A, GCFC2, HBEGF, CFL1, CFL2, FGF19, RARA, ELK4, CDC25B, MYH11, MYH15, COL18A1, COL1A1, COL1A2, FGF5, FGFR1, COL5A1, VIM, WNK1, TLN1, MAPK14, IRAK2, IRAK3, IRAK4, LEFTY1, TP53, CCR4, ABL1, ABL2, CCR6, MAPK6, GNAI1, GNAI2, GNAI3, ITGA2, MAPK8IP2, BAK1, ITGA3, EP300, MAPK8IP3, MAPKAPK2, LTBP4, GNAS, NRAS, SOS2, HSPG2, GNB4, TBRG1, ITGAL, RBL1, NRG1, NRG4, ITGB3, SOX12, APAF1, BBC3, GFER, CTNNB1, RPS6KA1, SOX4, MYH9, MET, NRP1, APC, RPS6KA3, RPS6KA4, EPHA2, EPHA4, SPON2, PXN, APH1A, UBTF, EPHB2, TCF23, TCF3, SMAD9, FOSB, RBPJ, JAK3, MYL9, MYLK, SH3RF1, MSN, ERBB3, FOSL1, FOSL2, E2F1, E2F2, E2F3, E2F4, BCL2L1, BCL2L11, ATM, PLCD3, PLCE1, PLCG2, TNC, DDR2, MYO10, CD3E, CD4, JUNB, JUND, IL10RB, TNFRSF10A, H3-4, MYO1D, MYO1F, MYO3A, MYO5A, MAX, FPR2, TEAD1, TNFRSF10B, TNFRSF10D, H3C10, MYO6, PIK3R1, ACTB, PSENEN, ACTG1, CREB1, ACTN4, TNFRSF13C, AKT2, PRKAR2A, HNF1A, SRF, H3C2, H3C3, H3C4, ACVR2B, ACVRL1, IL1B, PRKCH, PLPP3, PDGFRA, CXCR4, ADAM17, TRAF6, NET1, PIP4K2B, PIP4K2C, RHOA, RHOB, RHOC, PAK1, PAK2, IL23R, CACNA1A, CACNA1B, CACNA1C, OSMR, CYCS, CRK, VCL, TFAM, CACNA2D2, CACNB2, LIMK1, LIMS1, LIMS2, TGFA, TGFB1, IGF1, IGF1R, IGF2, SEPTIN5, IL5RA, IL6, IL6R, TGFBR1, SEPTIN9, SNAI1, TGFBR2, RAC1, FYN, FAS, PARD3, FZD6, FZD7, IL7R, BMP2, BMP3, ADCY1, BMPR1A, GRB2, RAC3, RACK1, ARHGDIA, PARVB, MKNK2, NLK, CDH6, CDH7, RAD51, ARHGEF2, CDK1, TUBB2A, CAMK2A, PTEN, TUBD1, ANGPT4, FBLIM1, CDK2, LAMA5, CDK4, HRAS, PTGS2, PAX6, CCL22, CDK6, CDKN1A, CDKN1B, CDKN2A, MRAS, ELK1, PAK4, MEF2D",https://pathcards.genecards.org/card/erk_signaling
38.80,Apoptotic Pathways in Synovial Fibroblasts,731,178,"EIF2B5, MAP2K2, MAP2K3, PPP1R11, EIF2S3, EIF3C, CARM1, EIF3F, NCKAP1, EIF3J, MAP2K7, HDGF, PPP1R14A, PPP1R15A, EIF4A2, EIF4E, PTPA, MAP3K2, EIF4G1, PFN1, PFN2, EIF5A, CACNG8, POLR2A, PPP1R3B, MDK, MDM2, MYC, PPP1R7, RAPGEF1, MAPK1, KITLG, CASP8, GLG1, PPP1R9B, PPP2R2A, HSP90AA1, HBEGF, CFL1, CFL2, F2R, FGF19, RARA, ELK4, FGF5, TAF11, FGFR1, TAF15, WNK1, MAPK14, LEFTY1, TP53, AGO1, AGO2, ABI2, ABL1, MAPK6, GNAI1, GNAI2, GNAI3, ITGA2, BAK1, ITGA3, EP300, LTBP4, GNAS, NRAS, SOS2, GNB4, TBRG1, ITGAL, NRG1, NRG4, ITGB3, APAF1, BBC3, GFER, XIAP, RPS6KA1, MET, NRP1, RPS6KA3, RPS6KA4, PLA2G4A, MMP9, MYL9, MYLK, SH3RF1, ERBB3, YWHAE, FOSL1, YWHAG, BCL2L1, BCL2L11, ATM, YWHAZ, IKBKG, PLCE1, CD3E, TNFRSF10A, H3-4, CD44, TNFRSF10B, H3C10, CRABP2, IDE, PIK3R1, ACTB, ACTG1, CREB1, APP, AKT2, PRKAR2A, H3C2, TEP1, H3C3, H3C4, IL1B, PRKCH, TERF2, PLPP3, PDGFRA, PPARA, PPARD, NET1, PIP4K2B, PIP4K2C, RHOA, RHOB, RHOC, PAK1, PAK2, CACNA1A, CACNA1B, CACNA1C, CYCS, ALOX15, CACNA2D2, CACNB2, LIMK1, TGFA, TGFB1, IGF1, IGF1R, IGF2, IL6, TGFBR1, RXRA, RXRB, RAC1, FYN, FAS, PARD3, PARP1, BMP2, BMP3, PARP15, GRAP2, ADCY1, GRB2, RAC3, VDAC1, VDAC2, DFFA, ARHGDIA, ARHGEF2, CRKL, PTEN, H4C8, HRAS, EIF2A, EIF2AK2, CDKN2A, EIF2B3, MRAS, ELK1, PAK4, MEF2D",https://pathcards.genecards.org/card/apoptotic_pathways_in_synovial_fibroblasts
38.58,MAPK Family Signaling Cascades,588,151,"ARL2, MAP2K2, NPM1, AXIN1, STAT5B, PTPN11, RANBP2, POLR2A, CCNB1, POLR2E, POLR2F, CEBPB, PTPN3, MDM2, MYC, MAPK1, KITLG, KLB, PTPN6, NCOR1, HSP90AA1, HBEGF, FGF19, ARRB1, ARRB2, DLL4, UBA52, FGF5, STRN, RASA4, DAB2IP, FGFR1, HEYL, TLN1, FGFR1OP2, UBC, TP53, IRF4, BAG4, AGO1, AGO2, AGO3, ABHD17B, TBL1XR1, MAPK6, EP300, HIP1, MAPKAPK5, DUSP2, FKBP1A, NRAS, AGTRAP, DUSP4, FAM131B, NRG1, NRG4, ITGB3, HDAC7, KREMEN1, DUSP6, DUSP8, CTNNB1, RPS6, MYH9, MET, APC, APH1A, SPRED1, YES1, TNRC6A, TNRC6B, TNRC6C, SPRED3, LYN, RBPJ, JAK3, ATG7, BCL11A, MSN, ERBB3, ZFYVE9, BCL2L1, BCL2L11, RCE1, SPTBN2, FOXM1, PIK3CD, JUNB, MYO18A, TRIP11, PIK3R1, ACTB, PSENEN, ACTG1, MIB2, AKT1S1, CREB1, DNMT1, AKT2, PDGFRA, SHOC2, ADAM17, CDC14B, PPFIBP1, PAK1, PAK2, CDC37, NEURL1, PSMB2, PSMB5, PSMB9, VCL, TPM3, PEA15, PSMC4, RICTOR, PSMD1, PSMD10, PSMD11, FXR1, TGFA, TGFB1, IGF2BP1, TRAT1, IL5RA, IL6, IL6R, TGFBR1, TGFBR2, RAC1, FYN, PSME3, FZD6, MCL1, GRB2, KIAA1549, PSMF1, CALM3, KSR2, CDK1, CAMK2A, PTEN, KIF5B, HRAS, MPRIP, CDKN1A, CDKN1B, NCBP2, MRAS, CSK, WNT3A",https://pathcards.genecards.org/card/mapk_family_signaling_cascades
38.57,Cytokine Signaling in Immune System,787,188,"CANX, MAP2K3, EIF2S3, NPM1, TNFSF14, TNFSF15, TNIP2, TXLNA, MAP2K7, STAT2, STAT5B, EIF4A2, EIF4A3, NUP153, NUP155, NUP205, EIF4E, PTPN1, PTPN11, RANBP2, EIF4G1, NUP42, NUP43, NUP50, NUP62, TAB2, PTPN14, NKIRAS2, CCND1, VEGFA, NUP85, NUP93, NUP98, MYC, RAPGEF1, MAPK1, CASP8, IP6K2, PTPN6, GBP4, PTPN9, BRWD1, HSP90AA1, CFL1, HSP90B1, USP14, HSPA2, UBA52, SOCS1, HSPA8, COL1A2, HSPA9, BTRC, VIM, SOD2, POM121, MAPK14, UBC, IRAK2, IRAK3, IRAK4, IRF1, TP53, IRF4, ABL2, UBE2V1, KPNA2, KPNA5, KPNB1, DUS2, MAPKAPK2, NRAS, SOS2, DUSP4, STX1A, STX4, STXBP2, DUSP6, RPS6KA1, TRIM14, RPS6KA3, P4HB, YBX1, HLA-A, HLA-B, YES1, TRIM29, RELA, SUMO1, MMP9, LYN, PDCD4, JAK3, HMGB1, MSN, TCP1, BCL2L1, BCL2L11, YWHAZ, IKBIP, PDE12, IKBKG, PLCG2, CD4, PIK3CD, JUNB, IL10RB, MAVS, FPR1, CD44, H3C10, NOD2, PIK3R1, CREB1, APP, TNFRSF13C, AKT2, H3C14, H3C15, H3C2, H3C3, H3C4, IL1B, FSCN1, EDARADD, IFITM3, TRAF3, MIF, ADAM17, TRAF6, TOLLIP, ARF1, IL20RB, PPIA, IL21R, PAK2, IL23R, IFNAR2, PSMB2, PSMB5, PITPNA, LMNB1, OSMR, VCAM1, FANCA, SYK, CRK, PSMB9, MTAP, IFNLR1, PSMC4, ALOX15, PSMD1, PSMD10, PSMD11, IL36B, TGFB1, IL5RA, IL6, IL6R, FANCM, FYN, PSME3, PEDS1-UBE2V1, MCL1, IL7R, GRAP2, GRB2, ILF3, NANOG, PSMF1, PTAFR, CDK1, TUBA1B, TUBB2A, CAMK2A, CRKL, SNRPA1, LAMA5, SAA1, HRAS, PTGS2, CCL22, EIF2AK2, CDKN1A, CDKN1B, ELK1, CSK",https://pathcards.genecards.org/card/cytokine_signaling_in_immune_system
38.51,Nervous System Development,1269,273,"RPS19, MAP2K2, SALL1, CAPNS1, RPL12, CARM1, ADIRF, CNOT6L, LCE1A, EIF4A2, EIF4A3, EIF4E, PTPN11, EIF4G1, PFN1, DSG3, PFN2, RPL13A, DICER1, CACNG8, POLR2A, POLR2E, POLR2F, CEBPB, RPL14, ARPC2, MYC, MAPK1, NKX2-2, NKX2-5, MED12, NCOR1, EZH2, HSP90AA1, RPL18A, KLF4, RPS27, MED17, HSP90AB1, CFL1, ARPC3, GCK, RARA, ENAH, UBA52, MYH11, HSPA8, FGFR1, COL5A1, MED23, MED24, SPI1, RPL22, TLN1, ZEB2, RPS28, MAPK14, UBC, LEFTY1, RPL36, TP53, AGO2, MED26, MED28, MED29, KMT2A, KMT2C, KMT2D, ABL1, ABL2, ABLIM1, TBL1XR1, MED7, RPL37, ITGA2, RBBP4, AP2M1, AP2S1, EP300, RPL27, NRAS, SOS2, WT1, RPL41, STX1A, STX1B, ITGB3, RPL28, RPS4X, ZNF638, CTNNB1, RPS6, RPS6KA1, MYH9, MET, NRP1, RPL30, SLIT1, SLIT3, RPS6KA3, RPS6KA4, PIAS2, PKP1, EPHA2, EPHA4, APH1A, EPHB2, TRPC5, DCX, LFNG, YES1, RPL7A, RELA, H2AC14, MMP9, TAL1, LYN, H2AC18, H2AC19, H2AC20, SDCBP, LYPLA2, TCF3, H2AC7, H2AC8, RBPJ, MSI1, H2AX, MYL9, H2BC1, KRT8, MSN, RPL34, RPTN, FOXA1, FOXC1, H2BC11, H2BC12, H2BC13, E2F1, PRSS8, H2BC17, H2BC21, YY1, H2BC26, H2BC3, H2BC5, SPTBN2, GIT1, SUZ12, MYO10, ONECUT3, H2BC9, ZIC2, PIK3CD, RNPS1, RPL8, RPL9, NTN1, FOXP1, PRX, TEAD1, H3C10, PABPN1, PIK3R1, ACTB, PSENEN, ACTG1, POU3F1, POU3F3, CREB1, RPLP1, AKT2, PRKAR2A, HNF1A, SRF, SRGAP1, H3C14, H3C15, H3C2, H3C3, H3C4, ACVR2B, CXCR4, PPARA, SEMA3E, KDM5A, PAGR1, NEO1, KDM6B, DOK6, CLASP1, RHOA, RHOB, RHOC, PAK1, PAK2, NEUROD1, PLXNA1, PLXNA2, PLXNA3, PSMB2, PSMB5, PITPNA, CACNA1C, VAV2, VAV3, PLXND1, PSMB9, SEMA7A, UNC5A, UNC5B, UNC5C, UNC5D, PSMC4, TFAP2A, TFAP2B, TFAP2C, FURIN, RPS12, PSMD1, PSMD10, CACNB2, PSMD11, NFASC, NAB2, LIMK1, TGFB1, DEK, PMP22, KRTAP19-1, SMYD1, IL6R, HOXB3, SNAI1, RXRA, RAC1, FYN, EFNA1, PSME3, EFNA3, ARHGAP39, RPS16, GRB2, RPS17, NANOG, PSMF1, KRTAP9-6, SIX1, TUBA1B, TUBB2A, H4C15, HOXC4, HOXD11, HOXD3, CDK19, CDK2, H4C8, PAX2, CDK4, HAND1, HRAS, PAX6, DPYSL2, DPYSL5, CDKN1A, NCBP2, VASP, GATA6, PAK4, MEF2D, WNT3A, NOTO",https://pathcards.genecards.org/card/nervous_system_development
37.67,DNA Damage,296,92,"NPM1, CDT1, PTPA, BRCA1, WEE1, CCNA2, POLR2A, CCNB1, CCND1, CCND2, CCNF, TACC3, MDM2, BRIP1, TIGAR, SESN2, BRSK1, PPP2R2A, CENPI, ARPP19, USP1, CDC25B, ANP32A, OTUB1, HCFC1, VIM, TMPO, SFN, PTTG1, BUB3, TP53, ENSA, DTX3L, CCAR2, PHLDA3, XRCC5, XRCC6, HJURP, APEX1, TRIM28, TRIM29, FOSB, H2AX, HUS1, YWHAE, YWHAG, E2F1, TP73, ATM, YWHAZ, YY1, TDP1, FOXM1, JUNB, ERCC6L, PRIM1, PRIM2, SMC1A, APTX, SPART, PLK1, TERF2, ORC1, SMG1, ORC6, CABIN1, CDC37, CDC45, FANCA, CDC73, TFAP2C, RIF1, PPM1D, ADD1, RAD18, RAD23A, MKI67, MCM4, MCM7, RPA1, RAD51, CDK1, CDK16, CDK2, CDK4, DYRK2, CDK6, NCAPD3, CDKN1A, CDKN1B, CDKN2A, MRE11",https://pathcards.genecards.org/card/dna_damage
37.42,Chromatin Regulation / Acetylation,255,83,"CARM1, POLR1A, DR1, WDR77, BRD4, BRD7, TIAL1, POLR2A, SP1, POLR3A, SETD1A, MED12, NCOR1, EZH2, SETD1B, CENPI, HCFC1, TAF15, TMPO, CCNT1, NR3C1, MED26, KMT2A, KMT2B, KMT5A, TBL1XR1, PHF19, CBX5, CBX8, RBBP4, DTX3L, EP300, CCAR2, CHD1L, CHD4, CHD7, HDAC7, H1-4, METTL14, HJURP, RNF20, H2AC1, TRIM28, RELA, H2AC13, MSL2, H2AX, HMGA1, HMGA2, HMGB1, JARID2, RNF40, H2BC3, SUZ12, SMARCAD1, HMGN2, SMARCC2, SMC1A, DNMT1, AR, HNRNPA0, PAF1, KDM2B, KDM5A, KDM5C, KDM6B, CABIN1, DOT1L, PRMT5, TFAM, SSU72, DEK, IGF2BP3, BMI1, CLOCK, TUBA1B, EWSR1, MLLT1, MLX, ING1, NCAPD3, MTA1, MBD3",https://pathcards.genecards.org/card/chromatin_regulation__acetylation
33.66,ESR-mediated Signaling,298,89,"ARL4C, CARM1, AXIN1, USF2, POLR2A, POLR2E, CCND1, POLR2F, SP1, MYC, ABCG8, MAPK1, NCOR1, HSP90AA1, HBEGF, HSP90AB1, RARA, STRN, TLE3, CCNT1, AGO1, AGO2, AGO3, TBL1XR1, GNAI1, GNAI2, GNAI3, EP300, KPNA2, NRAS, GNB4, FKBP5, TNRC6A, TNRC6B, TNRC6C, H2AC14, MMP9, H2AC18, H2AC19, H2AC20, H2AC7, H2AC8, FOSB, H2AX, MYLIP, H2BC1, FOXA1, H2BC11, H2BC12, H2BC13, H2BC17, H2BC21, YY1, H2BC26, H2BC3, H2BC5, H2BC9, JUND, H3C10, CRABP2, PIK3R1, CREB1, SMC1A, RDH10, RDH11, AKT2, SRF, H3C14, H3C15, H3C2, H3C3, H3C4, PPARD, PDHB, PDHX, EEPD1, TGFA, IGF1R, RXRA, RXRB, FASN, CALM3, H4C15, ANGPTL3, S1PR3, H4C8, HRAS, CDKN1B, ELK1",https://pathcards.genecards.org/card/esr-mediated_signaling
33.30,Transport of The SLBP Independent Mature MRNA,319,93,"NPM1, THRA, THRB, WDR77, EIF4A2, EIF4A3, NUP153, NUP155, NUP205, EIF4E, RAN, RANBP2, EIF4G1, BRCA1, NUP42, NUP43, NUP50, NUP62, POLR2A, CCNB1, POLR2E, POLR2F, NUP85, NUP93, NUP98, MDM2, RANGAP1, SATB2, GCK, RARA, PHAX, UBA52, POM121, TMPO, PHC2, UBC, TP53, NR3C1, HIC1, CBX5, CBX8, EP300, KPNA2, KPNA5, KPNB1, CTDNEP1, GEMIN4, GEMIN6, HDAC7, RNF168, PIAS2, PIAS4, TRIM28, RELA, SUMO1, SUMO2, HMGA1, IKBKG, SUZ12, PABPN1, SMC1A, DNMT1, PLK1, AR, NEK6, NEK9, PPARA, ZNF350, PRMT5, LMNB1, SENP2, TFAP2A, TFAP2B, TFAP2C, RXRA, PARK7, PARP1, BMI1, VDR, RPA1, CDK1, H4C15, H4C8, SNRPB, SNRPD1, SAE1, SNRPD2, SNRPD3, SNRPG, EIF2AK2, CDKN2A, NCBP2, MTA1",https://pathcards.genecards.org/card/transport_of_the_slbp_independent_mature_mrna
32.71,Signaling By Receptor Tyrosine Kinases,532,134,"MUC20, MAP2K2, PTK6, NCKAP1, STAT5B, PTPN1, PTPN11, TAB2, TIAL1, DIAPH1, POLR2A, POLR2E, POLR2F, VEGFA, PTPN3, MDK, MYC, RAPGEF1, MAPK1, KITLG, KLB, PTPN6, NCOR1, HSP90AA1, HBEGF, PTPRF, FGF19, UBA52, SOCS1, COL1A1, COL1A2, FGF5, FGFR1, COL5A1, VGF, HGS, MAPK14, UBC, ABI2, ITGA2, AP2M1, AP2S1, ITGA3, EP300, MAPKAPK2, SGK1, NRAS, DUSP4, RBFOX2, NRG1, NRG4, ITGB3, CHD4, MEMO1, DUSP6, CTNNB1, RPS6KA1, MET, NRP1, RPS6KA3, PXN, APH1A, PRDM1, SPRED1, YES1, EPN1, MMP9, LYN, REST, FOSB, SH3GL1, JAK3, RRAD, ERBB3, FOSL1, RNF41, GIPC1, JUNB, JUND, TNS4, IDE, PIK3R1, ACTB, PSENEN, ACTG1, CREB1, FAM83A, FAM83D, DNMT1, AKT2, SRF, PDGFRA, PAG1, ADAM17, DOCK7, ARC, RHOA, PAK1, RAB4A, PAK2, CYBA, CDC37, VAV2, VAV3, CRK, HNRNPH1, FURIN, RICTOR, NAB2, ATP6V0D2, TGFA, IGF1, IGF1R, IGF2, ATP6V1B2, ATP6V1E1, RAC1, FYN, WASF2, GRAP2, GRB2, GABRB2, THBS1, THBS2, CALM3, EGR3, CRKL, LAMA5, HRAS, NCBP2, ARF6, ELK1, MEF2D, CSK",https://pathcards.genecards.org/card/signaling_by_receptor_tyrosine_kinases
32.47,Cytoskeletal Signaling,308,90,"LASP1, RAN, PFN1, DIAPH1, FERMT2, NUP98, STK4, CFL1, ENAH, SCAI, VIM, TJP3, TMPO, TLN1, CAVIN1, DBN1, AP2M1, KPNA2, KPNB1, BAP1, FLOT1, MYH9, MARCKSL1, PXN, MARK2, DCX, CTTN, MYL9, ZFYVE26, KRT8, MSN, ERC1, RAB11A, RAB11B, ATP1A1, MYO6, ACTB, ACTG1, SRCIN1, ACTN4, SRF, FSCN1, RAB27A, ARC, RHOA, RHOB, RHOC, PAK1, RAB4A, PAK2, LLGL1, CDC37, PDPN, LMNB1, VAV2, VAV3, VCL, RAB9A, NF2, LIMK1, LIMS1, TFRC, IGF2BP1, RAC1, LMNB2, ARHGAP31, WASF2, ARHGAP42, RAC3, RACK1, VDAC1, VDAC2, ADD1, ARHGDIA, LPP, LIMD1, ARHGEF2, KIF1B, TUBA1B, TUBB, KIF3A, KIF3B, LPXN, DPYSL2, MPRIP, VASP, SEC24A, ARF6, RAB10, PAK4",https://pathcards.genecards.org/card/cytoskeletal_signaling
32.32,SARS-CoV-2 Infection,414,111,"CANX, RPS19, NPM1, LARP1, STAT2, NUP153, NUP155, NUP205, PTPN11, RANBP2, NUP42, NUP43, NUP50, NUP62, BRD4, TAB2, HAVCR1, GATAD2A, VEGFA, NUP85, NUP93, NUP98, PCBP2, SAR1B, SP1, PTPN6, HSP90AA1, RPS27, HSP90AB1, ANO7, UBA52, ZDHHC5, ZDHHC8, POM121, SFN, RPS28, UBC, IRAK2, NR3C1, ISCU, UBE2V1, RBBP4, AP2M1, AP2S1, EP300, KPNA2, KPNB1, GEMIN4, GEMIN6, FKBP1A, HSPG2, CHD4, RPS4X, RPS6, NRP1, HLA-A, HLA-B, RELA, SUMO1, REST, ATG14, JAK3, YWHAE, YWHAG, BCL2L1, YWHAZ, IKBKG, PLCG2, GPC4, MGAT4A, MGAT5, MAVS, ATP1A1, NOD2, SEC24D, AKT2, MBL2, VPS18, TRAF3, TRAF6, PPIA, IFNAR2, PPIB, SYK, MTA3, FURIN, RPS12, VPS39, VPS45, FXYD1, IL6R, SIKE1, PEDS1-UBE2V1, G3BP1, ST3GAL2, RPS16, GRB2, RPS17, ST6GALNAC3, TUBB, CNBP, MAN2A1, SNRPB, SNRPD1, MAP1LC3B, SNRPD2, SNRPD3, SNRPG, SEC24A, MTA1, MBD3",https://pathcards.genecards.org/card/sars-cov-2_infection
32.29,Pleural Mesothelioma,409,110,"MAP2K2, MAP2K3, AXIN1, MAP2K7, MAP3K2, EIF4G1, BRCA1, MAP3K5, MAP3K9, CCND1, CCND2, MAP4K2, VEGFA, TSC1, MDK, MDM2, MDM4, SP1, CSNK1E, MYC, MAPK1, KITLG, EZH2, HBEGF, FGF19, SLC7A5, SETD5, FGF5, BTRC, HCFC1, FGFR1, VGLL4, MAPK14, TP53, NDRG1, KMT2C, ITGA2, WNT3, RBBP4, BAK1, ITGA3, MAPKAPK2, BAP1, ITGB3, KREMEN1, BBC3, CTNNB1, RPS6, RPS6KA1, MET, APC, SLC2A1, RPS6KA3, DVL3, EPHA2, MMP9, HMGB1, FOSL1, E2F1, ATM, YY1, SUZ12, FOXM1, PIK3CD, MAX, FRAT2, CD44, TEAD1, ACTB, ACTG1, AKT1S1, CREB1, ULK1, AKT2, IL1B, PDGFRA, MINK1, PAK1, PAK2, CYCS, SENP2, NF2, TGFA, TGFB1, IGF1, IGF1R, IGF2, IL6, EFNA1, EFNA3, FZD6, FZD7, BMI1, GRB2, MKNK2, LIMD1, PODXL, PTEN, ANGPT4, CDK2, LAMA5, CDK4, WNT7B, HRAS, CDKN1A, CDKN2A, ELK1, PAK4, MEF2D, WNT3A",https://pathcards.genecards.org/card/pleural_mesothelioma
31.79,Mitotic G1 Phase and G1/S Transition,149,55,"PTK6, CDT1, MYBL2, WEE1, CCNA2, CCNB1, CCND1, CCND2, MYC, PPP2R2A, UBA52, TK1, UBC, ABL1, RBBP4, RBL1, LYN, E2F1, E2F2, E2F3, E2F4, E2F6, MAX, RRM2, PRIM1, PRIM2, AKT2, ORC1, ORC4, ORC6, CKS1B, PSMB2, PSMB5, CDC45, PSMB9, PSMC4, PSMD1, PSMD10, PSMD11, PSME3, LIN52, LIN9, PSMF1, MCM4, MCM5, MCM7, RPA1, MCM8, CDK1, CDK2, CDK4, CDK6, CDKN1A, CDKN1B, CDKN2A",https://pathcards.genecards.org/card/mitotic_g1_phase_and_g1s_transition
31.67,Cell Cycle Checkpoints,292,86,"RANBP2, TOP3A, BRCA1, NUP43, WEE1, CCNA2, CCNB1, NUP85, NUP98, MDM2, MDM4, RANGAP1, BRIP1, SPC24, ZNF385A, RPS27, CENPI, UBA52, CENPM, CENPN, CENPO, DSN1, BUB1, SFN, DNA2, BUB3, UBC, NDE1, NDEL1, TP53, KNL1, SGO1, RNF168, PIAS4, DYNC1LI2, NSD2, DYNLL2, H2AX, H2BC1, HUS1, YWHAE, YWHAG, H2BC11, H2BC12, H2BC13, H2BC17, H2BC21, ATM, YWHAZ, H2BC26, H2BC3, H2BC5, H2BC9, RFC2, ERCC6L, H3-4, TAOK1, PLK1, ORC1, ORC4, ORC6, CLASP1, PSMB2, PSMB5, CDC45, PSMB9, PSMC4, PSMD1, PSMD10, PSMD11, PSME3, PSMF1, MCM4, MCM5, MCM7, RPA1, MCM8, CDK1, H4C15, KIF2C, CDK2, H4C8, CDKN1A, CDKN1B, CDKN2A, MRE11",https://pathcards.genecards.org/card/cell_cycle_checkpoints
31.01,HCMV Infection,160,57,"NUP153, NUP155, NUP205, RANBP2, NUP42, NUP43, NUP50, NUP62, NUP85, NUP93, NUP98, NCOR1, EZH2, POM121, TBL1XR1, RBBP4, TSG101, DYNC1LI2, H2AC1, H2AC11, H2AC12, TRIM28, H2AC13, H2AC14, DYNLL2, H2AC18, H2AC19, H2AC20, H2AC7, H2AC8, H2BC1, H2BC11, H2BC12, H2BC13, H2BC17, H2BC21, H2BC26, H2BC3, H2BC5, SUZ12, H2BC9, H3C10, CREB1, H3C14, H3C15, H3C2, H3C3, H3C4, VPS36, VPS37A, VPS37B, VPS37C, TUBA1B, TUBB2A, H4C15, H4C8, ELK1",https://pathcards.genecards.org/card/hcmv_infection
30.83,Class I MHC Mediated Antigen Processing and Presentation,854,190,"CANX, GAN, CAPZA2, MUL1, NPLOC4, FBXL8, FBXO17, PTPN11, FEM1A, FEM1B, BRCA1, STIM1, TAB2, FBXO31, WDTC1, CCNF, SAR1B, KLC2, PTPN6, UBA1, ENAH, UBA5, UBA52, KLHL21, KLHL3, SOCS1, COL1A1, COL1A2, BTLA, TIRAP, BTN3A2, BTRC, FBXW2, FBXW8, UBC, UBE2D4, COLEC12, UBE2G1, UBE2Q1, KLRD1, AP1B1, ASB16, ASB8, AP1S1, RNF115, COMMD4, COMMD9, AP1S3, UBE2V1, COPS7B, AP2M1, AP2S1, DTX3L, DCAF10, DCAF11, UBE2Z, RBCK1, RNF130, TLR6, FKBP1A, NRAS, WSB1, ITGAL, DCAF16, DCAF5, UBOX5, STX4, DCAF7, DCAF8, CD1D, CD209, NECTIN2, PIANP, CTSA, DCTN3, DCTN4, DCTN5, DCTN6, RNF19B, DCUN1D2, DDA1, HLA-A, HLA-B, YES1, HLA-DOA, DYNC1LI2, RNF217, RELA, TRIM41, DYNLL2, LYN, ATG14, MYLIP, HUWE1, HMGB1, ATG7, ERAP2, BCL10, SH3RF1, C3, RNF4, RNF41, YWHAZ, SPSB1, SPTBN2, CD300LG, IKBKG, PLCG2, CD3E, CD4, PIK3CD, ICOSLG, ZBTB16, LILRA2, PIK3R1, ASB6, MIB2, MICA, MICB, ULBP3, SEC24D, VAMP3, VAMP8, AKT2, SEC61A1, KCTD7, KBTBD6, ORAI2, PAG1, TRAF6, TRAF7, AREL1, ARF1, PPIA, PAK1, PAK2, CYBA, OSCAR, PSMB2, PSMB5, VCAM1, SYK, PSMB9, SIGLEC12, ZNRF1, ZNRF2, PSMC4, SENP8, RICTOR, PSMD1, PSMD10, PSMD11, NFATC3, SIGLEC9, GPS1, TRAT1, SMURF2, RAC1, FYN, PSME3, SIPA1, FZR1, PEDS1-UBE2V1, GRAP2, NPEPPS, GRB2, PSMF1, LNPEP, LONRF1, CALM3, CALR, RAET1E, TUBA1B, TUBB2A, PTEN, DPP3, KIF2C, KIF3A, KIF3B, KIF5B, HRAS, ARIH2, FBXL13, FBXL16, FBXL18, FBXL19, CDKN1A, VASP, SEC24A, CSK",https://pathcards.genecards.org/card/class_i_mhc_mediated_antigen_processing_and_presentation
30.05,Assembly of The Pre-replicative Complex,314,89,"AXIN1, CDT1, PTPN11, CCNA2, CCND1, CCND2, SETD1A, UBA52, SPI1, DNA2, PHC2, UBC, AGO1, AGO2, AGO3, KMT2A, KMT2B, KMT2C, KMT2D, ABL1, CBX8, OCLN, EP300, KPNB1, TNRC6A, TNRC6B, TNRC6C, H2AC14, TAL1, H2AC18, H2AC19, H2AC20, TCF3, H2AC7, H2AC8, H2AX, MYL9, H2BC1, H2BC11, H2BC12, H2BC13, TP73, H2BC17, H2BC21, GINS2, GINS3, H2BC26, H2BC3, H2BC5, H2BC9, RFC2, PRIM1, PRIM2, H3C10, SMARCC2, H3C14, H3C15, H3C2, H3C3, H3C4, ORC1, ORC4, ORC6, PSMB2, PSMB5, CDC45, PSMB9, PSMC4, RUNX2, PSMD1, PSMD10, PSMD11, PSME3, FZR1, BMI1, THBS1, PSMF1, MCM4, MCM5, MCM7, RPA1, MCM8, H4C15, CDK2, H4C8, POLD3, PAX5, CDK6, CBX6",https://pathcards.genecards.org/card/assembly_of_the_pre-replicative_complex
29.65,Homology Directed Repair,346,95,"NPLOC4, POLL, POLM, POLQ, MCRS1, INO80D, INO80E, TOP3A, BRCA1, WEE1, CCNA2, POLR2A, CCNB1, POLR2E, POLR2F, BRIP1, TIMELESS, USP1, UBA52, TIPIN, PPP4C, SFN, DNA2, UBC, TP53, ASCC2, ABL1, ISY1, COPS7B, EP300, KPNA2, BAP1, CHD1L, RNF168, DCLRE1B, XRCC2, PIAS4, XRCC3, XRCC5, XRCC6, APEX1, SLX4, NSD2, H2AC14, SUMO1, SUMO2, H2AC18, H2AC19, H2AC20, MSH3, H2AC7, H2AC8, H2AX, H2BC1, HUS1, YWHAE, YWHAG, H2BC11, H2BC12, H2BC13, RNF4, H2BC17, H2BC21, ATM, YWHAZ, YY1, H2BC26, H2BC3, H2BC5, TDP1, H2BC9, RFC2, H3-4, ACTB, AQR, TERF2, FANCA, ALKBH5, RIF1, GPS1, SMUG1, FANCM, PARP1, PARP2, RAD18, RAD23A, RPA1, RAD51, CDK1, H4C15, CDK2, H4C8, INO80, POLD3, MRE11",https://pathcards.genecards.org/card/homology_directed_repair
29.50,Endometrial Cancer,201,65,"MAP2K2, AXIN1, STAT5B, CCND1, VEGFA, MDM2, MYC, STK4, MAPK1, CASP8, FGFR1, TP53, BAK1, NRAS, SOS2, BBC3, DUSP6, CTNNB1, APC, PXN, RELA, MSH3, JAK3, E2F1, E2F2, E2F3, BCL2L1, BCL2L11, IKBKG, PLCG2, PIK3CD, NTN1, CRABP2, PIK3R1, CREB1, AKT2, RHOA, PAK1, PAK2, CYCS, MAGI3, VCL, TGFA, TGFB1, IGF1, IGF1R, TGFBR1, TGFBR2, RXRA, RXRB, RAC1, GRB2, RAC3, RAD51, CALM3, PTEN, GRIN2A, CDK4, HRAS, PTGS2, CDK6, CDKN1A, CDKN2A, ELK1, PAK4",https://pathcards.genecards.org/card/endometrial_cancer
