Score,SuperPath Name,# SuperPath Total Genes,# SuperPath Matched Genes,Matched Genes (Symbols),Evidence URL
29.19,Pre-NOTCH Expression and Processing,235,72,"CCND1, TACC3, MDK, MYC, NCOR1, ARRB1, ARRB2, DLL4, UBA52, B4GALT1, HEYL, TLE3, UBC, TP53, AGO1, AGO2, AGO3, TBL1XR1, EP300, HDAC7, APH1A, YBX1, LFNG, TNRC6A, TNRC6B, TNRC6C, H2AC14, H2AC18, H2AC19, H2AC20, H2AC7, H2AC8, RBPJ, H2AX, H2BC1, H2BC11, H2BC12, H2BC13, E2F1, E2F3, H2BC17, H2BC21, YWHAZ, H2BC26, H2BC3, H2BC5, H2BC9, H3C10, ATP2A2, PSENEN, MIB2, CREB1, H3C14, H3C15, H3C2, H3C3, H3C4, ADAM17, NEURL1, PSMB2, PSMB5, PLXND1, PSMB9, PSMC4, FURIN, PSMD1, PSMD10, PSMD11, PSME3, PSMF1, H4C15, H4C8",https://pathcards.genecards.org/card/pre-notch_expression_and_processing
29.07,Metabolism,2127,398,"SLC5A6, RPS19, GAPDH, GSTM3, RPL12, DHODH, CARM1, ADK, ADO, NUDT3, NUDT8, PFAS, EXT1, LARS1, MVK, GART, BPNT1, GLB1L3, GLCE, SLC16A1, DHTKD1, PFKFB2, PFKFB3, PFKM, ABCB7, HSD17B10, INSIG1, ABCC1, NUP153, NUP155, NUP205, RAN, RANBP2, LRP10, HSD17B12, NUP42, NUP43, NUP50, ABCC5, NUP62, MRI1, RPL13A, PGAM1, RPL14, NUP85, NUP93, NUP98, TRMT112, SAR1B, MDH2, SP1, GBA1, BRIP1, ABCG2, SLC6A8, GBA2, NQO2, IP6K1, IP6K2, MED12, PGK1, NCOR1, PGM2L1, HSP90AA1, RPL18A, RPS27, MED17, HSP90AB1, SLC19A3, GCK, GCLM, SLC7A5, ARSA, BTD, B3GNT7, SBF1, DLST, UBA52, B4GALT1, ARSK, LDHA, ABHD14B, LDLR, HEXA, TK1, MED23, OAZ1, MED24, GLO1, AS3MT, POM121, STS, RPL22, AOC3, GDE1, GLUL, GLYAT, RPS28, DAO, UBC, FH, NDOR1, RPL36, CHAC1, NDST1, MED26, MED28, MED29, ABHD5, NDUFA2, ELOVL1, ISCA1, NDUFA3, ISCU, NDUFA7, FAHD1, NDUFAF3, TBL1XR1, MED7, ISYNA1, RPL37, ENTPD5, GNAI1, GNAI2, SLC25A12, NDUFB11, SLC25A16, CBS, ENTPD7, VKORC1, SLC25A32, ACACA, PPT1, ACADSB, HILPDA, EP300, AGPAT5, AGPS, RPL27, KPNB1, OCRL, MAPKAPK2, FITM2, SGMS2, GNAS, SGPL1, SGPP2, ACBD7, CERS1, CERS2, CERT1, HSPG2, AGXT2, GNB4, NDUFB5, SLC26A2, SLC27A1, PKM, RPL41, PHKG2, STX1A, NDUFS2, NDUFS5, DCAKD, NRF1, FLAD1, NDUFV3, RPL28, AHCY, AHR, RPS4X, PHYKPL, COX15, SCO1, COX18, COX19, ACOT2, FLVCR1, RPS6, ACOX1, PI4K2B, SLC2A1, RPL30, CTPS1, PIAS4, CTSA, SULT1B1, PYCR1, NME1-NME2, ITPKC, CES2, CES3, UCK2, GGPS1, SLC35D2, PLA2G4A, COX6B1, RPL7A, ACSL6, AIMP1, UST, IVD, IYD, NMNAT2, SUMF2, AK2, QDPR, SUMO2, UGT2B4, AK4, NT5C, APOC3, SDHC, MOCS1, CHST12, MOGAT1, MOGAT3, PIK3C2A, BCKDK, NT5C2, CHST3, NT5C3A, MSMO1, MFSD2A, RPL34, LYVE1, GPAT4, CHST6, PRELP, MAT1A, LHPP, CIAO1, PLCD3, PLCE1, PLCG2, NUBP1, NUBPL, GPC4, CIAPIN1, SPTLC2, OMD, SPTLC3, PIK3CD, RPL8, RPL9, TNFAIP8, TNFAIP8L1, LIAS, PLD2, PLD3, RFK, RRM2, PLEKHA1, PLEKHA3, CD44, PRXL2B, PSAP, PSAT1, ECSIT, TPST2, IDH3G, PIK3R1, AKR1D1, GPI, RDH11, SRD5A3, SEC24D, ATP5F1A, RPLP1, PRKAR2A, MID1IP1, RAB14, PLIN3, SRM, ALDH1B1, SHMT1, SHMT2, PLPP3, PPARA, PPARD, PDHB, PDHX, ALDH9A1, ALDOA, ALDOC, UMPS, N6AMT1, ATP5F1B, MBOAT2, MIGA1, MIGA2, CKB, PAICS, KDSR, PIP4K2B, PIP4K2C, ORMDL2, ARF1, PISD, MIOX, RAB4A, CYB5B, OSBPL10, OSBPL2, PDP2, PSMB2, PSMB5, CACNA1A, CACNA1C, PITPNM3, CYCS, PDSS1, PSMB9, PDXK, PANK1, PANK3, MTAP, TPI1, PSMC4, ALOX15, CACNA2D2, ALPI, RPS12, FUT1, FUT2, PSMD1, PSMD10, CACNB2, PSMD11, FUT9, FXN, RIMKLB, PPIP5K2, DEGS1, GPT2, AMD1, RXRA, RXRB, SLC46A1, PSME3, CYP11A1, FASN, SERINC1, ETFDH, G6PC1, G6PD, MTHFD1, MTHFD1L, MTHFD2, MTMR10, ADCY1, MTMR12, ST3GAL2, RPS16, RPS17, VDAC1, VDR, PNPLA3, CLOCK, PSMF1, PPM1L, PNPLA6, PNPLA7, CYP2B6, CALM3, CMBL, CYP2C19, PTDSS2, PTEN, LPCAT1, NFYA, MLX, CDK19, UQCR11, UQCRB, MMAB, PTGES2, HAAO, HACD2, HACD4, UQCRQ, HPSE, INMT, CYP2W1, PTGIS, PTGR2, PTGS1, PTGS2, CYP4A11, CYP4A22, HS3ST1, GSR, SEC24A, SRD5A1, FMO1, CDS2, ARF3, MTHFR",https://pathcards.genecards.org/card/metabolism
28.89,Chromatin Organization,270,79,"CARM1, DR1, MCRS1, WDR77, CCND1, GATAD2A, MEAF6, VPS72, BRPF1, SETD1A, BRWD1, NCOR1, EZH2, SETD3, HCFC1, USP22, KMT2A, KMT2B, KMT2C, KMT2D, KMT5A, TBL1XR1, RBBP4, EP300, EP400, CHD4, NSD1, H2AC1, H2AC11, H2AC12, RELA, NSD2, H2AC13, H2AC14, ATF7IP, H2AC18, H2AC19, H2AC20, JADE2, REST, H2AC7, H2AC8, MSL2, H2AX, H2BC1, H2BC11, H2BC12, H2BC13, H2BC17, H2BC21, H2BC26, H2BC3, H2BC5, SUZ12, H2BC9, H3C10, ACTB, SMARCC2, PADI1, H3C14, H3C15, H3C2, H3C3, H3C4, KDM2A, KDM2B, KDM5A, KDM5C, KDM6B, DOT1L, PRMT5, MTA3, CLOCK, H4C15, H4C8, CDK4, ARID5B, MTA1, MBD3",https://pathcards.genecards.org/card/chromatin_organization
28.48,CKAP4 Signaling Pathway Map,108,43,"MAP2K2, DKK3, BRCA1, CCNB1, CCND1, MDM2, SP1, MYC, ABCG2, MAPK1, CASP8, GLI2, VIM, MAPK14, TP53, OCLN, APAF1, DUSP6, CTNNB1, RELA, MMP9, E2F1, BCL2L11, ATM, TNFRSF10A, CD44, TNFRSF10B, TRAF1, MIF, TGFB1, IL6R, TGFBR1, SNAI1, TGFBR2, FAS, PARD3, BMI1, NANOG, CDK1, PTEN, CDK4, CDKN1B, WNT3A",https://pathcards.genecards.org/card/ckap4_signaling_pathway_map
27.84,Signaling Events Mediated By HDAC Class I,118,45,"THRA, WDR77, MXD1, NUP153, RAN, RANBP2, NUP62, GATAD2A, RANGAP1, NCOR1, HSP90AA1, RARA, BTRC, NR3C1, RBBP4, EP300, CHD4, HDAC7, RELA, SUMO1, H2AC20, REST, YWHAE, H2BC21, YY1, BCOR, H3-4, MAX, SRF, H3C14, H3C15, PPARA, NONO, PRMT5, MTA3, RXRA, RXRB, TUBA1B, TUBB2A, H4C15, CAMK2A, GRK2, H4C8, MTA1, MBD3",https://pathcards.genecards.org/card/signaling_events_mediated_by_hdac_class_i
27.76,MAPK-Erk Pathway,275,79,"MAP2K2, MAP2K3, CAPZA2, MXD1, MAP3K2, PFN1, PFN2, CEBPB, FERMT2, ARPC2, MAPK1, HSP90AA1, HSP90AB1, CFL1, HSP90B1, ARPC3, CFL2, ARRB1, ARRB2, BUB1, TMOD2, TMOD3, MAPK6, GNAI1, GNAI3, ITGA2, ITGA3, NRAS, ITGAL, ITGB3, DUSP6, RPS6, RPS6KA1, EPHA2, EPHA4, PXN, YBX1, EPHB2, SPRED1, YES1, PLA2G4A, CTTN, TAL1, LYN, YWHAE, YWHAG, BCL2L11, YWHAZ, PIK3R1, CREB1, CREB3L2, FSCN1, PRKCH, RGS16, RGS17, RGS5, PPARA, RHOA, PAK1, CRK, EEF2K, PEA15, FURIN, IGF2BP2, RAC1, FYN, RAC3, RACK1, IMP4, CALM3, KSR2, ARHGEF39, CAMK2A, GRK3, HRAS, PAX6, CDKN1B, VASP, ELK1",https://pathcards.genecards.org/card/mapk-erk_pathway
26.68,Toll-like Receptor Signaling Pathway,285,80,"MAP2K2, MAP2K3, MAP2K7, STAT2, STAT5B, TAB2, CCND1, CCND2, MYC, MAPK1, CASP8, PTPN6, HSPA2, SOCS1, HSPA8, TIRAP, TLR5, OTUD5, MAPK14, IRAK2, IRAK3, IRAK4, TP53, BAK1, EP300, RBCK1, TLR6, NRAS, SOS2, HSPG2, APAF1, CD209, BBC3, CTNNAL1, RNF216, RELA, MMP9, JAK3, MSN, TP73, RNF41, BCL2L1, YWHAZ, IKBKG, CD3E, PIK3CD, MAVS, PIK3R1, CREB1, CREB3L2, AKT2, PLK1, IL1B, MBL2, TRAF3, TRAF6, TOLLIP, IFNAR2, CYCS, SYK, RAB9A, NFATC3, TGFB1, IL6, TGFBR1, TGFBR2, RAC1, CYLD, FAS, GRB2, RACK1, EGR3, CDK2, CDK4, HRAS, CDK6, EIF2AK2, CDKN1A, CDKN1B, ELK1",https://pathcards.genecards.org/card/toll-like_receptor_signaling_pathway
26.63,MAP Kinase Signaling,113,43,"MAP2K2, MAP2K3, MCRIP1, NIBAN2, MAP2K7, PTPN11, MAP3K2, TAB2, MAP3K5, MAP3K9, MAP4K2, MAPK1, PPP2R2A, SFN, MAPK14, MAPK6, MAPKAPK2, MAPKAPK5, NRAS, DUSP4, DUSP6, RPS6KA1, RPS6KA3, RPS6KA4, YES1, LYN, FOSB, YWHAE, FOSL1, YWHAG, FOSL2, YWHAZ, JUNB, JUND, SRF, SHOC2, PEA15, RAC1, FYN, RAC3, HRAS, MRAS, ELK1",https://pathcards.genecards.org/card/map_kinase_signaling
26.41,Angiopoietin-like Protein 8 Regulatory Pathway,194,61,"MAP2K2, MAP2K3, THRA, THRB, MAP2K7, PFKM, EIF4E, PTPN1, PTPN11, MAP3K2, MAP3K5, MAP3K9, MAP4K2, TSC1, ABCG8, RAPGEF1, MAPK1, SESN3, PTPRF, SOCS1, CYTH3, MAPK14, SORBS1, MAPK6, SGK1, SGK3, SOS2, STX4, STXBP2, XBP1, FLOT1, RPS6KA1, SLC2A1, RPS6KA3, RPS6KA4, PIK3C2A, RRAD, PIK3CD, TRIP10, PIK3R1, AKT2, SRF, PRKCH, MINK1, ARF1, RAB4A, CRK, RICTOR, IGF1R, RXRA, RAC1, FASN, G6PC1, GRB2, CYP2B6, PTEN, KIF3A, KIF5B, HRAS, ARF6, ELK1",https://pathcards.genecards.org/card/angiopoietin-like_protein_8_regulatory_pathway
26.20,Packaging Of Telomere Ends,209,64,"NPM1, CCNA2, POLR2A, POLR2E, POLR2F, NCOR1, CENPI, UBA52, CENPM, CENPN, CENPO, UBC, TP53, RBBP4, KNL1, EP300, EP400, FKBP1A, H1-1, H1-2, H1-4, HJURP, APEX1, H2AC11, OIP5, H2AC13, H2AC14, H2AC18, H2AC19, H2AC20, H2AC7, H2AC8, H2AX, H2BC1, HMGA1, HMGA2, H2BC11, H2BC12, H2BC13, H2BC17, H2BC21, ATM, H2BC26, H2BC3, H2BC5, H2BC9, RFC2, H3-4, ACVR2B, TERF2, CABIN1, LMNB1, SMUG1, PARP1, PARP2, RPA1, H4C15, SKI, CDK2, H4C8, POLD3, CDKN1A, CDKN1B, MRE11",https://pathcards.genecards.org/card/packaging_of_telomere_ends
25.74,GPCR Pathway,712,158,"MAP2K2, MAP2K3, PPP1R11, PTK7, CARD10, POLR1A, MAP2K7, STAT2, STAT5B, HDGF, PPP1R14A, PPP1R15A, PTPA, MAP3K2, BRCA1, MAP3K5, CCNA2, POLR2A, CCNB1, CCND1, CCND2, PPP1R3B, CCNF, VEGFA, MDK, MDM2, SP1, CSNK1E, MYC, PPP1R7, TYRO3, RAPGEF1, MAPK1, KITLG, GLG1, PPP1R9B, NCOR1, PPP2R2A, HSP90AA1, HBEGF, FGF19, FGF5, TAF11, FGFR1, TAF15, CCNT1, TLN1, MAPK14, LEFTY1, TP53, MAPK6, GNAI1, GNAI2, GNAI3, ITGA2, ITGA3, TSG101, EP300, KPNA2, KPNB1, LTBP4, GNAS, NRAS, SOS2, GNB4, TBRG1, ITGAL, NRG1, NRG4, ITGB3, HDAC7, GFER, MET, NRP1, EPHA2, EPHA4, PXN, EPHB2, TRPC5, HLA-DOA, MMP9, LYN, JAK3, BCL10, ERBB3, E2F1, E2F2, E2F3, E2F4, RCAN1, BCL2L1, IKBKG, PLCD3, PLCE1, PLCG2, DDR2, CD3E, CD4, PLD2, PLD3, PIK3R1, ACTB, ACTG1, CREB1, AKT2, PRKAR2A, SRF, PRKCH, PLPP3, PDGFRA, NET1, ARF1, RHOA, RHOB, RHOC, PAK1, CABIN1, PAK2, PRKX, SYK, CRK, VCL, NFAT5, NFATC3, LIMK1, TGFA, TGFB1, IGF1, IGF1R, IGF2, IL6, TGFBR1, TGFBR2, RAC1, FYN, BMP2, BMP3, ADCY1, GRB2, RAC3, CALM3, ARHGEF2, CDK1, TUBB2A, CAMK2A, CDK2, CDK4, HRAS, PTGS2, CDKN1A, CDKN1B, CDKN2A, MRAS, ARF6, ELK1, PAK4, CSK, ARF3",https://pathcards.genecards.org/card/gpcr_pathway
25.17,Influenza Infection,157,52,"CANX, RPS19, RPL12, NUP153, NUP155, NUP205, RAN, RANBP2, NUP42, NUP43, NUP50, NUP62, RPL13A, POLR2A, POLR2E, POLR2F, RPL14, NUP85, NUP93, NUP98, HSP90AA1, RPL18A, RPS27, UBA52, POM121, RPL22, RPS28, RPL36, RPL37, KPNA2, RPL27, KPNA5, KPNB1, RPL41, RPL28, RPS4X, RPS6, RPL30, RPL7A, RPL34, RPL8, RPL9, PABPN1, RPLP1, RPS12, TGFB1, PARP1, RPS16, RPS17, CALR, GRSF1, EIF2AK2",https://pathcards.genecards.org/card/influenza_infection
25.11,Autophagy Pathway,228,67,"CCND1, FERMT2, MDM2, HSP90AA1, HSP90AB1, HSP90B1, TP53, ITGA2, ITGA3, NRAS, ITGAL, ITGB3, XIAP, EPHA2, EPHA4, PXN, EPHB2, ATG14, HMGB1, ATG7, YWHAE, YWHAG, BCL2L11, YWHAZ, RAB11A, RAB11B, IL10RB, PIK3R1, AKT1S1, CREB1, CREB3L2, ULK1, AKT2, RAB13, RAB14, RAB23, RAB27A, RAB2A, RAB2B, RAB31, CXCR4, RAB40B, RAB40C, IL20RB, IL21R, RAB4A, RAB5C, IL23R, CDC37, SYK, FURIN, RAB9A, IGF1R, IL5RA, IL6R, IL7R, RAB3B, PTEN, MAP1LC3B, HRAS, CDKN1A, CDKN1B, RAB17, RAB15, RAB5B, RAB10, RAB1B",https://pathcards.genecards.org/card/autophagy_pathway
24.67,Regulation of TP53 Activity,362,93,"NPM1, CARM1, CNOT6L, TOP3A, BRCA1, BRD7, CCNA2, POLR2A, CCNB1, POLR2E, POLR2F, GATAD2A, TSC1, MDM2, MDM4, MEAF6, BRIP1, TIGAR, BRPF1, SESN2, SESN3, ZNF385A, SETD9, BTG2, UBA52, TAF11, TAF15, SFN, CCNT1, DNA2, MAPK14, UBC, TP53, NDRG1, AGO1, AGO2, AGO3, KMT5A, RBBP4, EP300, CTDP1, MAPKAPK5, SGK1, BANP, RBL1, CHD4, APAF1, BBC3, SCO1, COX18, COX19, PRDM1, TNRC6A, TNRC6B, TNRC6C, COX6B1, SLC38A9, HUS1, YWHAE, YWHAG, E2F1, E2F4, TP73, ATM, RRAGC, RRAGD, YWHAZ, E2F8, RFC2, RFFL, TNFRSF10A, TNFRSF10B, TNFRSF10D, GPI, AKT2, PIP4K2B, PIP4K2C, PRMT5, CYCS, RICTOR, FAS, G6PD, RPA1, CDK1, PTEN, CDK2, DYRK2, GSR, CDKN1A, CDKN1B, CDKN2A, MRE11, MBD3",https://pathcards.genecards.org/card/regulation_of_tp53_activity
24.58,TGF-Beta Pathway,653,146,"MAP2K2, MAP2K3, PTK7, MAP2K7, STAT2, STAT5B, HDGF, EIF4A2, EIF4E, PTPA, RAN, MAP3K2, EIF4EBP2, EIF4G1, BRCA1, SAR1A, MAP3K5, MAP3K9, CEBPB, MAP4K2, VEGFA, SAR1B, MDK, SP1, MYC, TYRO3, MAPK1, KITLG, PPP2R2A, GCFC2, UBA1, F2, F2R, FGF19, F2RL3, SOCS1, FGF5, FGFR1, MAPK14, UBC, LEFTY1, TP53, MAPK6, ITGA2, MAPK8IP2, ITGA3, EP300, MAPK8IP3, MAPKAPK2, SPIRE2, MAPKAPK5, LTBP4, GNAS, DUSP14, NRAS, SOS2, GNB4, DUSP4, TBRG1, ITGAL, NRG1, NRG4, ITGB3, GFER, DUSP6, XIAP, RPS6, RPS6KA1, MET, RPS6KA3, RPS6KA4, PIAS4, EPHA2, EPHA4, PXN, EPHB2, DCX, SUMO1, TCF23, SUMO2, TCF3, SMAD9, JAK3, SH3RF1, ERBB3, IKBKG, DDR2, CD4, IL10RB, TNFRSF10A, H3-4, TEAD1, TNFRSF10B, TNFRSF10D, H3C10, PIK3R1, CREB1, TNFRSF13C, AKT2, HNF1A, H3C2, H3C3, H3C4, IL1B, PLPP3, PDGFRA, CXCR4, NET1, RHOA, PAK1, PAK2, IFNAR2, PSMB2, PSMB5, CRK, PSMB9, TFAM, PSMC4, PSMD1, NFATC3, TGFA, TGFB1, IGF1, IGF1R, IGF2, IL6, IL6R, TGFBR1, TGFBR2, RAC1, IL7R, BMP2, BMP3, GRB2, RAC3, MKNK2, MCM5, ARHGEF2, CRKL, SKI, ANGPT4, HRAS, CCL22, MRAS, ELK1, PAK4",https://pathcards.genecards.org/card/tgf-beta_pathway
24.44,Cell Cycle,137,47,"WEE1, CCNA2, CCNB1, CCND1, CCND2, MDM2, MYC, CDC25B, BUB1, SFN, PTTG1, BUB3, TP53, ABL1, EP300, RBL1, YWHAE, YWHAG, E2F1, E2F2, E2F3, E2F4, ATM, YWHAZ, PRIM1, PRIM2, CREB1, SMC1A, PLK1, ORC1, CDC14B, ORC4, ORC6, CDC45, TGFB1, FZR1, MCM4, MCM5, MCM7, RPA1, CDK1, CDK2, CDK4, CDK6, CDKN1A, CDKN1B, CDKN2A",https://pathcards.genecards.org/card/cell_cycle
24.14,Development VEGF Signaling Via VEGFR2 - Generic Cascades,147,49,"MAP2K2, MAP2K3, PTPN11, BRCA1, VEGFA, SP1, RAPGEF1, MAPK1, HSP90AA1, HSP90AB1, HSP90B1, MAPK14, MAPKAPK2, MAPKAPK5, SOS2, ITGB3, CTNNB1, NRP1, PXN, YES1, PLA2G4A, RELA, FOSB, JAK3, FOSL1, IKBKG, PLCG2, PIK3CD, JUNB, JUND, CD44, PIK3R1, ACTB, ACTG1, CREB1, AKT2, PRKCH, RHOA, PAK1, PAK2, VCAM1, CRK, VCL, RAC1, FYN, GRB2, HRAS, PTGS1, PTGS2",https://pathcards.genecards.org/card/development_vegf_signaling_via_vegfr2_-_generic_cascades
23.67,Signaling By WNT,331,86,"AXIN1, PFN1, CSNK1E, MYC, ARRB2, UBA52, BTRC, TLE3, UBC, AGO1, AGO2, AGO3, KMT2D, WNT3, AP2M1, AP2S1, EP300, GNB4, KREMEN1, CTNNB1, CTNNBIP1, XIAP, RNF146, SOX4, APC, DVL3, TNRC6A, TNRC6B, TNRC6C, PYGO2, H2AC14, H2AC18, H2AC19, H2AC20, H2AC7, H2AC8, H2AX, H2BC1, H2BC11, H2BC12, H2BC13, H2BC17, H2BC21, YWHAZ, H2BC26, H2BC3, H2BC5, BCL9L, H2BC9, H3-4, FRAT2, PRICKLE1, H3C10, AKT2, RSPO1, PDE6A, H3C14, H3C15, H3C2, H3C3, H3C4, RHOA, PSMB2, PSMB5, PSMB9, VPS35, CDC73, PSMC4, PSMD1, PSMD10, PSMD11, SMURF2, RUNX3, RAC1, PSME3, FZD6, FZD7, RAC3, PSMF1, NLK, CALM3, H4C15, CAMK2A, H4C8, WNT7B, WNT3A",https://pathcards.genecards.org/card/signaling_by_wnt
23.58,Validated Targets of C-MYC Transcriptional Activation,80,33,"GAPDH, PTMA, NPM1, PFKM, EIF4E, EIF4G1, CCNB1, CCND2, MYC, HSP90AA1, POLR3D, HSPA4, LDHA, TK1, IREB2, TP53, SLC2A1, UBTF, NME1-NME2, MMP9, PRDX3, HMGA1, HUWE1, FOSL1, E2F3, MAX, SHMT1, TFRC, SNAI1, MTDH, BMI1, CDK4, MTA1",https://pathcards.genecards.org/card/validated_targets_of_c-myc_transcriptional_activation
23.05,Hepatocyte Growth Factor Receptor Signaling,115,41,"MAP2K2, NPM1, MAP2K7, PTPN11, MAP3K5, CCND1, RAPGEF1, MAPK1, SFN, TP53, SOS2, NRG1, APAF1, CTNNB1, XIAP, RPS6KA1, MET, PXN, ERBB3, BCL2L1, PIK3CD, PIK3R1, CREB1, AKT2, PAK1, CACNA1C, CYCS, CRK, SNAI1, RAC1, FAS, GRB2, DFFA, DFFB, CDK1, CAMK2A, CRKL, PTEN, HRAS, PTGS2, ELK1",https://pathcards.genecards.org/card/hepatocyte_growth_factor_receptor_signaling
22.84,E2F Transcription Factor Network,66,29,"BRCA1, MYBL2, CCNA2, SP1, MYC, TK1, HIC1, CBX5, RBBP4, RBL1, APAF1, TRIM28, E2F1, E2F2, E2F3, E2F4, TP73, ATM, YY1, E2F6, RRM2, ORC1, PRMT5, MCL1, CDK1, CDK2, CDKN1A, CDKN1B, CDKN2A",https://pathcards.genecards.org/card/e2f_transcription_factor_network
22.76,PIP3 Activates AKT Signaling,310,81,"PTPN11, GATAD2A, MDM2, MAPK1, KITLG, KLB, EZH2, HBEGF, FGF19, UBA52, FGF5, STRN, FGFR1, PHC2, UBC, IRAK4, TP53, AGO1, AGO2, AGO3, CBX8, RBBP4, KPNA2, SGK1, NRG1, NRG4, PHLPP1, CHD4, HDAC7, XIAP, RNF146, MET, TNRC6A, TNRC6B, TNRC6C, REST, SLC38A9, ERBB3, RRAGC, RRAGD, SUZ12, PIK3CD, FRK, PIK3R1, AKT1S1, CREB1, AKT2, PRKAR2A, PDGFRA, TRAF6, PIP4K2B, PIP4K2C, PRKX, PSMB2, PSMB5, PSMB9, MTA3, PSMC4, RICTOR, PSMD1, PSMD10, PSMD11, TGFA, TRAT1, SNAI1, RAC1, FYN, PSME3, BMI1, ADCY1, GRB2, PSMF1, CALM3, CAMK2A, PTEN, GRK2, CDKN1A, CDKN1B, MTA1, CBX6, MBD3",https://pathcards.genecards.org/card/pip3_activates_akt_signaling
22.69,NFAT and Cardiac Hypertrophy,326,84,"EIF2B5, MAP2K2, MAP2K3, MAP2K7, EIF4E, MAP3K2, MAP3K5, MAP3K9, CACNG8, RAPGEF1, MAPK1, NKX2-5, FGFR1, MAPK14, MAPK6, GNAI1, GNAI2, GNAI3, ITGA2, ITGA3, EP300, MAPKAPK2, GNAS, NRAS, SOS2, GNB4, ITGAL, ITGB3, HDAC7, RPS6, RPS6KA1, JAK3, MYLK, ERBB3, YWHAE, YWHAG, RCAN1, YWHAZ, IKBKG, PLCD3, PLCE1, PLCG2, PIK3R1, ACTB, ACTG1, CREB1, AKT2, PRKAR2A, SRF, PRKCH, PDGFRA, EDN1, RHOA, RHOB, RHOC, CABIN1, CACNA1A, CACNA1B, CACNA1C, CRK, CACNA2D2, CACNB2, NFAT5, NFATC3, TGFB1, IGF1, IGF1R, IGF2, IL6, TGFBR1, TGFBR2, RAC1, ADCY1, GRB2, RAC3, CALM3, CAMK2A, PTEN, HAND1, HRAS, EIF2B3, MRAS, ELK1, MEF2D",https://pathcards.genecards.org/card/nfat_and_cardiac_hypertrophy
22.67,Translational Control,190,57,"CANX, EIF2B5, EIF3C, LARP1, EIF3J, CNOT6, EIF4A2, EIF4A3, EIF4E, EIF4EBP2, EIF4G1, RPL13A, TIAL1, EIF5A, DICER1, PCBP2, TSC1, HSP90B1, HSPA9, SF3B1, AGO1, AGO2, AGO3, HIF1AN, XBP1, ZFP36, RPS6, DCP1A, P4HB, YBX1, RPL7A, PDCD4, RRAGC, RRAGD, YY1, ATP2A2, PABPN1, AKT1S1, ERN1, DDX6, EDC3, HNRNPA0, HNRNPD, EEF2, EEF2K, CDC73, RICTOR, SYNCRIP, FXR1, IGF2BP1, IGF2BP2, KHSRP, RACK1, EWSR1, DGCR8, EIF1, EIF2AK2",https://pathcards.genecards.org/card/translational_control
22.37,IL-1 Family Signaling Pathways,158,50,"MAP2K2, MAP2K3, MAP2K7, EIF4E, PTPN11, TAB2, SP1, MAPK1, PTPN6, UBA52, TIRAP, TLR5, MAPK14, UBC, IRAK2, IRAK3, IRAK4, IRF1, UBE2V1, LSP1, EP300, MAPKAPK2, SOS2, CD209, RPS6KA1, RELA, FOSB, BCL10, FOSL1, FOSL2, IKBKG, PLCG2, JUNB, JUND, ECSIT, IL1B, TRAF6, TOLLIP, EDN1, RHOA, SYK, IL36B, NFATC3, TGFA, IL6, GRB2, MKNK2, HRAS, PTGS2, ELK1",https://pathcards.genecards.org/card/il-1_family_signaling_pathways
22.31,P70S6K Signaling,392,96,"MAP2K2, MAP2K3, PPP1R11, EIF3C, EIF3F, EIF3J, HDGF, PPP1R14A, PPP1R15A, EIF4A2, EIF4E, PTPA, MAP3K2, EIF4G1, PPP1R3B, TSC1, MDK, PPP1R7, MAPK1, KITLG, GLG1, PPP1R9B, PPP2R2A, HBEGF, F2, F2R, FGF19, FGF5, FGFR1, MAPK14, LEFTY1, MAPK6, GNAI1, GNAI2, GNAI3, LTBP4, GNAS, FKBP1A, NRAS, SOS2, GNB4, TBRG1, NRG1, NRG4, GFER, RPS6, RPS6KA1, MET, NRP1, RPS6KA3, RPS6KA4, EPHA2, EPHA4, EPHB2, LYN, YWHAE, YWHAG, YWHAZ, IKBKG, PLCG2, DDR2, PLD2, PLD3, PIK3R1, PRKAR2A, PRKCH, PLPP3, PDGFRA, RHOA, RHOB, RHOC, PAK1, PAK2, VCAM1, SYK, EEF2, EEF2K, RICTOR, TGFA, TGFB1, IGF1, IGF1R, IGF2, IL6, TGFBR1, RAC1, BMP2, BMP3, ADCY1, GRB2, RAC3, HRAS, PTGS2, MRAS, ELK1, PAK4",https://pathcards.genecards.org/card/p70s6k_signaling
22.06,Senescence and Autophagy in Cancer,105,38,"MAP2K3, TNFSF15, CEBPB, MDM2, MAPK1, CDC25B, COL1A1, MAPK14, IRF1, TP53, KMT2A, FKBP8, SLC39A1, ATG14, HMGA1, ATG7, E2F1, CD44, AKT1S1, ULK1, IL1B, TGFB1, IGF1, IGF1R, IL6, IL6R, AMBRA1, IGFBP5, BMI1, BMP2, THBS1, PTEN, ING1, MAP1LC3B, HRAS, CDKN1A, CDKN1B, CDKN2A",https://pathcards.genecards.org/card/senescence_and_autophagy_in_cancer
21.92,Neuroscience,341,86,"GAPDH, PTPN1, THY1, CSNK1E, NKX2-2, PPP1R9B, BRSK1, STOML2, SLC1A2, ENAH, USP14, DLST, UBA52, NCS1, UBC, NDRG1, SLC25A12, DBN1, AGTPBP1, STX1A, MELK, TMED10, NRP1, P2RX7, APEX1, EPHB2, MARK2, DCX, FOSB, MSI1, DYRK1B, SHANK2, SHANK3, GIT1, TNC, PSENEN, CREB1, ULK1, TARDBP, SRCIN1, APP, VAMP1, VAMP3, CXCR4, ADAM17, NEO1, OPTN, ARC, PPFIBP1, RTN4, NEUROD1, PLXNA1, PLXNA2, PLXNA3, TOMM20, TFAM, UNC5B, TFAP2A, TFAP2B, GPR37L1, NF2, NFASC, FXR1, GPRC5A, NACC1, AMBRA1, ARHGAP26, PARK7, SLC4A1, KCNJ6, CLPP, MKI67, ATXN1, CLU, CALR, EGR3, TUBA1B, TUBB, CAMK2A, GRIN2A, GRK2, GRK3, PTGS1, PTGS2, NHERF1, DPYSL2",https://pathcards.genecards.org/card/neuroscience
21.85,PDGFR-beta Signaling Pathway,146,47,"MAP2K2, NCKAP1, STAT5B, PTPN1, PTPN11, MAP3K2, ARPC2, MYC, RAPGEF1, PPP2R2A, ARPC3, SFN, ABL1, ITGB3, ZFP36, DUSP6, USP6NL, RPS6, RPS6KA3, PLA2G4A, CTTN, TAGLN, BCL2L1, YWHAZ, JUND, PLD2, PIK3R1, CREB1, ACTN4, SRF, PAG1, RHOA, PAK1, RAB4A, VAV2, CRK, RICTOR, RAC1, SIPA1, WASF2, GRB2, ARHGDIA, PTEN, NHERF1, EIF2AK2, ELK1, CSK",https://pathcards.genecards.org/card/pdgfr-beta_signaling_pathway
21.79,Peptide Chain Elongation,417,100,"EIF2B5, RPS19, RPL12, EIF2S3, EIF3C, EIF3F, EIF3J, LARS1, NARS1, EIF3L, EIF4A2, EIF4A3, EIF4E, EIF4G1, RPL13A, CEBPB, RPL14, TRMT112, SESN2, SPCS1, SPCS3, PPP2R2A, RPL18A, MRPL12, RPS27, CASTOR2, UBA52, RPL22, RPS28, RPL36, DARS2, MRPL34, MRPL36, MRPL37, RPL37, MRPL44, MRPL49, CBS, MRPL57, MRPL9, MRPS10, RPL27, OXA1L, RPL41, MRPS16, MRPS18A, MRPS18B, RPL28, AHCY, RPS4X, RPS6, RPS6KA1, MRPS23, DCP1A, RPL30, RPS6KA3, MRPS27, MRPS30, YARS1, MRPS5, MRRF, RPL7A, AIMP1, SLC38A9, RPL34, RRAGC, RRAGD, MAT1A, EARS2, RNPS1, RPL8, RPL9, TARS2, RPLP1, SEC61A1, SRP54, SRP68, SRP9, N6AMT1, SMG1, SMG7, TRAM1, EEF1A2, EEF2, RPS12, SSR1, ATP6V0D2, ATP6V1B2, ATP6V1E1, FARSA, WARS1, RPS16, RPS17, IMPACT, MTRF1L, GRSF1, INMT, GSR, EIF2B3, NCBP2",https://pathcards.genecards.org/card/peptide_chain_elongation
21.63,Cell Cycle Regulation of G1/S Transition (part 1),124,42,"CARM1, CDT1, PTPA, BRCA1, WEE1, CCNA2, CCNB1, CCND1, CCND2, SP1, MYC, MAPK1, NCOR1, PPP2R2A, HSP90AA1, UBA1, UBA52, BTRC, PTTG1, UBC, NR3C1, RELA, E2F1, E2F4, ZFYVE9, JUNB, SMC1A, PLK1, MIF, CKS1B, TGFB1, TGFBR1, TGFBR2, FZR1, GRB2, CDK1, CDK2, CDK4, CDK6, CDKN1A, CDKN1B, CDKN2A",https://pathcards.genecards.org/card/cell_cycle_regulation_of_g1s_transition_(part_1)
21.56,Apoptosis and Autophagy,185,55,"MXD1, PTPN11, MAP3K5, STK17B, TIAL1, MYC, STK4, TIGAR, CASP8, PTRH2, TMPO, SFN, NDRG1, BAK1, CCAR2, ACIN1, PHLDA3, APAF1, BBC3, XIAP, PDCD4, BCL10, DYRK1B, YWHAE, YWHAG, BCL2L1, BCL2L11, YWHAZ, YY1, H2BC3, TNFRSF10A, MAX, TNFRSF10B, TNFRSF10D, OPA1, CXCR4, TRAF1, TRAF3, TRAF4, TRAF6, LMNB1, CYCS, UNC5B, PEA15, TFAP2A, TFAP2B, TFAP2C, LMNB2, FAS, MCL1, PARP1, VDAC1, DFFA, NDRG3, MLX",https://pathcards.genecards.org/card/apoptosis_and_autophagy
21.49,ADORA2B Mediated Anti-inflammatory Cytokines Production,419,100,"MAP2K2, MAP2K3, NPR1, NCKAP1, NCKIPSD, LASP1, MAP2K7, TXNIP, VEGFA, ARPC2, MAPK1, HSP90AB1, CFL1, ARPC3, CFL2, ARRB1, ARRB2, WIPF2, MAPK14, ABI2, ABL1, SLC9A3, ENTPD5, GNAI1, GNAI2, GNAI3, WNT3, GNAS, NRAS, GNB4, PHKG2, MYH9, SUGT1, P2RX7, DVL3, PXN, YES1, RELA, MMP9, LYN, MYLK, AKAP2, C3, PLCG2, MYO10, AKAP6, MYO5A, PIK3R1, ACTB, ACTG1, CREB1, PDE4A, PDE4C, PDE4D, APP, PRKAR2A, PDE7A, PDE7B, KDELR1, IL1B, PRKCH, RGS16, RGS17, ADAM17, RHOA, PAK1, CYBA, PRKX, CACNA1B, CACNA1C, VAV2, VAV3, SYK, CRK, FURIN, LIMK1, IL6, RAC1, FYN, WASF2, FZD7, BMP2, BMP3, ADCY1, GRB2, ADD1, CALM3, TUBB2A, CAMK2A, TUBD1, TUBGCP2, GRK2, GRK3, WNT7B, HRAS, NHERF1, MRAS, VASP, ELK1, WNT3A",https://pathcards.genecards.org/card/adora2b_mediated_anti-inflammatory_cytokines_production
21.28,Regulation of Actin Dynamics For Phagocytic Cup Formation,86,33,"NCKAP1, NCKIPSD, ARPC2, MAPK1, HSP90AA1, HSP90AB1, CFL1, ARPC3, WIPF2, ABI2, ABL1, MYH9, YES1, LYN, PLCG2, MYO10, MYO5A, PLD2, PLD3, PIK3R1, ACTB, ACTG1, PAK1, VAV2, VAV3, SYK, CRK, NF2, LIMK1, RAC1, FYN, WASF2, GRB2",https://pathcards.genecards.org/card/regulation_of_actin_dynamics_for_phagocytic_cup_formation
21.22,Activation of The Pre-replicative Complex,112,39,"POLQ, POLR1A, CDT1, CCNA2, MDM2, TIMELESS, UBA52, TIPIN, DNA2, UBC, CBX5, H1-1, H1-2, H1-4, H1-6, HUS1, E2F1, GINS2, GINS3, YWHAZ, RFC2, PRIM1, PRIM2, PLK1, ORC1, ORC4, ORC6, CDC45, MCM4, MCM5, MCM7, RPA1, RAD51, MCM8, CDK19, CDK2, CDK4, POLD3, CDK6",https://pathcards.genecards.org/card/activation_of_the_pre-replicative_complex
21.09,Cytoskeleton Remodeling Regulation of Actin Cytoskeleton By Rho GTPases,187,55,"MAP2K2, PFN1, PFN2, CCND1, SP1, ARPC2, MAPK1, CFL1, ARPC3, CFL2, MYH11, MYH15, COL1A1, COL1A2, TJP3, WIPF2, CGN, TLN1, ITGA2, OCLN, ITGA3, SOS2, ITGB3, NECTIN1, CTNNB1, MYH9, PXN, APH1A, MYL9, MYLK, ACTB, PSENEN, ACTG1, ACTN4, AKT2, FSCN1, ADAM17, RHOA, PAK1, RTN4, RTN4R, CLDN16, CLDN4, CLDN7, CRK, VCL, LIMK1, LIMS1, SNAI1, RAC1, MTDH, GRB2, ARHGDIA, PARVB, HRAS",https://pathcards.genecards.org/card/cytoskeleton_remodeling_regulation_of_actin_cytoskeleton_by_rho_gtpases
21.09,MAPK Signaling: Mitogens,108,38,"MAP2K2, EIF4E, EIF4G1, CCND1, CCND2, TSC1, MDM2, MYC, MAPK1, FGFR1, TP53, SOS2, RPS6, MET, UBTF, PDCD4, MFRP, ERBB3, E2F1, E2F2, E2F4, BCL2L1, BCL2L11, PLCG2, PIK3CD, PIK3R1, AKT1S1, AKT2, PDGFRA, RICTOR, IGF1R, GRB2, PTEN, CDK2, CDK4, CDKN1A, CDKN1B, MRAS",https://pathcards.genecards.org/card/mapk_signaling_mitogens
21.08,Development Ligand-independent Activation of ESR1 and ESR2,135,44,"MAP2K2, MAP2K3, CACNG8, CCND1, MAPK1, NCOR1, LDHA, MAPK14, EP300, GNAS, SOS2, NRG1, XIAP, RPS6KA1, RPS6KA3, RPS6KA4, ERBB3, PIK3CD, PIK3R1, CREB1, AKT2, PRKAR2A, PDGFRA, PPARA, PPARD, CACNA1A, CACNA1B, CACNA1C, CACNA2D2, CACNB2, IGF1, IGF1R, KCNIP3, TGFBR1, RXRA, RAC1, ADCY1, GRB2, CALM3, CAMK2A, HRAS, PTGIS, HRH2, PTGS2",https://pathcards.genecards.org/card/development_ligand-independent_activation_of_esr1_and_esr2
20.79,Programmed Cell Death,213,60,"CARD8, DSG3, MAPK1, CASP8, HSP90AA1, UBA52, VIM, SFN, UBC, IRF1, TP53, OCLN, BAK1, KPNB1, ACIN1, APAF1, FLOT1, BBC3, CTNNB1, XIAP, APC, H1-1, H1-2, PKP1, H1-4, DYNLL2, SDCBP, HMGB1, YWHAE, YWHAG, E2F1, TP73, BCL2L1, BCL2L11, YWHAZ, TNFRSF10A, TNFRSF10B, AKT2, IL1B, OPA1, PAK2, CDC37, PSMB2, PSMB5, LMNB1, CYCS, PSMB9, UNC5A, UNC5B, PSMC4, PSMD1, PSMD10, PSMD11, PSME3, FAS, PSMF1, ADD1, DFFA, DFFB, CDKN2A",https://pathcards.genecards.org/card/programmed_cell_death
20.63,MAPK Signaling Pathway,244,66,"MAP2K2, MAP2K3, MAP2K7, MAP3K2, TAB2, MAP3K5, CACNG8, MAP4K2, MYC, STK4, MAPK1, FGF19, ARRB1, ARRB2, ELK4, CDC25B, HSPA2, HSPA8, FGF5, FGFR1, MAPK14, TP53, MAPK8IP2, MAPK8IP3, MAPKAPK2, MAPKAPK5, DUSP2, NRAS, SOS2, DUSP4, DUSP6, DUSP8, RPS6KA3, RPS6KA4, PLA2G4A, RELA, IKBKG, JUND, MAX, TAOK1, ECSIT, AKT2, SRF, IL1B, TRAF6, PAK1, PAK2, CACNA1A, CACNA1B, CRK, CACNA2D2, CACNB2, NFATC3, TGFB1, TGFBR1, TGFBR2, RAC1, FAS, GRB2, RAC3, MKNK2, NLK, CRKL, HRAS, MRAS, ELK1",https://pathcards.genecards.org/card/mapk_signaling_pathway
20.47,Development IGF-1 Receptor Signaling,110,38,"MAP2K2, MAP3K5, CCND1, CCND2, TSC1, MDM2, MYC, MAPK1, HSP90AA1, HSP90AB1, HSP90B1, SOCS1, TP53, SOS2, RPS6, RPS6KA1, MET, RPS6KA3, RELA, JAK3, YWHAE, BCL2L1, BCL2L11, YWHAZ, PIK3CD, PIK3R1, CREB1, AKT2, IGF1, IGF1R, IGF2, IGFBP5, GRB2, PTEN, HRAS, CDKN1A, CDKN1B, ELK1",https://pathcards.genecards.org/card/development_igf-1_receptor_signaling
