Score,SuperPath Name,# SuperPath Total Genes,# SuperPath Matched Genes,Matched Genes (Symbols),Evidence URL
166.10,Signal Transduction,2597,559,"MUC20, ARL2, MAP2K2, DGKH, ARL4C, PTK6, NHS, CARM1, ADM, ADM2, NCKAP1, NCKIPSD, AXIN1, STAT5B, EMC3, WDR81, PPP1R14A, PPP1R15A, DLC1, EIF4E, PTPN1, PTPN11, RANBP2, TXNL1, EIF4G1, NUP43, USF2, TAB2, TMEM59, PFN1, WDR91, PFN2, TIAL1, DIAPH1, POLR2A, POLR2E, CCND1, POLR2F, NPW, TAC1, FERMT2, GATAD2A, VEGFA, NUP85, PTPN3, TACC3, NUP98, TSC1, MDK, MDM2, SP1, ARPC2, CSNK1E, RANGAP1, MYC, ABCG8, STK4, TOR1AIP1, RAPGEF1, MAPK1, KITLG, CASP8, KLB, FFAR2, FFAR4, KLC2, GLI2, PTPN6, SPC24, NCOR1, ABHD12, EZH2, HSP90AA1, TACR3, RPS27, HBEGF, HSP90AB1, CFL1, PTPRF, ARPC3, F2, F2R, FGF19, CENPI, RARA, ARRB1, ARRB2, DLL4, F2RL3, UBA52, CENPM, CENPN, CENPO, B4GALT1, SLC1A5, MYH11, SOCS1, HCAR1, COL1A1, COL1A2, FGF5, STRN, DSN1, SCAI, BTRC, RASA4, DAB2IP, FGFR1, COL5A1, VGF, VIM, SPEN, HEYL, BUB1, TLE3, KLK2, WIPF2, CGN, TMOD3, TMPO, SFN, CCNT1, TLN1, HGS, PHC2, OTUD1, BUB3, OTUD7B, VIPR1, MAPK14, UBC, NDE1, NDEL1, IRAK4, CAVIN1, TP53, NR3C1, BAG4, AGO1, AGO2, AGO3, ABHD17B, ABI2, KMT2D, CCR4, ABL1, ABL2, CCR6, TBL1XR1, MAPK6, GNAI1, GNAI2, GNAI3, ITGA2, CBX8, DBN1, WNT3, RBBP4, AP2M1, AP2S1, CCT6A, BAIAP2L1, ITGA3, KNL1, EP300, KPNA2, CEP97, RBCK1, OCRL, MAPKAPK2, PPY, MAPKAPK5, LTBP4, SGK1, SGO1, GNAS, DUSP2, FKBP1A, NRAS, SOS2, SOWAHC, GNB4, DUSP4, FKBP5, TBXA2R, RBFOX2, RBL1, NRG1, NRG4, ITGB3, PHLPP1, CHD4, HDAC7, KREMEN1, FLOT1, MEMO1, DUSP6, DUSP8, CTNNB1, CTNNBIP1, XIAP, RPS6, RPS6KA1, RNF146, SOX4, MYH9, MET, NRP1, APC, RPS6KA3, GOLGA3, DVL3, EPHA2, FMNL3, SPOPL, PXN, APH1A, SLITRK5, P4HB, YBX1, RNF20, PRDM1, SPPL2A, SPRED1, LETM1, LFNG, YES1, DYNC1LI2, PLA2G4A, TNRC6A, TNRC6B, TNRC6C, EPN1, SPRED3, RELA, CTTN, PYGO2, SH3BP1, H2AC14, NSFL1C, MMP9, DYNLL2, YKT6, LYN, H2AC18, H2AC19, H2AC20, REST, SLC38A9, GHSR, CPD, H2AC7, H2AC8, SMAD9, FOSB, RBPJ, SH3GL1, JAK3, H2AX, MYL9, MYLIP, MYLK, H2BC1, SH3PXD2A, SH3RF1, RRAD, ERBB3, YWHAE, FOSL1, YWHAG, FOXA1, NMUR1, H2BC11, H2BC12, H2BC13, E2F1, E2F3, E2F4, C3, RNF41, ZFYVE9, H2BC17, H2BC21, BCL2L1, BCL2L11, RCE1, GIPC1, RRAGC, RRAGD, YWHAZ, YY1, H2BC26, H2BC3, H2BC5, CPSF7, SPTBN2, BCL9L, GIT1, IKBKG, PLCG2, SUZ12, TNFAIP1, H2BC9, PIK3CD, JUNB, JUND, TNFRSF10A, ERCC6L, H3-4, PLD2, FPR1, FPR2, DDX39B, TAOK1, TNS4, TRIP10, FRAT2, PRICKLE1, FRK, TNFRSF10B, CD55, TNFRSF10D, H3C10, CRABP2, PSAP, ATP1B4, ATP2A2, MYO6, IDE, PIK3R1, PLEKHG2, PLEKHG3, PLEKHG4B, ACTB, PLEKHG5, PSENEN, ACTG1, MIB2, SWAP70, GPHA2, AKT1S1, CREB1, SMC1A, FAM83A, FAM83D, PDE4A, ULK1, PDE4C, C5AR2, PDE4D, DNMBP, DNMT1, RDH10, RDH11, APP, VAMP3, AKT2, RSPO1, PRKAR2A, PDE6A, SRF, PDE7A, SRGAP1, PDE7B, H3C14, H3C15, H3C2, H3C3, H3C4, PLIN3, ACVR2B, ACVRL1, PLK1, PRKCH, RGS16, RGS17, SHMT2, AR, RGS5, PDGFRA, CXCR4, TRAF1, PPARD, PDHB, PDHX, PAG1, SHOC2, ADAM17, CDC14B, CKB, TRAF6, NET1, DOCK7, PIP4K2B, OPTN, PIP4K2C, CLASP1, EDN1, ARC, RHOA, RHOB, RHOBTB3, RHOC, RHOF, PAK1, RAB4A, PAK2, RTN4, RTN4R, CYBA, CDC37, GPR161, NEURL1, PRKX, PLXNA1, PSMB2, PSMB5, LMNB1, VAV2, VAV3, SPATA2, PLXND1, GPR20, SYK, CRK, PSMB9, VCL, VPS35, MTA3, EEF2K, HNRNPH1, CDC73, TPM3, PEA15, PSMC4, FURIN, GPR37L1, RICTOR, PSMD1, PSMD10, RAB9A, PSMD11, NF2, NAB2, SSTR2, ATP6V0D2, EEPD1, LIMK1, GPS1, TFRC, TGFA, TGFB1, IGF1, IGF1R, IGF2, IGF2BP1, ARHGAP11A, TRAT1, ATP6V1B2, ATP6V1E1, SMURF2, IL5RA, RUNX3, IL6, EFHD2, IL6R, ARHGAP17, ARHGAP18, TGFBR1, SNAI1, TGFBR2, RXRA, RXRB, RAC1, FYN, PSME3, CYLD, ARHGAP26, FAS, PARD3, ARHGAP31, ARHGAP39, WASF2, FZD6, FZD7, PARD6B, FASN, TAS2R5, PARP1, BMI1, BMP2, GRAP2, NPBWR1, ADCY1, BMPR1A, GRB2, ARHGAP42, RAC3, RACK1, GABRB2, NPFFR1, THBS1, THBS2, PSMF1, ARHGDIA, NLK, PTAFR, CALM3, KSR2, EVC, ARHGEF18, ARHGEF2, CDK1, EGR3, TUBA1B, TUBB2A, ARHGEF39, H4C15, CAMK2A, CRKL, SKI, PTEN, AMOTL2, ANGPTL3, GRK2, KIF2C, GRK3, KIF3A, GRK5, GRK6, MLN, S1PR3, CDK2, TULP3, LAMA5, H4C8, STARD13, KIF5B, ANKFY1, CDK4, SAA1, WNT7B, HRAS, HRH2, CCL22, CDKN1A, CDKN1B, NCBP2, MRAS, ARF6, ELK1, MTA1, CBX6, PAK4, MEF2D, CSK, MBD3, WNT3A, RGS12",https://pathcards.genecards.org/card/signal_transduction
166.10,Metabolism of Proteins,2077,494,"CANX, EIF2B5, MUC19, MUC20, RPS19, ARL2, GAN, RPL12, EIF2S3, CAPZA2, MUC4, EIF3C, MUL1, NPLOC4, NPM1, EIF3F, FBXL8, THRA, FBXO17, AXIN1, EIF3J, TNIP2, THRB, LARS1, ANKRD28, MCRS1, INO80D, NARS1, INO80E, PTP4A2, EIF3L, PFDN6, EIF4A2, THSD4, THSD7A, HSD17B10, NUP153, NUP155, NUP205, EIF4E, ADRM1, RANBP2, EIF4G1, FEM1A, FEM1B, BRCA1, NUP42, NUP43, NUP50, NUP62, B3GALNT2, FBXO31, WDTC1, THY1, RPL13A, PGAP1, EIF5A, CCNA2, CCNF, RPL14, NUP85, NUP93, NUP98, TRMT112, SAR1B, MDH2, MDM2, MDM4, RANGAP1, GBA1, MYC, FFAR4, SPCS1, TIMM10, SPCS3, RPL18A, KLF4, MRPL12, RPS27, COG5, HSP90B1, U2AF2, SATB2, UBA1, F2, RARA, ARRB1, ARRB2, ARSA, USP12, USP14, USP16, B3GNT7, UBA52, B4GALT1, KLHL21, KLHL3, ARSK, HSPA8, HSPA9, OTUB1, BTRC, HCFC1, PTRH2, VGF, FBXW2, USP22, USP28, KLK2, FBXW8, AGBL5, POM121, ENPEP, STS, RPL22, AOPEP, HGS, PHC2, OTUD5, OTUD7A, OTUD7B, RPS28, UBC, FH, UBE2G1, RPL36, TP53, DARS2, GMDS, NR3C1, RNF103, NDUFA2, MRPL34, MRPL36, MRPL37, ASB16, ASB8, HIC1, PPP6R1, COMMD4, COMMD9, RPL37, MRPL44, MRPL49, COPS7B, COPZ1, CBX5, CBX8, MRPL57, MRPL9, MRPS10, CCT3, ADAMTS14, CCT6A, ACADSB, DCAF10, DCAF11, EP300, UBE2Z, AGTPBP1, RPL27, OXA1L, ASGR2, WSB1, HSPG2, GNB4, GNE, DCAF16, BAP1, DCAF5, RPL41, FKBP8, STX1A, DCAF7, DCAF8, MRPS16, MRPS18A, MRPS18B, NDUFV3, RPL28, TMED10, HDAC7, USP42, RPS4X, USP49, TMED9, ACOT2, ITM2B, CTNNB1, RPS6, RNF146, MARCHF6, RNF168, TRIM13, APC, MRPS23, RPL30, ASPH, MRPS27, MRPS30, PIAS2, PIAS4, CTSA, SPON2, ASXL2, METTL21A, LY6E, DCTN3, DCTN4, APH1A, DCTN5, DCTN6, RNF185, P4HB, YARS1, RNF20, DCUN1D2, SLC30A5, MRPS5, DDA1, OGFOD1, METTL22, HLA-A, DYNC1LI2, FN3K, FN3KRP, MRRF, H2AC1, H2AC11, H2AC12, UGGT1, UGGT2, RPL7A, AIMP1, GOLM1, TRIM28, RELA, NEGR1, H2AC13, H2AC14, LY6H, SUMF2, SUMO1, DYNLL2, YKT6, YME1L1, YOD1, SUMO2, H2AC18, H2AC19, H2AC20, PIGG, PIGO, CPE, PIGP, PIGS, H2AC7, H2AC8, FOLR1, PIGW, H2AX, H2BC1, QSOX1, BCL10, RPL34, LYZ, TCP1, H2BC11, H2BC12, H2BC13, MSRB3, C3, RNF40, DNAJC24, JOSD1, H2BC17, H2BC21, RCE1, YY1, H2BC26, H2BC3, SPSB1, H2BC5, SPTBN2, IKBKG, TNC, SUZ12, RAB11A, RAB11B, NUCB1, EARS2, H2BC9, FOXK1, RPL8, RPL9, MYO5A, MGAT4A, MGAT5, MATN3, MAVS, MPI, ECH1, CD55, H3C10, MBD5, SEC16A, ZBTB16, SEC22C, NOD2, TPST2, BET1L, IDE, ACTB, PSENEN, TSPAN14, TSPAN15, ASB6, RFT1, SMC1A, DNMT1, SRD5A3, TARS2, SEC24D, APP, ATP5F1A, RPLP1, TPGS1, RAB13, RAB14, SEC61A1, KCTD7, KDELR1, H3C14, H3C15, H3C2, H3C3, H3C4, OPA1, ALDH1B1, SHMT2, RAB23, KBTBD6, RAB27A, AR, RAB2A, RAB2B, RAB31, PAF1, TRAF3, SRP54, SRP68, SRP9, PPARA, PDHB, ALG1, N6AMT1, ATP5F1B, EDEM3, ALG10B, TRAF6, RAB40B, RAB40C, SMDT1, ARF1, ALG14, RHOA, RAB4A, RAB5C, RTN4RL1, RTN4RL2, TRAM1, TRAPPC10, LMAN2, ZNF350, ALG9, PSMB2, PSMB5, EEF1A2, VASH1, TOMM20, TRAPPC2, PSMB9, TFAM, EEF2, CDC73, PSMC4, SENP2, SENP8, TFAP2A, TFAP2B, TFAP2C, FURIN, ALPI, RPS12, PSMD1, PSMD10, RAB9A, PSMD11, SSR1, MCFD2, GPS1, TGFA, TGFB1, IGF1, IGF2, PMPCA, SMURF2, IL6, TGFBI, TGFBR1, TGFBR2, RXRA, TTL, TTLL12, IGFBP5, PSME3, CYLD, FARSA, WAC, WARS1, PARK7, PARP1, NAGK, SERPINA1, BMI1, ST3GAL2, RPS16, RPS17, VDAC1, VDAC2, VDR, THBS1, THBS2, PSMF1, CLPP, CLPX, RAD18, ST6GAL2, RAD23A, DPM2, ST6GALNAC3, RPA1, RAB3B, LONP2, CALM3, CALR, ATXN3, CMAS, PEX13, CDK1, TUBA1B, TUBB2A, H4C15, CALU, POFUT2, PTEN, MTRF1L, AMELX, AMFR, DPP3, EXOC5, MAN1C1, MAN2A1, MAN2A2, H4C8, KIF5B, UQCRQ, SAA1, SAE1, INO80, EXOC8, PAX6, FBXL13, FBXL16, FBXL18, FBXL19, GALNT6, EIF2AK2, CDKN1A, CDKN2A, EIF2B3, SEC24A, GATA6, MTA1, RAB17, RAB15, RAB5B, RAB10, RAB36, RAB1B, CPM, GGA1, RAB32, ARF3",https://pathcards.genecards.org/card/metabolism_of_proteins
166.10,Infectious Disease,1818,455,"CANX, MUC19, MUC20, RPS19, MAP2K2, MAP2K3, CAPNS1, RPL12, SLC11A2, MUC4, NPM1, ABCA12, LARP1, NCKAP1, NCKIPSD, AXIN1, EXT1, MAP2K7, STAT2, STAT5B, SLC16A1, THSD4, THSD7A, NUP153, NUP155, NUP205, RAN, PTPN11, RANBP2, TXNIP, TOP3A, BRCA1, SERPING1, NUP42, NUP43, NUP50, NUP62, BRD4, TAB2, ABCC6, HAVCR1, RPL13A, POLR2A, CCNB1, POLR2E, CCND1, CCND2, POLR2F, CEBPB, RPL14, GATAD2A, VEGFA, NUP85, NUP93, NUP98, PCBP2, SAR1B, MDM2, SP1, ARPC2, RANGAP1, MYC, BRIP1, ABCG8, MAPK1, KITLG, CASP8, KLB, PTPN6, MED12, PGK1, SPCS1, SPCS3, NCOR1, EZH2, HSP90AA1, RPL18A, RPS27, HBEGF, MED17, HSP90AB1, ARPC3, ANO7, GCK, GCLM, F2, FGF19, ARRB1, ARRB2, BTD, CDC25B, DLL4, UBA52, B4GALT1, HSPA8, COL1A1, COL1A2, FGF5, TIRAP, STRN, BTRC, ANTXR2, ZDHHC5, TAF11, FGFR1, HEXA, MED23, MED24, HEYL, ZDHHC8, TAF15, SOD2, WIPF2, POM121, SFN, CCNT1, RPL22, TLN1, DNA2, FGFR1OP2, TLR5, HGS, RPS28, MAPK14, UBC, IRAK2, IRAK4, RPL36, TP53, NR3C1, IRF4, BAG4, AGO1, AGO2, MED26, AGO3, MED28, MED29, AP1B1, ABI2, ISCU, AP1S1, SLC24A4, ABL1, TBL1XR1, MED7, AP1S3, RPL37, ENTPD5, UBE2V1, GNAI1, GNAI2, GNAI3, RBBP4, AP2M1, AP2S1, ADAMTS14, ACACA, TSG101, EP300, KPNA2, RPL27, KPNA5, KPNB1, HIP1, CTDP1, GNAS, GEMIN4, GEMIN6, TLR6, FKBP1A, NRAS, HSPG2, AGTRAP, GNB4, GNE, SLC26A2, FAM131B, RPL41, STX1A, STX1B, NRG1, NRG4, ITGB3, CHD4, RPL28, AHCY, HDAC7, RPS4X, CD209, KREMEN1, DUSP6, DUSP8, CTNNB1, RPS6, MYH9, MET, NRP1, APC, SLC2A1, SUGT1, P2RX7, RPL30, XRCC2, DVL3, CTSA, SPON2, XRCC5, XRCC6, APH1A, RNF185, SPRED1, LFNG, HLA-A, HLA-B, YES1, DYNC1LI2, H2AC1, H2AC11, H2AC12, TNRC6C, RPL7A, SPRED3, TRIM28, RELA, SLC36A2, H2AC13, H2AC14, SUMO1, DYNLL2, LYN, H2AC18, H2AC19, H2AC20, REST, MSH3, H2AC7, H2AC8, ATG14, RBPJ, SH3GL1, JAK3, H2AX, H2BC1, HMGA1, HUS1, HMGB1, ATG7, BCL11A, CHST3, MSN, RPL34, ERBB3, YWHAE, YWHAG, CHST6, H2BC11, H2BC12, H2BC13, E2F1, E2F2, E2F3, C3, ZFYVE9, H2BC17, H2BC21, BCL2L1, BCL2L11, ATM, YWHAZ, H2BC26, H2BC3, H2BC5, PRELP, MAT1A, IKBKG, PLCG2, SUZ12, GPC4, MYO10, CD4, OMD, H2BC9, RFC2, FOXM1, PIK3CD, JUNB, RPL8, RPL9, MYO18A, MYO5A, MGAT4A, MGAT5, MAVS, MPI, TRIP11, ATP1A1, PRIM1, PRIM2, H3C10, NOD2, TPST2, PABPN1, PIK3R1, ACTB, PSENEN, ACTG1, MIB2, RFT1, AKT1S1, CREB1, PACS1, DNMT1, SRD5A3, SEC24D, APP, RPLP1, VAMP1, AKT2, PRKAR2A, H3C14, H3C15, H3C2, H3C3, H3C4, IL1B, MBL2, PDGFRA, VPS18, CXCR4, TRAF3, ALG1, SHOC2, ADAM17, TRAF6, ARF1, ALG14, PPFIBP1, PPIA, PAK2, RAB5C, IFNAR2, CYBA, CDC37, NEURL1, PRKX, ALG9, PSMB2, PSMB5, LMNB1, PPIB, VAV2, VAV3, SYK, CRK, PSMB9, VCL, EEF2, MTA3, TPM3, PSMC4, FURIN, RPS12, RICTOR, PSMD1, PSMD10, VTA1, PSMD11, VPS36, VPS37A, VPS37B, VPS37C, VPS39, VPS45, FXR1, FXYD1, TGFA, TGFB1, IGF1R, UNC93B1, TRAT1, IL6, IL6R, TGFBR1, TGFBR2, RAC1, FYN, PSME3, CYP11A1, SIKE1, WASF2, FZD6, FZD7, FZR1, PEDS1-UBE2V1, MCL1, SLC4A1, PARP1, G3BP1, G6PC1, ADCY1, ST3GAL2, RPS16, GRB2, RPS17, KIAA1549, THBS1, THBS2, SLC4A4, PSMF1, DPM2, ST6GALNAC3, RPA1, RAD51, CALM3, KSR2, CALR, TUBA1B, TUBB, TUBB2A, H4C15, CAMK2A, CNBP, PTEN, GRSF1, CDK19, CDK2, MAN2A1, H4C8, MMAB, SNRPB, SNRPD1, KIF5B, CDK4, MAP1LC3B, SNRPD2, SNRPD3, SNRPG, HRAS, CDK6, MPRIP, EIF2AK2, CDKN1A, CDKN1B, CDKN2A, NCBP2, MRAS, MRE11, SEC24A, ELK1, MTA1, RAB5B, CSK, MBD3, WNT3A",https://pathcards.genecards.org/card/infectious_disease
166.10,Innate Immune System,2054,441,"CANX, MUC19, MUC20, MAP2K3, GAN, EIF2S3, SLC11A1, CAPZA2, MUC4, NPM1, FBXL8, NCKAP1, NCKIPSD, FBXO17, TNFSF14, TNFSF15, TNIP2, TXK, TXLNA, LAT2, MAP2K7, STAT2, STAT5B, ARL8A, EIF4A2, EIF4A3, NUP153, NUP155, NUP205, EIF4E, PTPN1, PTPN11, RANBP2, TXNIP, EIF4G1, SERPING1, NUP42, NUP43, NUP50, NUP62, STIM1, TAB2, PTPN14, FBXO31, NIT2, NKIRAS2, PGAM1, DIAPH1, POLR2E, CCND1, POLR2F, CCNF, VEGFA, NUP85, NUP93, NUP98, PCBP2, SAR1B, ARPC2, MYC, POLR3A, RAPGEF1, MAPK1, CASP8, IP6K2, KLC2, PTPN6, GBP4, PTPN9, BRWD1, HSP90AA1, HSP90AB1, CFL1, HSP90B1, ARPC3, UBA1, F2, ENAH, POLR3D, POLR3E, POLR3F, ARSA, USP14, HSPA2, UBA5, UBA52, B4GALT1, KLHL21, KLHL3, SOCS1, HSPA8, COL1A1, COL1A2, BTLA, TIRAP, HSPA9, DSN1, BTN3A2, BTRC, FBXW2, VIM, SOD2, FBXW8, WIPF2, POLR3K, POM121, TLR5, OTUD5, MAPK14, UBC, IRAK2, IRAK3, IRAK4, IRF1, UBE2D4, COLEC12, UBE2G1, UBE2Q1, TP53, IRF4, KLRD1, AP1B1, ABI2, ASB16, ASB8, AP1S1, ABL1, ABL2, RNF115, CCR6, RNF125, NLRC3, COMMD9, AP1S3, UBE2V1, AP2M1, AP2S1, DTX3L, EP300, KPNA2, UBE2Z, KPNA5, RBCK1, KPNB1, RNF130, DUS2, MAPKAPK2, TLR6, FKBP1A, NRAS, SOS2, WSB1, DUSP4, ITGAL, PKM, COTL1, UBOX5, STX1A, STX4, STXBP2, DCD, CD1D, APAF1, CD209, TMT1A, NECTIN2, DUSP6, CTNNB1, RPS6KA1, MYH9, ACP3, TRIM14, PIANP, SUGT1, P2RX7, RPS6KA3, SLC2A5, CTSA, PKP1, XRCC5, XRCC6, DCTN3, DCTN4, DCTN5, DCTN6, SLPI, P4HB, RNF19B, YBX1, NME1-NME2, HLA-A, HLA-B, YES1, HLA-DOA, DYNC1LI2, REG3A, RNF216, RNF217, TRIM29, RELA, TRIM41, SUMO1, MMP9, DYNLL2, LYN, PDCD4, SDCBP, TRIM56, ATG14, JAK3, MYLIP, HUWE1, HMGB1, ATG7, QSOX1, ERAP2, BCL10, SH3RF1, MSN, LYZ, PRDX6, TCP1, C3, RNF4, RNF41, BCL2L1, BCL2L11, YWHAZ, IKBIP, SPSB1, SPTBN2, CD300LG, PDE12, SURF4, MGAM, IKBKG, PLCG2, PIGR, MYO10, CD3E, CD4, OLR1, PIK3CD, JUNB, IL10RB, MYO5A, PLD2, PLD3, MAVS, FPR1, FPR2, ICOSLG, CD44, FRK, CD55, H3C10, PSAP, ZBTB16, ECSIT, NOD2, LILRA2, PIK3R1, ACTB, CRCP, ACTG1, TSPAN14, ASB6, MIB2, MICA, GPI, MICB, CREB1, ULBP3, C5AR2, SEC24D, APP, TNFRSF13C, VAMP3, VAMP8, AKT2, RAB14, SEC61A1, KCTD7, H3C14, H3C15, H3C2, H3C3, H3C4, IL1B, FSCN1, EDARADD, MBL2, KBTBD6, RAB27A, KCMF1, RAB31, IFITM3, ORAI2, TRAF3, ALDOA, ALDOC, PAG1, UNC13D, MIF, ADAM17, TRAF6, TRAF7, TOLLIP, DOK3, AREL1, ARF1, IL20RB, PPIA, IL21R, RHOA, RHOF, PAK1, PAK2, RAB5C, IL23R, IFNAR2, CYBA, DEFB105A, DEFB105B, OSCAR, PSMB2, PSMB5, PITPNA, LMNB1, TOM1, VAT1, VAV2, VAV3, OSMR, VCAM1, OSTF1, FANCA, SYK, CRISPLD2, CRK, PSMB9, VCL, PDXK, EEF2, SIGLEC12, MTAP, ZNRF1, ZNRF2, IFNLR1, PSMC4, ALOX15, RICTOR, PSMD1, PSMD10, PSMD11, IL36B, NF2, NFASC, NFATC3, ATP6V0D2, SIGLEC9, LIMK1, TGFB1, DEGS1, UNC93B1, TRAT1, ATP6V1B2, ATP6V1E1, SMURF2, IL5RA, IL6, IL6R, FANCM, RAC1, FYN, PSME3, CYLD, SIKE1, SIPA1, WASF2, FZR1, PEDS1-UBE2V1, MCL1, ATP7A, IL7R, SERPINA1, SIRPA, GRAP2, NPEPPS, GRB2, ILF3, NANOG, PSMF1, LNPEP, CLU, LONRF1, PTAFR, CALM3, CALR, RAET1E, CDK1, TUBA1B, TUBB, SYNGR1, TUBB2A, CMTM6, CAMK2A, CRKL, PTEN, LPCAT1, KIF2C, KIF3A, KIF3B, SNRPA1, LAMA5, KIF5B, PTGES2, HPSE, CANT1, SAA1, HRAS, PTGS2, ARIH2, CCL22, HRNR, FBXL13, FBXL16, FBXL18, FBXL19, EIF2AK2, CDKN1A, CDKN1B, MRE11, VASP, SEC24A, ELK1, RAB5B, RAB10, CSK, C6, NHLRC3",https://pathcards.genecards.org/card/innate_immune_system
166.10,Gene Expression (Transcription),1543,428,"NPM1, CARM1, NUDT21, THRA, ZNF154, ZNF155, AXIN1, POLR1A, DR1, THRB, ZNF680, ZNF681, ZNF682, ZNF689, ZNF699, ZNF70, ZNF701, MCRS1, POLR1E, CNOT6L, ZNF554, ZNF555, ZNF556, ZNF561, ZNF562, ZNF566, EIF4A3, NUP153, NUP155, ZNF703, ZNF704, NUP205, ZNF708, ZNF710, RAN, PTPN1, PTPN11, RANBP2, POLR1G, TXNIP, TOP3A, BRCA1, NUP42, NUP43, NUP50, MYBL2, NUP62, BRD7, AFF4, INTS11, DICER1, CCNA2, POLR2A, CCNB1, POLR2E, CCND1, CCND2, POLR2F, CEBPB, ZNF257, GATAD2A, VEGFA, NUP85, NUP93, NUP98, TSC1, INTS3, MDM2, MDM4, SP1, MEAF6, MYC, BRIP1, INTS7, POLR3A, ZNF264, ZNF267, ZNF268, ZNF28, TIGAR, MAPK1, NKX2-5, BRPF1, SESN2, SESN3, GLI2, SETD1A, MED12, ZNF385A, NCOR1, ZNF394, EZH2, HSP90AA1, KLF4, MED17, U2AF2, GTF3C4, SATB2, GCK, RARA, POLR3D, POLR3E, POLR3F, ELL2, PHAX, GTF3C6, SETD9, BTG1, BTG2, UBA52, ZNF573, COL1A1, COL1A2, ZNF583, ZNF584, ZNF585B, ZNF587, ZNF589, ZNF600, NR1D2, HCFC1, TAF11, SF3B1, MED23, MED24, CSTF1, CSTF2, TAF15, SOD2, SPI1, POLR3K, POM121, SFN, CCNT1, DNA2, PHC2, ZNF282, ZNF285, MAPK14, UBC, CAVIN1, TP53, NR2F6, NR3C1, NDRG1, AGO1, AGO2, MED26, AGO3, ZNF607, ZNF610, ZNF614, ZNF619, KMT2A, ZNF626, KMT2B, KMT2C, KMT2D, ABL1, KMT5A, TBL1XR1, MED7, TAF8, PHF19, CBX5, CBX8, RBBP4, ZNF417, ZNF419, OCLN, EP300, ZFHX3, ZFP14, CTDP1, MAPKAPK5, SGK1, GEM, NRBP1, ITGAL, FKBP5, BANP, RBL1, HIVEP3, CHD4, HDAC7, ZFP30, APAF1, ZNF737, ZNF74, ZNF740, ZNF747, BAZ2A, BBC3, ZFP37, ZNF641, ZNF655, SCO1, COX18, COX19, CTNNB1, MET, UBTF, YBX1, PRDM1, ZNF426, ZFP69B, ZNF43, ZNF430, ZNF431, ZNF432, ZNF436, ZNF439, YES1, TNRC6A, TNRC6B, TNRC6C, COX6B1, TRIM28, RELA, H2AC14, SUMO1, TAL1, H2AC18, H2AC19, H2AC20, REST, SLC38A9, TCF3, H2AC7, H2AC8, RBPJ, H2AX, MYL9, H2BC1, HUS1, JARID2, YWHAE, YWHAG, H2BC11, H2BC12, H2BC13, E2F1, E2F4, TP73, H2BC17, H2BC21, BCL2L11, ATM, ZNF175, RRAGC, RRAGD, YWHAZ, YY1, H2BC26, H2BC3, H2BC5, CPSF7, SUZ12, ZNF749, ZNF764, ZNF770, E2F6, E2F8, H2BC9, RFC2, ZIK1, RFFL, JUNB, RNPS1, TNFRSF10A, TDRKH, MAX, RRM2, DDX39B, ZKSCAN1, BDP1, ZKSCAN4, ZNF445, ZNF446, TEAD1, ZNF772, ZNF785, TNFRSF10B, ZNF790, TNFRSF10D, H3C10, ZNF799, ATP1B4, PABPN1, ACTB, CRCP, SMARCC2, GPI, CREB1, DNMT1, ZNF333, AKT2, ZNF33A, ZNF34, SRF, H3C14, H3C15, H3C2, H3C3, H3C4, AR, PAF1, PPARA, PPARD, RPRD2, PAGR1, PIP4K2B, ZNF200, ZNF660, PIP4K2C, ZNF665, ZNF669, SRSF2, SRSF6, SRSF7, ZNF677, ZNF460, ZNF471, ZNF347, ZNF350, SRSF9, PSMB2, PSMB5, PRMT5, CYCS, ZNF99, PSMB9, ZNF208, ZNF212, TFAM, MTA3, ZC3H11A, CDC73, PSMC4, RUNX2, PAPOLA, TFAP2A, TFAP2B, TFAP2C, FURIN, RICTOR, PSMD1, PSMD10, PSMD11, SSU72, ZNF486, ZNF496, ZNF500, ZNF101, GPRIN1, NFIB, TGFA, TGFB1, DEK, SMURF2, RUNX3, IL6, NFIC, NFIX, KCNIP3, ESRRB, ESRRG, RXRA, ZNF37A, RXRB, ZNF383, FYTTD1, PSME3, FAS, FZR1, MTF2, PARP1, G6PC1, G6PD, BMI1, BMP2, SNAPC3, VDR, THBS1, PPM1D, PSMF1, ZNF124, ZNF138, ZNF141, RPA1, RAD51, CALM3, ATXN3, ZNF519, CDK1, ZNF543, H4C15, ZSCAN25, CAMK2A, SKI, PTEN, GRIN2A, MLLT1, ANG, NFYA, CDK2, DGCR8, H4C8, SNRPB, CDK4, SNRPD3, SNRPG, PAX5, DYRK2, CDK6, GSR, CDKN1A, CDKN1B, CDKN2A, NCBP2, MRE11, MTA1, CBX6, ZNF517, MBD3, ZNF100, EAF1, ZNF485",https://pathcards.genecards.org/card/gene_expression_(transcription)
166.10,Regulation of Activated PAK-2p34 By Proteasome Mediated Degradation,943,253,"CANX, EIF2S3, PTK6, ABCA12, ABCA2, AXIN1, TNFSF14, TNFSF15, TXK, LAT2, CDT1, MAP2K7, MCRS1, INO80D, INO80E, ABCB5, ABCB7, ABCC1, ADRM1, EIF4G1, ABCC5, STIM1, TAB2, PFN1, ABCC6, WEE1, CCNA2, CCNB1, CCND1, ABCD2, VEGFA, TACC3, ABCF1, MDM2, MDM4, MYC, ABCG8, MAPK1, CASP8, SET, GLI2, PTPN6, ZNF385A, HSP90AA1, HSP90AB1, HSP90B1, SATB2, UBA1, ARRB1, ARRB2, CDC25B, HSPA2, HSPA4, DLL4, ANP32A, UBA52, HSPA8, COL1A1, HSPA9, BTRC, HCFC1, RASA4, DAB2IP, OAZ1, TLE3, PTTG1, DNA2, BUB3, MAPK14, UBC, UBE2G1, TP53, NR3C1, AGO1, AGO2, AGO3, ABL1, MAPK6, UBE2V1, RBBP4, AP2M1, AP2S1, HIF1AN, EP300, ZFHX3, MAPKAPK2, MAPKAPK5, FKBP1A, NRAS, GNB4, ITGAL, BAP1, HIVEP3, ZFP36, CTNNB1, XIAP, RNF146, APC, DCP1A, DCP2, DVL3, SPOPL, ASXL2, APH1A, RNF185, P4HB, SPRED1, HLA-A, HLA-B, YES1, H2AC1, H2AC11, H2AC12, TNRC6A, TNRC6B, TNRC6C, SPRED3, RELA, H2AC13, H2AC14, LYN, H2AC18, H2AC19, H2AC20, H2AC7, H2AC8, RBPJ, H2AX, BCL10, E2F1, E2F4, BCL2L11, ATM, GINS2, GINS3, YWHAZ, YY1, IKBKG, PLCG2, CD3E, CD4, RFC2, FOXK1, PIK3CD, MAX, FRAT2, TEAD1, PRICKLE1, PRIM1, PRIM2, FRK, MBD5, PIK3R1, ACTB, PSENEN, SMC1A, TNFRSF13C, AKT2, PDE6A, SEC61A1, PLK1, SRM, EDARADD, OPA1, AR, ORAI2, ORC1, TRAF3, ADAM17, CDC14B, TRAF6, ORC4, ORC6, CKS1B, PPIA, RHOA, PAK1, PAK2, GPR161, PSMB2, PSMB5, VAV2, VAV3, CDC45, SYK, PSMB9, HNRNPD, CDC73, PSMC4, RUNX2, SENP8, PSMD1, PSMD10, PSMD11, NFATC3, TGFB1, IGF2BP1, SEPTIN5, SMURF2, RUNX3, AMD1, TGFBR1, TGFBR2, RAC1, FYN, PSME3, LIN52, FZD6, FZD7, FZR1, PEDS1-UBE2V1, PARK7, LIN9, BMP2, GRAP2, KHSRP, GRB2, RAC3, PPM1D, PSMF1, ATXN1, NLK, MCM4, MCM5, MCM7, RPA1, LIMD1, CALM3, EVC, CALR, ATXN2, MCM8, ATXN3, CDK1, TUBA1B, TUBB, TUBB2A, CAMK2A, PTEN, TUBGCP2, GRK2, KIF3A, CDK2, CDK4, INO80, EXOSC2, POLD3, HRAS, EXOSC6, FBXL18, CDKN1A, CDKN1B, CDKN2A",https://pathcards.genecards.org/card/regulation_of_activated_pak-2p34_by_proteasome_mediated_degradation
166.10,Cellular Responses to Stimuli,819,237,"RPS19, MAP2K3, RPL12, EIF2S3, CAPZA2, PTK6, RAI1, MUL1, NPLOC4, CARM1, EXTL3, MAP2K7, HDGF, HSBP1, PPP1R15A, ABCC1, NUP153, NUP155, NUP205, RANBP2, TXNIP, BRCA1, NUP42, NUP43, NUP50, NUP62, MAP3K5, RPL13A, CCNA2, CEBPB, RPL14, VEGFA, NUP85, NUP93, NUP98, MDM2, MDM4, ABCF2, SP1, MYC, TXNRD2, ABCG2, MAPK1, SESN2, NCOR1, EZH2, HSP90AA1, RPL18A, RPS27, HSP90AB1, HSP90B1, STOML2, GCLM, CASTOR2, SLC7A11, HSPA2, HSPA4, UBA52, HSPA4L, HSPA8, HSPA9, BTRC, SOD2, POM121, RPL22, TLN1, PHC2, RPS28, MAPK14, UBC, RPL36, CHAC1, TP53, NR3C1, BAG1, BAG4, BAG5, AGO1, AGO3, TBL1XR1, RPL37, CBX8, RBBP4, HIF1AN, EP300, EP400, CCAR2, RPL27, MAPKAPK2, MAPKAPK5, FKBP14, FKBP5, RPL41, XBP1, RPL28, RPS4X, SCO1, COX18, COX19, RPS6, RPS6KA1, DCP2, RPL30, H1-1, RPS6KA3, H1-2, H1-4, DCTN3, DCTN4, DCTN5, DCTN6, P4HB, DYNC1LI2, TNRC6A, TNRC6B, TNRC6C, COX6B1, RPL7A, RELA, H2AC14, DYNLL2, YME1L1, H2AC18, H2AC19, H2AC20, SLC38A9, H2AC7, HM13, H2AC8, PRDX3, H2AX, H2BC1, HMGA1, HMGA2, RPL34, DNAJB6, DNAJB9, YWHAE, PRDX6, H2BC11, H2BC12, H2BC13, E2F1, E2F2, E2F3, H2BC17, H2BC21, BCL2L1, ATM, RRAGC, RRAGD, H2BC26, H2BC3, H2BC5, SUZ12, MT1A, H2BC9, RPL8, RPL9, H3-4, MAFK, H3C10, AKT1S1, CREB1, CREB3L2, ERN1, RPLP1, AKT2, H3C14, H3C15, H3C2, H3C3, H3C4, CREBRF, AR, TERF2, TSPYL2, PPARA, KDM6B, MINK1, CABIN1, CYBA, PSMB2, PSMB5, LMNB1, CYCS, PSMB9, PSMC4, RPS12, PSMD1, PSMD10, PSMD11, TPP1, SSR1, CRTC3, ATP6V0D2, ATP6V1B2, ATP6V1E1, IL6, RXRA, SLC46A1, PSME3, FZR1, ATP7A, G6PD, BMI1, RPS16, KHSRP, RPS17, CLOCK, PSMF1, ADD1, RPA1, IMPACT, LIMD1, CALR, TUBA1B, TUBB2A, H4C15, CAMK2A, DPP3, NFYA, CDK2, H4C8, CDK4, EXOSC2, MAP1LC3B, EXOSC6, CDK6, GSR, CDKN1A, CDKN1B, CDKN2A, MRE11, CBX6, MEF2D, CCS",https://pathcards.genecards.org/card/cellular_responses_to_stimuli
166.10,"Cell Cycle, Mitotic",691,191,"PTK6, NPM1, ANKRD28, CDT1, NUP153, NUP155, NUP205, HAUS2, HAUS3, RAN, RANBP2, TOP3A, BRCA1, NUP42, NUP43, NUP50, MYBL2, NUP62, HAUS5, HAUS6, WEE1, CCNA2, POLR2A, CCNB1, POLR2E, CCND1, CCND2, POLR2F, NUP85, NUP93, NUP98, MDM2, MDM4, CSNK1E, RANGAP1, MYC, BRIP1, MAPK1, SET, SPC24, ZNF385A, PPP2R2A, HSP90AA1, RPS27, HSP90AB1, CENPI, ARPP19, CDC25B, HSPA2, UBA52, CENPM, CENPN, CENPO, DSN1, BTRC, TK1, BUB1, POM121, TMPO, SFN, PTTG1, DNA2, BUB3, UBC, NDE1, NDEL1, TP53, ENSA, ABL1, KMT5A, RBBP4, CC2D1B, KNL1, EP300, CTC1, KPNB1, CTDNEP1, SGO1, PHLDA1, RBL1, RNF168, PIAS4, HJURP, DCTN3, DYNC1LI2, OIP5, NSD2, H2AC14, SUMO1, DYNLL2, LYN, H2AC18, H2AC19, H2AC20, GORASP2, H2AC7, H2AC8, H2AX, H2BC1, HUS1, YWHAE, YWHAG, H2BC11, H2BC12, H2BC13, E2F1, E2F2, E2F3, E2F4, H2BC17, H2BC21, ATM, GINS2, GINS3, CHTF8, YWHAZ, H2BC26, H2BC3, H2BC5, E2F6, H2BC9, RFC2, FOXM1, ERCC6L, H3-4, MAX, RRM2, TAOK1, PRIM1, PRIM2, H3C10, SMC1A, AKT2, H3C14, H3C15, H3C2, H3C3, H3C4, SPAST, PLK1, RAB2A, NEK6, NEK9, TERF2, ORC1, OPTN, ORC4, ORC6, CKS1B, CLASP1, PSMB2, PSMB5, LMNB1, CDC45, PSMB9, PSMC4, PSMD1, PSMD10, PSMD11, PSME3, LIN52, FZR1, LIN9, PSMF1, MCM4, MCM5, MCM7, RPA1, RAD51, MCM8, CDK1, TUBA1B, TUBB, TUBB2A, H4C15, TUBGCP2, KIF2C, CDK2, H4C8, CDK4, POLD3, FBXL18, CDK6, NCAPD3, NCAPG, NCAPG2, CDKN1A, CDKN1B, CDKN2A, MRE11, RAB1B",https://pathcards.genecards.org/card/cell_cycle_mitotic
166.10,RNA Polymerase I Promoter Opening,555,167,"CAPNS1, CARM1, POLR1A, DR1, MCRS1, WDR77, PPP1R14A, POLR1E, CNOT6L, EIF4A2, EIF4A3, EIF4E, POLR1G, EIF4G1, DICER1, POLR2A, CCNB1, POLR2E, CCND1, POLR2F, CEBPB, GATAD2A, MYC, CASP8, SET, SETD1A, NCOR1, EZH2, RARA, CDC25B, UBA52, MYH11, HCFC1, SF3B1, TLE3, KLK2, SOD2, SPI1, SFN, UBC, CAVIN1, TP53, AGO1, AGO2, AGO3, KMT2A, KMT2B, KMT2C, KMT2D, KMT5A, TBL1XR1, PHF19, CBX5, RBBP4, EP300, KPNB1, HSPG2, CHD4, BAZ2A, ITM2B, CTNNB1, MYH9, PIAS2, APH1A, UBTF, H2AC1, H2AC11, H2AC12, TNRC6A, TNRC6B, TNRC6C, PYGO2, H2AC13, H2AC14, TAL1, H2AC18, H2AC19, H2AC20, REST, H2AC7, H2AC8, H2AX, MYL9, H2BC1, LYZ, JARID2, YWHAE, YWHAG, H2BC11, H2BC12, H2BC13, E2F1, H2BC17, H2BC21, BCL2L11, YWHAZ, YY1, H2BC26, H2BC3, H2BC5, BCL9L, SUZ12, H2BC9, H3-4, PRIM1, PRIM2, H3C10, PABPN1, ACTB, PSENEN, TSPAN14, TSPAN15, SMARCC2, CREB1, DNMT1, APP, H3C14, H3C15, H3C2, H3C3, H3C4, PLK1, KDM2A, AR, ORC1, KDM2B, KDM5A, KDM5C, PAGR1, KDM6B, ORC4, ORC6, RHOA, RHOB, RHOC, PAK1, PRMT5, LMNB1, MTA3, CDC73, FURIN, DEK, RUNX3, IL6R, TGFBI, HOXB3, RXRA, RAC1, MTF2, THBS1, CDK1, H4C15, HOXC4, HOXD3, CDK2, H4C8, CDK4, SAA1, ARID5B, PAX6, NCAPD3, NCAPG2, CDKN1A, CDKN2A, MTA1, MBD3, GGA1",https://pathcards.genecards.org/card/rna_polymerase_i_promoter_opening
53.00,Cellular Senescence,195,80,"MAP2K3, MAP2K7, MAP3K5, CCNA2, CEBPB, MDM2, MDM4, SP1, MAPK1, EZH2, UBA52, PHC2, MAPK14, UBC, TP53, AGO1, AGO3, CBX8, RBBP4, EP400, MAPKAPK2, MAPKAPK5, RPS6KA1, H1-1, RPS6KA3, H1-2, H1-4, TNRC6A, TNRC6B, TNRC6C, RELA, H2AC14, H2AC18, H2AC19, H2AC20, H2AC7, H2AC8, H2AX, H2BC1, HMGA1, HMGA2, H2BC11, H2BC12, H2BC13, E2F1, E2F2, E2F3, H2BC17, H2BC21, ATM, H2BC26, H2BC3, H2BC5, SUZ12, H2BC9, H3-4, H3C10, H3C14, H3C15, H3C2, H3C3, H3C4, TERF2, KDM6B, MINK1, CABIN1, LMNB1, IL6, FZR1, BMI1, H4C15, CDK2, H4C8, CDK4, CDK6, CDKN1A, CDKN1B, CDKN2A, MRE11, CBX6",https://pathcards.genecards.org/card/cellular_senescence
50.42,Signaling By Rho GTPases,722,189,"NHS, NCKAP1, NCKIPSD, EMC3, WDR81, PPP1R14A, DLC1, RANBP2, TXNL1, NUP43, TMEM59, PFN1, WDR91, PFN2, DIAPH1, FERMT2, NUP85, NUP98, ARPC2, RANGAP1, TOR1AIP1, RAPGEF1, MAPK1, KLC2, SPC24, HSP90AA1, RPS27, HSP90AB1, CFL1, ARPC3, CENPI, CENPM, CENPN, CENPO, SLC1A5, MYH11, DSN1, SCAI, VIM, SPEN, BUB1, KLK2, WIPF2, TMOD3, TMPO, SFN, HGS, BUB3, MAPK14, NDE1, NDEL1, CAVIN1, ABI2, ABL1, ABL2, DBN1, CCT6A, BAIAP2L1, KNL1, CEP97, OCRL, SGO1, SOS2, SOWAHC, FLOT1, CTNNB1, MYH9, GOLGA3, DVL3, EPHA2, FMNL3, SLITRK5, RNF20, LETM1, DYNC1LI2, CTTN, SH3BP1, H2AC14, NSFL1C, DYNLL2, YKT6, H2AC18, H2AC19, H2AC20, CPD, H2AC7, H2AC8, H2AX, MYL9, MYLK, H2BC1, SH3PXD2A, SH3RF1, YWHAE, YWHAG, H2BC11, H2BC12, H2BC13, H2BC17, H2BC21, YWHAZ, H2BC26, H2BC3, H2BC5, CPSF7, GIT1, TNFAIP1, H2BC9, ERCC6L, PLD2, DDX39B, TAOK1, TRIP10, H3C10, MYO6, PIK3R1, PLEKHG2, PLEKHG3, PLEKHG4B, ACTB, PLEKHG5, ACTG1, SWAP70, DNMBP, VAMP3, SRF, SRGAP1, H3C14, H3C15, H3C2, H3C3, H3C4, PLIN3, PLK1, SHMT2, AR, CKB, NET1, DOCK7, CLASP1, RHOA, RHOB, RHOBTB3, RHOC, RHOF, PAK1, PAK2, CYBA, CDC37, PLXNA1, LMNB1, VAV2, VAV3, PLXND1, TPM3, RAB9A, NF2, LIMK1, GPS1, TFRC, ARHGAP11A, EFHD2, ARHGAP17, ARHGAP18, RAC1, ARHGAP26, ARHGAP31, ARHGAP39, WASF2, PARD6B, GRB2, ARHGAP42, RAC3, ARHGDIA, CALM3, ARHGEF18, ARHGEF2, TUBA1B, TUBB2A, ARHGEF39, H4C15, KIF2C, H4C8, STARD13, KIF5B, ANKFY1, CDKN1B, PAK4, CSK",https://pathcards.genecards.org/card/signaling_by_rho_gtpases
